item_id,item_name,store_id,store_name,original_price,price,category,stock_0930,stock_1630,stock_2030,change_1,change_2,change_3
68213c05b14699806189b2b0,Wildrose Herbal D-TOX Kit 12day Program,67ffcc6581edee2219c54e94,Unknown,64.99,54.99,Health & Wellness,9,,,,,
682bbc06c8802244e1542253,Banat Toothbrush Pack Of 2,67ffcc6581edee2219c54e94,Unknown,4.99,2.99,Grocery,6,,,,,
682bbe4326bdd6612a51d31e,Auroshikha 18 Fragrance (Mini Palette),67ffcc6581edee2219c54e94,Unknown,10.99,4.99,Grocery,4,,,,,
682bbf183e6e6efab73a3fb7,Meditation Incense Cones,67ffcc6581edee2219c54e94,Unknown,12.99,6.99,Grocery,8,,,,,
6850875cf14056777f0acbd8,Desert Essence Red Raspberry Shampoo 237ml,67ffcc6581edee2219c54e94,Unknown,15.99,7.99,Grocery,2,,,,,
6869b846e76ab7f39234f42b,Sour Strips Green Apple,685f076cae659ef8e57956fc,Unknown,8.99,7.99,Snacks & Drinks,3,,,,,
6869b8b6e76ab7f3923502a3,Sour Strips Strawberry,685f076cae659ef8e57956fc,Unknown,8.99,7.99,Snacks & Drinks,4,,,,,
6869b96c26c9413d166fc310,Sour Strips Watermelon,685f076cae659ef8e57956fc,Unknown,8.99,7.99,Snacks & Drinks,1,,,,,
6869b9bdd45286d9ce5ea147,Sour Strips Tropical Mango,685f076cae659ef8e57956fc,Unknown,8.99,7.99,Snacks & Drinks,1,,,,,
6869ba9ee76ab7f392353a9d,Sour Strips Pink Lemonade,685f076cae659ef8e57956fc,Unknown,8.99,7.99,Snacks & Drinks,5,,,,,
6869bae4d45286d9ce5ec328,Sour Strips Wild Cherry,685f076cae659ef8e57956fc,Unknown,8.99,7.99,Snacks & Drinks,3,,,,,
686af3f226c9413d168f16fa,Pringles Original Party Pack,685f076cae659ef8e57956fc,Unknown,5.99,5.5,Snacks & Drinks,4,,,,,
68a523bee4d63010325aea25,Herbafresh Dead Sea Bath Salt 500g,67ffcc6581edee2219c54e94,Unknown,8.99,3.99,Grocery,15,,,,,
68bc5e026e06f3f1d9451757,L'Oreal Paris Feria Smokey Silver S1 Silver Grey Permanent Hair Dye Kit (1 ct),65e8f30bcb43951cbd853f59,Unknown,21.29,10.65,Beauty,1,,,,,
691f6eb770ccf1c96852c9f3,Coconut Cashews,691b59a5669ef62168a65bdb,Unknown,3.5,2.0,Nuts & Snacks,20,,,,,
691f6f952363bcbd857e1d3e,Milk Choco Covered Salted Caramel Peanuts,691b59a5669ef62168a65bdb,Unknown,4.5,3.5,Nuts & Snacks,13,,,,,
692b87b2ddfa836f5a2ef579,CanadaDry Tonic Water,65e8f30bcb43951cbd853f59,Unknown,2.0,1.0,Drinks,2,,,,,
692e5b5c7aaefcde17875128,Everland Himalayan Crystal Salt 500g,67ffcc6581edee2219c54e94,Unknown,5.99,2.99,Grocery,5,,,,,
695807500c79613ef47ed200,Pretzel Pzazz Sour Cream & Chive,685f076cae659ef8e57956fc,Unknown,4.49,3.49,Snacks & Drinks,2,,,,,
695807dba1132e12bc69c1a4,Haribo Peaches,685f076cae659ef8e57956fc,Unknown,4.79,4.19,Snacks & Drinks,6,,,,,
69580a580c79613ef47f3b0e,Arizona Fruit Snacks,685f076cae659ef8e57956fc,Unknown,5.79,4.29,Snacks & Drinks,4,,,,,
69714698a0eb91f622f82d6c,Whisky Kiss Almonds,691b59a5669ef62168a65bdb,Unknown,3.5,2.0,Nuts & Snacks,34,,,,,
697146fbe2f09d0b9327b973,Salted Caramel Cashew,691b59a5669ef62168a65bdb,Unknown,3.5,2.0,Nuts & Snacks,22,,,,,
6971473140e632216a673804,Butter Toffee Almonds,691b59a5669ef62168a65bdb,Unknown,3.5,2.0,Nuts & Snacks,18,,,,,
6971479b40e632216a6747a2,Durian Choco Dipped Almonds,691b59a5669ef62168a65bdb,Unknown,4.5,3.5,Nuts & Snacks,16,,,,,
697147e9077af9138bbd2b71,Strawberry Choco Dipped Almonds,691b59a5669ef62168a65bdb,Unknown,4.5,3.5,Nuts & Snacks,11,,,,,
6971481f077af9138bbd30d3,Matcha Choco Dipped Almonds,691b59a5669ef62168a65bdb,Unknown,4.5,3.5,Nuts & Snacks,8,,,,,
6971485c9f875680704e4823,Yogurt Almonds,691b59a5669ef62168a65bdb,Unknown,4.5,2.25,Nuts & Snacks,2,,,,,
697148999f875680704e521a,Choco Salted Caramel Cashews,691b59a5669ef62168a65bdb,Unknown,4.5,3.5,Nuts & Snacks,10,,,,,
6976ba764bb7d7af11f788f7,New World Almond Butter Crunchy Roasted 500g,67ffcc6581edee2219c54e94,Unknown,14.99,9.99,Grocery,42,,,,,
6976bb2dcf5c56b4f1144310,Bestropics Coconut Smoothie 355ml,67ffcc6581edee2219c54e94,Unknown,3.49,1.99,Beverages,49,,,,,
6976bbec7717e37fa681e259,Karma Sparkling Watermelon Hydration Drink 285ml,67ffcc6581edee2219c54e94,Unknown,3.99,1.99,Beverages,25,,,,,
6976bc9ccf5c56b4f114614f,Karma Sparkling Grape Hydration Drink 285ml,67ffcc6581edee2219c54e94,Unknown,3.99,1.99,Beverages,24,,,,,
6976bce23695546c5d4594c5,Karma Apple Soda 285ml,67ffcc6581edee2219c54e94,Unknown,3.99,1.99,Beverages,19,,,,,
6976bd304e0f1abfeaaeefcf,Karma Berry Soda 285ml,67ffcc6581edee2219c54e94,Unknown,3.99,1.99,Beverages,23,,,,,
6984d853e9a0a7e95dffd353,2 Pizza Dough FRESH,67e6b1577b5f59b1bba8c7c4,Unknown,12.0,4.99,Pizza Dough,7,,,,,
698a6de210bcc888935c3465,Dark Choco Gingers,691b59a5669ef62168a65bdb,Unknown,4.5,3.0,Nuts & Snacks,8,,,,,
698a6fc110bcc888935c6c25,Inshell Peanuts Salted,691b59a5669ef62168a65bdb,Unknown,4.0,1.75,Nuts & Snacks,6,,,,,
698f49f4b00680d6ddef4fed,marine box seaweed snacks,5ddef30c9af4e045c44b9d67,Unknown,7.99,3.99,Grocery,1,,,,,
698f97126b722fca3c676d2d,Clamato Extra Spicy Rimmer,65bd257956f2d4f45a3da0e2,Unknown,4.99,2.49,Centre of Store,4,,,,,
698f973b6b722fca3c67762d,Clamato Chunky Pub Style Rimmer,65bd257956f2d4f45a3da0e2,Unknown,4.99,2.49,Centre of Store,5,,,,,
698f974aef2f3a8ea588e559,Clamato Rimmer,65bd257956f2d4f45a3da0e2,Unknown,4.99,2.49,Centre of Store,2,,,,,
698f97e11af04775da117eea,Single Strength Lime Juice,65bd257956f2d4f45a3da0e2,Unknown,2.99,1.49,Centre of Store,1,,,,,
6990a4dc23539fc0dede8364,Life Brand Extra Strength Ibuprofen,65e8f30bcb43951cbd853f59,Unknown,8.19,4.1,Medicine,1,,,,,
6990a5f7f3da2e15883cfdb8,Clearblue Digital & Visual Pregnancy Test Combo Pack (2 ct),65e8f30bcb43951cbd853f59,Unknown,24.99,24.99,Personal Care,1,,,,,
699917b48e5e05cc774e386f,Haldiram's Snacks Chatpata Dal (150 g),65e8f30bcb43951cbd853f59,Unknown,2.39,1.19,Snacks,1,,,,,
699ea7cc3523a0e94c0686cf,Kraft Creamy Poppy Seed Dressing (425 ml),65e8f30bcb43951cbd853f59,Unknown,4.49,2.24,Pantry,6,,,,,
69a00167bd948ea62253dbed,Derlea Foods Turmeric Puree (120 g),65e8f30bcb43951cbd853f59,Unknown,3.99,1.99,Pantry,3,,,,,
69a0804dda60c9dfbdad038a,Soft Drink Go Bananas,629cec56061cc278a85326dc,Unknown,1.0,0.5,Centre of Store,35,,,,,
69a149f994d00ccc15395367,Polysporin Original Antibiotic Cream (30 g),65e8f30bcb43951cbd853f59,Unknown,15.59,7.79,Medicine,3,,,,,
69a3ea74b21135ee52f66112,Foodaholic Nourishing Sepia Color Cream 1min 7N Natural Brown Hair Dye (60 g),65e8f30bcb43951cbd853f59,Unknown,7.99,3.99,Beauty,10,,,,,
69a540055c370550fff5135c,Children's Advil Fever & Pain Relief Fruit Flavour Oral Suspension Liquid (100 ml),67bdc806855e4112ad907797,Unknown,12.99,6.49,Medicine,4,,,,,
69a540a942f1b200d41fd142,"Alpo Cookout Classics Pork, Beef, Chicken, & Veggie Dog Food (7.2 kg)",67bdc806855e4112ad907797,Unknown,26.29,13.14,Pet Care,2,,,,,
69a540d5da92734cc0777901,Purina One +Plus Healthy Puppy Lamb Dry Puppy Food (6 kg),67bdc806855e4112ad907797,Unknown,39.49,19.74,Other,2,,,,,
69a54189b21135ee520f2b7b,Purina One Microbiome Balance Chicken & Rice Dry Dog Food (1.81 kg),67bdc806855e4112ad907797,Unknown,15.59,7.79,Pet Care,1,,,,,
69a541b85c370550fff51825,Beneful Originals Dry Dog Food with Real Chicken (7 kg),67bdc806855e4112ad907797,Unknown,33.29,16.64,Pet Care,1,,,,,
69a62a3da7c94f56e42f27af,Flexible Paper Straws 100 Pack,65bd257956f2d4f45a3da0e2,Unknown,3.0,1.5,Home & Entertainment,1,,,,,
69a68ffc6d87d0ba3f6110a8,Beneful Originals Dry Dog Food with Real Salmon (7 kg),67bdc806855e4112ad907797,Unknown,33.29,16.64,Pet Care,1,,,,,
69a6909b6d87d0ba3f6112e6,Whiskas Catmilk Cat Drink Treat (200 ml),67bdc806855e4112ad907797,Unknown,2.99,1.5,Pet Care,14,,,,,
69a691fdf9d8fe4c78fc5278,Durex Play 2-in-1 Guarana Massage Lubricant (200 ml),65e8f30bcb43951cbd853f59,Unknown,19.99,9.99,Personal Care,1,,,,,
69a692cb6623a9b168461131,Kraft Dinner Poutine Macaroni & Cheese Cup (58 g),67bdc806855e4112ad907797,Unknown,2.79,1.39,Pantry,1,,,,,
69a6938f20ac153a0fa83f5b,Children's Motrin Fever Relief Grape Oral Suspension (120 ml),67bdc806855e4112ad907797,Unknown,11.99,5.99,Medicine,2,,,,,
69a6938ff9d8fe4c78fc5653,Vicks Early Defence Cold Virus Blocker Nasal Spray (15 ml),67bdc806855e4112ad907797,Unknown,17.99,8.99,Medicine,1,,,,,
69a6938ffcaf623e655380ba,Advil Junior Very Berry Chewable Tablets (40 ct),67bdc806855e4112ad907797,Unknown,19.29,9.64,Medicine,1,,,,,
69a7df063cb0c5aebafe72e1,Mama Sita's Annatto Powder (10 g),65e8f30bcb43951cbd853f59,Unknown,1.07,0.53,Pantry,35,,,,,
69a7e63d3cb0c5aebafe8fb5,Hubba Bubba Mixed Fruit Flavoured Bubble Gum Variety Pack (4 pk),67bdc806855e4112ad907797,Unknown,2.67,1.33,Candy,3,,,,,
69a7e63d8db9227a2f5afd30,Pedigree Vitality+ Hearty Beef & Vegetable Dry Dog Food (8 kg),67bdc806855e4112ad907797,Unknown,30.99,15.5,Pet Care,1,,,,,
69a7e63dfa487e269a865747,Mama Sita's Annatto Powder (10 g),67bdc806855e4112ad907797,Unknown,1.07,0.53,Pantry,42,,,,,
69a939e0c7d0f8576092699a,Taco Bell Hot Sauce (207 ml),65e8f30bcb43951cbd853f59,Unknown,3.27,1.63,Pantry,4,,,,,
69aa80bd7a386e0fe0821015,Kraft vinaigrette rancher's choice / Rancher's Choice Dressing (425 ml),65e8f30bcb43951cbd853f59,Unknown,4.29,2.14,Pantry,3,,,,,
69abdb3b65f21b711816e830,Paldo Seafood Noodle Soup Bowl (86 g),65e8f30bcb43951cbd853f59,Unknown,1.99,0.99,Pantry,3,,,,,
69ac4d813b6d48e5a4492e5f,"Planet First Wheat Stalk Straws, Compostable, 200 Straws",629cec56061cc278a85326dc,Unknown,6.0,3.0,Home & Entertainment,1,,,,,
69ad2a1b5e9c327ae55a8730,Tamam Pomegranate Juice Concentrate Molasses (300 ml),65e8f30bcb43951cbd853f59,Unknown,5.29,2.64,Pantry,8,,,,,
69ad2bf0729860da45abb1a2,Kraft Coleslaw Dressing (425 ml),65e8f30bcb43951cbd853f59,Unknown,4.29,2.14,Pantry,2,,,,,
69ae681c65f21b71184e7adc,IAMS Proactive Health Indoor Weight & Hairball Care Chicken & Turkey Dry Cat Food (3.18 kg),65e8f30bcb43951cbd853f59,Unknown,31.29,15.64,Pet Care,4,,,,,
69ae6937729860da45c550c6,Taco Bell Crunch Wrap Supreme Cravings Kit(642 g),65e8f30bcb43951cbd853f59,Unknown,9.29,4.64,Pantry,1,,,,,
69af44d57c68be5cd91749bc,Chili Lime Pistachios,691b59a5669ef62168a65bdb,Unknown,13.5,9.5,Nuts & Snacks,9,,,,,
69b0751f729860da45f2da99,Nut Mix,691b59a5669ef62168a65bdb,Unknown,3.5,1.25,Nuts & Snacks,4,,,,,
69b25ddb729860da45205cb1,Goldfish Frank's RedHot Crackers (180 g),67bdc806855e4112ad907797,Unknown,4.49,2.24,Snacks,3,,,,,
69b25e5c7c68be5cd95ac77f,Suraj Masala Noodles (75 g x 4 pk),65e8f30bcb43951cbd853f59,Unknown,1.69,0.84,Pantry,3,,,,,
69b3b7055e9c327ae5f1a6a2,Kraft Raspberry Vinaigrette Dressing (425 ml),67bdc806855e4112ad907797,Unknown,4.29,2.14,Pantry,15,,,,,
69b3b93e7c68be5cd9759e3b,Kraft Raspberry Vinaigrette Dressing (425 ml),65e8f30bcb43951cbd853f59,Unknown,4.29,2.14,Pantry,7,,,,,
69b7a40237728011b3e74e52,Taco Bell Creamy Baja Sauce (354 ml),67bdc806855e4112ad907797,Unknown,5.29,2.64,Pantry,7,,,,,
69b7a402861548711d4bd6cc,Kraft Asian Sesame Dressing (425 ml),67bdc806855e4112ad907797,Unknown,4.29,2.14,Pantry,1,,,,,
69b7a402861548711d4bd6d5,T&T 10 Multigrain Rice (1.5 kg),67bdc806855e4112ad907797,Unknown,12.49,6.24,Pantry,1,,,,,
69b7a403c0a1a71683b7f7cd,Cocon Mixed Fruit Pudding Cups (708 g),67bdc806855e4112ad907797,Unknown,6.79,3.39,Pantry,2,,,,,
69b7aa3b5e7581448b3663c2,Jack Link's Bouchées tendres de poulet aux jalapenos / Jalapeno Chicken Tender Bites (81 g),65e8f30bcb43951cbd853f59,Unknown,7.99,3.99,Snacks,1,,,,,
69b8ff29022e1e4fc9048c8d,Astro Snacks Freeze-Dried Nerds Very Berry Clusters Candy (30 g),67bdc806855e4112ad907797,Unknown,11.99,5.99,Candy,2,,,,,
69b8fff11e31b0b0389b0988,Maple Leaf Vienna Sausage (113 g),67bdc806855e4112ad907797,Unknown,2.49,1.24,Pantry,9,,,,,
69b90021022e1e4fc9048e01,Old El Paso Chili Seasoning Mix (24 g),67bdc806855e4112ad907797,Unknown,1.59,0.79,Pantry,14,,,,,
69b9036074af51da80cdb047,Heinz Smoky Bacon Mayonnaise Style Sauce (340 ml),65e8f30bcb43951cbd853f59,Unknown,4.99,2.49,Pantry,2,,,,,
69bb166bae3a93044ee51e5f,Whoppers Box 113g,69379713a3687e3a3db2d8bc,Unknown,3.99,1.99,Grocery,1,,,,,
69bb171cecf624e1ca77c0be,Fuze Ice Tea Lemon 500ml,69379713a3687e3a3db2d8bc,Unknown,3.8,1.9,Grocery,22,,,,,
69bb9a98ae3a93044eea8213,Dare Bear Paws Rainbow Chip Cookies (240 g),67bdc806855e4112ad907797,Unknown,4.49,2.24,Snacks,6,,,,,
69bceb0c7e7daae2e92172a0,Slim Jim Mild Snack Size Sticks (112 g),65e8f30bcb43951cbd853f59,Unknown,8.49,4.24,Snacks,4,,,,,
69bcebd224adbca86212d046,Crispy Pani Puri (200 g),65e8f30bcb43951cbd853f59,Unknown,5.29,2.64,Snacks,8,,,,,
69bcec0a7e7daae2e9217538,Bick's Squeeze Sweet Green Relish (500 ml),65e8f30bcb43951cbd853f59,Unknown,4.49,2.24,Pantry,2,,,,,
69bcec9324adbca86212d1e0,Pocky Chocolate Banana Biscuit Sticks (70 g),67bdc806855e4112ad907797,Unknown,3.59,1.79,Snacks,3,,,,,
69bcecc57e7daae2e9217784,Slim Jim Mild Snack Size Sticks (112 g),67bdc806855e4112ad907797,Unknown,8.29,4.14,Snacks,5,,,,,
69be3eac410610c12ccda189,Osem Bamba Peanut Butter Puffs (100 g),67bdc806855e4112ad907797,Unknown,3.99,1.99,Snacks,3,,,,,
69be41c5410610c12ccda997,Reese's Puffs Minis Cereal (331 g),65e8f30bcb43951cbd853f59,Unknown,4.59,2.29,Pantry,7,,,,,
69be41e4119b7dbd4fbf9f58,Osem Bamba Peanut Butter Puffs (100 g),65e8f30bcb43951cbd853f59,Unknown,3.99,1.99,Snacks,9,,,,,
69be423a1854d3fde924819f,Kraft Vinaigrette Ranch aux Trois Fromages / Three Cheese Ranch Dressing (425 ml),65e8f30bcb43951cbd853f59,Unknown,4.29,2.14,Pantry,8,,,,,
69bede6d1854d3fde92955dc,"Steamed Noodles, Thick",65a1a8282f4530e32514d6c3,Unknown,3.29,1.64,HMR,3,,,,,
69bf8c431854d3fde930a44c,Armstrong Old Light Cheddar Cheese Bar (600 g),65e8f30bcb43951cbd853f59,Unknown,12.99,6.49,Dairy & Eggs,1,,,,,
69bf8cb87e7daae2e93c1e30,Iogo Duo Vanilla Strawberry Creamy Yogurt (650 g),65e8f30bcb43951cbd853f59,Unknown,4.99,2.49,Dairy & Eggs,2,,,,,
69bf8df7119b7dbd4fcb834b,Humpty Dumpty Cheesy Party Mix (250 g),67bdc806855e4112ad907797,Unknown,4.99,2.49,Snacks,4,,,,,
69bf8df71854d3fde930a855,Knorr Microwave Spicy Korean BBQ Noodle Cup (73 g),67bdc806855e4112ad907797,Unknown,3.99,1.99,Pantry,5,,,,,
69bf8df724adbca8622d880d,Knorr Microwave Teriyaki Noodle Cup (73 g),67bdc806855e4112ad907797,Unknown,3.99,1.99,Pantry,1,,,,,
69bf8df7410610c12cda10c4,Reddi-Bulk Roasted Salted In-Shell Sunflower Seeds (150 g),67bdc806855e4112ad907797,Unknown,2.39,1.19,Snacks,1,,,,,
69bf8df77e7daae2e93c2191,Kicking Horse 3 Sisters Medium Roast K-Cup Coffee Pods (10 ct),67bdc806855e4112ad907797,Unknown,19.69,9.84,Pantry,2,,,,,
69bf9136119b7dbd4fcb8b53,Reddi-Bulk Roasted Salted In-Shell Sunflower Seeds (150 g),65e8f30bcb43951cbd853f59,Unknown,2.39,1.19,Snacks,15,,,,,
69bf91557e7daae2e93c2a52,Ben's Original Spicy Style Korean BBQ Rice (240 g),65e8f30bcb43951cbd853f59,Unknown,3.79,1.89,Pantry,9,,,,,
69bf9180410610c12cda1a48,Dare Real Fruit Sours Summerfruit Burst Plant-Based Gummies (350 g),65e8f30bcb43951cbd853f59,Unknown,5.39,2.69,Candy,1,,,,,
69bf919b410610c12cda1a6e,Sun Bum SPF 30 Premium Sunscreen Lotion (177 ml),65e8f30bcb43951cbd853f59,Unknown,24.59,12.29,Beauty,2,,,,,
69bf91b11854d3fde930b289,Knorr Microwave Spicy Korean BBQ Noodle Cup (73 g),65e8f30bcb43951cbd853f59,Unknown,3.99,1.99,Pantry,6,,,,,
69bf91da1854d3fde930b2cf,Knorr Microwave Teriyaki Noodle Cup (73 g),65e8f30bcb43951cbd853f59,Unknown,3.99,1.99,Pantry,8,,,,,
69bf931924adbca8622d95d9,Vicks VapoPads Menthol Refill Pads (10 ct),65e8f30bcb43951cbd853f59,Unknown,21.99,10.99,Medicine,2,,,,,
69c0dfd7aaa592b9fdacbbed,Kellogg's Original Squishmallows Cereal (269 g),65e8f30bcb43951cbd853f59,Unknown,6.39,3.19,Pantry,10,,,,,
69c0e1abb65b039ed7228120,Kashi Go Active Mixed Berry Crunch Cereal (501 g),65e8f30bcb43951cbd853f59,Unknown,9.29,4.64,Pantry,2,,,,,
69c0e1c6b65b039ed722816c,Ritz Original Mini Crackers (180 g),65e8f30bcb43951cbd853f59,Unknown,4.69,2.34,Snacks,1,,,,,
69c0e1dab65b039ed72281f0,Pocky Chocolate Biscuit Sticks (70 g),65e8f30bcb43951cbd853f59,Unknown,3.59,1.79,Snacks,1,,,,,
69c0e23caaa592b9fdacc2a2,Dairyland 18% Sour Cream (450 ml),65e8f30bcb43951cbd853f59,Unknown,5.29,2.64,Dairy & Eggs,4,,,,,
69c0e297b65b039ed72284f2,Ziggy's Smoked Kolbassa Sausage (375 g),65e8f30bcb43951cbd853f59,Unknown,8.79,4.39,Meat & Fish,8,,,,,
69c0e2a3fe1e2ec182b6b8b2,Dairyland 5% Sour Cream (500 ml),65e8f30bcb43951cbd853f59,Unknown,5.29,2.64,Dairy & Eggs,3,,,,,
69c0e8a10558ff0c85526fa9,Armstrong Old Light Cheddar Cheese Bar (600 g),67bdc806855e4112ad907797,Unknown,12.99,6.49,Dairy & Eggs,4,,,,,
69c0ebf90558ff0c85527624,Kicking Horse Kick Ass Dark Roast K-Cup Coffee Pods (10 ct),67bdc806855e4112ad907797,Unknown,19.69,9.84,Pantry,4,,,,,
69c0ebf90558ff0c8552763b,Kellogg's Original Squishmallows Cereal (269 g),67bdc806855e4112ad907797,Unknown,6.39,3.19,Pantry,6,,,,,
69c0ebf9b65b039ed72298b6,Starbucks Pike Place Medium Roast K-Cup Coffee Pods (10 ct),67bdc806855e4112ad907797,Unknown,15.99,7.99,Pantry,1,,,,,
69c1811f1f1341c77a1945a2,Mixed Produce Box #20,5d0bd76b8894a4ebbfd7048a,Unknown,5.0,5.0,Produce,1,,,,,
69c1863505d7190032c99803,FS TRADITIONAL HUMMUS,6969181f05a95a3633344338,Unknown,4.5,2.25,Deli,14,,,,,
69c18f514c009499a15cfd8d,Mixed Produce Box #30,5d0bd76b8894a4ebbfd7048a,Unknown,5.0,5.0,Produce,1,,,,,
69c1957bf76961da484b9ec1,Mixed Produce Box #104,5d0bd76c8894a4ebbfd704b8,Unknown,5.0,5.0,Produce,1,,,,,
69c1958ff76961da484ba339,Mixed Produce Box #105,5d0bd76c8894a4ebbfd704b8,Unknown,5.0,5.0,Produce,1,,,,,
69c19a2105d7190032ccae56,pork side rib portion,64a6b9d71e02c66732c06f33,Unknown,3.03,1.51,Meat,1,,,,,
69c1a3910558ff0c855b56bc,Pistachio 800g,691b59a5669ef62168a65bdb,Unknown,22.0,18.5,Nuts & Snacks,2,,,,,
69c1a41baaa592b9fdb50dcd,Fancy Nut Mix 908g,691b59a5669ef62168a65bdb,Unknown,23.0,15.0,Nuts & Snacks,4,,,,,
69c1a464b65b039ed72acd85,Select Nut Mix 908g,691b59a5669ef62168a65bdb,Unknown,16.0,8.0,Nuts & Snacks,4,,,,,
69c1c49e95e95b13ad83a01a,rooster Dark soy sauce,5ddef30c9af4e045c44b9d67,Unknown,6.99,3.0,Grocery,5,,,,,
69c22ffdb65b039ed7313783,Cadbury Dairy Milk Hazelnut Chocolate Bar (180 g),65e8f30bcb43951cbd853f59,Unknown,7.79,3.89,Candy,3,,,,,
69c23018aaa592b9fdbb8950,Nongshim Spicy & Creamy Toomba Stir-Fry Noodle (137 g x 4 ct),65e8f30bcb43951cbd853f59,Unknown,13.39,6.69,Pantry,2,,,,,
69c23059aaa592b9fdbb89ae,Powerade Fruit Punch Sports Drinks (591 ml x 6 ct),65e8f30bcb43951cbd853f59,Unknown,7.99,3.99,Drinks,4,,,,,
69c232dbe8e6f19bb3e13ebe,Ziggy's Extra Lean Cooked Turkey Breast (175 g),65e8f30bcb43951cbd853f59,Unknown,3.99,1.99,Meat & Fish,4,,,,,
69c23443b65b039ed73142e3,Farmer's Market Carrot Cake (875 g),65e8f30bcb43951cbd853f59,Unknown,13.89,6.94,Bakery,1,,,,,
69c2348caaa592b9fdbb948b,Dairyland 1% Milk Carton (2 L),65e8f30bcb43951cbd853f59,Unknown,4.99,2.49,Dairy & Eggs,2,,,,,
69c234a9e8e6f19bb3e144ef,Dairyland chocolate milk 946ml,65e8f30bcb43951cbd853f59,Unknown,4.29,2.14,Dairy & Eggs,9,,,,,
69c23a1e0558ff0c85626117,Dairyland Chocolate milk,67bdc806855e4112ad907797,Unknown,4.29,2.14,Dairy & Eggs,8,,,,,
69c23a1eaaa592b9fdbba0e2,Dairyland 33% Whipping Cream Carton (946 ml),67bdc806855e4112ad907797,Unknown,7.29,3.64,Dairy & Eggs,4,,,,,
69c23a1eb65b039ed73150b8,Tropicana Refreshers Watermelon Juice (1.36 L),67bdc806855e4112ad907797,Unknown,5.49,2.74,Drinks,2,,,,,
69c23a1eb65b039ed73150c4,Ziggy's Extra Lean Cooked Turkey Breast (175 g),67bdc806855e4112ad907797,Unknown,3.99,1.99,Meat & Fish,1,,,,,
69c23da2aaa592b9fdbba6b9,Daiya Dairy-Free Creamy Caesar Dressing (237 ml),67bdc806855e4112ad907797,Unknown,7.99,3.99,Pantry,1,,,,,
69c23da2aaa592b9fdbba6c6,Minute Maid No Sugar/Sweetener Added Watermelon Blueberry Juice (200 ml x 8 ct),67bdc806855e4112ad907797,Unknown,4.69,2.34,Drinks,1,,,,,
69c2afac208978ccefa493c5,PC ARTICHOKE & ASIAGO LARGE,629cec56061cc278a85326dc,Unknown,4.75,2.38,Deli,1,,,,,
69c2c8c2ca54120c7af20576,Mixed Produce Box #73,5d0bd76c8894a4ebbfd704b8,Unknown,5.0,5.0,Produce,1,,,,,
69c2d2031f1341c77a4055df,whipping cream,5ddef30c9af4e045c44b9d67,Unknown,4.9,2.45,Dairy,41,,,,,
69c2d523e8e6f19bb3e8063d,Sierra Mountain Mix 170g,691b59a5669ef62168a65bdb,Unknown,2.5,1.5,Nuts & Snacks,12,,,,,
69c2d5edaaa592b9fdc2a02b,Select Nut Mix Unsalted,691b59a5669ef62168a65bdb,Unknown,16.0,8.0,Nuts & Snacks,1,,,,,
69c2d89df39cdbac4517142e,PC SPINACH DIP LARGE,629cec56061cc278a85326dc,Unknown,4.75,2.38,Deli,18,,,,,
69c2d8bef39cdbac45171796,PC ARTICHOKE & ASIAGO LARGE,629cec56061cc278a85326dc,Unknown,4.75,2.38,Deli,26,,,,,
69c2ef05208978ccefaed9ab,Mixed Produce Box #9,6969181f05a95a3633344338,Unknown,5.0,5.0,Produce,1,,,,,
69c2f524aaa592b9fdc57b81,PC MILD ITALIAN PK SAUSG 500G,5fac3e04d7528a3c966b13a4,Unknown,8.0,4.0,Meat,1,,,,,
69c2f55eb65b039ed73b41df,BC SAUS PORK BREAKFAST,5fac3e04d7528a3c966b13a4,Unknown,10.0,5.0,Meat,1,,,,,
69c3072795e95b13adaa2d4e,dairyland skim milk,65a1a8282f4530e32514d6c3,Unknown,4.92,2.46,Dairy,3,,,,,
69c31fb5208978ccefb530b4,DAIRYLAND MILK 1%,65a1a8282f4530e32514d6c3,Unknown,5.73,2.87,Dairy,1,,,,,
69c37ee6e8e6f19bb3f24ea3,Suraj 2% Dahi Yogurt (750 g),65e8f30bcb43951cbd853f59,Unknown,2.89,1.44,Dairy & Eggs,4,,,,,
69c37f08fe1e2ec182d8405c,Summer Fresh Greek Pasta Feta Salad (300g),65e8f30bcb43951cbd853f59,Unknown,5.07,2.53,Easy Meals,6,,,,,
69c385b3aaa592b9fdccbf5e,Lucky Me! Kalamansi Pancit Canton Chow Mein Instant Noodles (60 g),65e8f30bcb43951cbd853f59,Unknown,0.89,0.44,Pantry,47,,,,,
69c385f6e8e6f19bb3f26303,Kari Kari Salt & Pepper Roasted Rice Cracker Peanut Mix (50 g),65e8f30bcb43951cbd853f59,Unknown,2.69,1.34,Snacks,2,,,,,
69c38604fe1e2ec182d852b8,Kraft Dinner Deluxe Shells with Velveeta Cheese Sauce (350 g),65e8f30bcb43951cbd853f59,Unknown,5.79,2.89,Pantry,3,,,,,
69c38ae4aaa592b9fdccc993,Charlotte's Mini Chocolate Peanut Butter Parfait (145 g),67bdc806855e4112ad907797,Unknown,3.49,1.74,Bakery,1,,,,,
69c38ae4b65b039ed742a345,Farmer's Market Strawberry Shortcake (755 g),67bdc806855e4112ad907797,Unknown,15.49,7.74,Bakery,2,,,,,
69c38ae4b65b039ed742a352,Farmer's Market Tiramisu Cake (675 g),67bdc806855e4112ad907797,Unknown,15.49,7.74,Bakery,1,,,,,
69c38ae4fe1e2ec182d85d4f,Renee's Balsamic Vinaigrette (350 ml),67bdc806855e4112ad907797,Unknown,7.99,3.99,Pantry,6,,,,,
69c38d700558ff0c85752ac3,Suraj Coconut Oil (500 ml),67bdc806855e4112ad907797,Unknown,6.89,3.44,Pantry,1,,,,,
69c38d70b65b039ed742a952,Farmer's Market Butter Tarts (765 g),67bdc806855e4112ad907797,Unknown,7.79,3.89,Bakery,1,,,,,
69c38d70e8e6f19bb3f2724f,Pocky Almond Crush Biscuit Sticks (41 g),67bdc806855e4112ad907797,Unknown,4.29,2.14,Snacks,5,,,,,
69c38d70fe1e2ec182d86274,Old Dutch Hot Buffalo Pretzel Pieces (240 g),67bdc806855e4112ad907797,Unknown,5.49,2.74,Snacks,4,,,,,
69c3b584ca54120c7a061ec6,Mixed Produce Box #135,5d0bd76b8894a4ebbfd7048a,Unknown,5.0,5.0,Produce,1,,,,,
69c3b5913fd7554482665d5d,Mixed Produce Box #139,5d0bd76b8894a4ebbfd7048a,Unknown,5.0,5.0,Produce,1,,,,,
69c3b5bbca54120c7a062309,Mixed Produce Box #122,5d0bd76b8894a4ebbfd7048a,Unknown,5.0,5.0,Produce,1,,,,,
69c3b62a8828bf1adf0c010e,Mixed Produce Box #123,5d0bd76b8894a4ebbfd7048a,Unknown,5.0,5.0,Produce,1,,,,,
69c3b64e1f1341c77a538284,Mixed Produce Box #47,5d0bd76b8894a4ebbfd7048a,Unknown,5.0,5.0,Produce,1,,,,,
69c3b65eca54120c7a062ce6,Mixed Produce Box #46,5d0bd76b8894a4ebbfd7048a,Unknown,5.0,5.0,Produce,1,,,,,
69c3b69b208978ccefbabdd1,Mixed Produce Box #144,5d0bd76b8894a4ebbfd7048a,Unknown,5.0,5.0,Produce,1,,,,,
69c3b9f795e95b13adb44061,Mixed Produce Box #102,5d0bd76b8894a4ebbfd7048a,Unknown,5.0,5.0,Produce,1,,,,,
69c3ba0517b5483314a7d125,Mixed Produce Box #103,5d0bd76b8894a4ebbfd7048a,Unknown,5.0,5.0,Produce,1,,,,,
69c3d8848828bf1adf109090,RIVIERA MANGO PASS VEGAN,5d0bd76b8894a4ebbfd7048a,Unknown,6.99,3.49,Natural Foods,5,,,,,
69c3d89e21ac653b85c34d74,DAIRYLAND MILK 1%MF ORGANIC,5d0bd76b8894a4ebbfd7048a,Unknown,7.29,3.64,Natural Foods,1,,,,,
69c3f3a62b6d2ad7b707dcc0,PF KOREAN PORK STRIPS FRZ,629cec56061cc278a85326dc,Unknown,10.0,5.0,Meat,5,,,,,
69c3fe272b6d2ad7b70a90b0,DELI WORLD BREAD WHITE RST STY,5d0bd76c8894a4ebbfd704b8,Unknown,4.79,2.39,Bakery,1,,,,,
69c3fe5661a0596c47a40ee8,NN BREAD BRIOCHE,5d0bd76c8894a4ebbfd704b8,Unknown,3.19,1.59,Bakery,7,,,,,
69c3fe662b6d2ad7b70a9df8,PIZZA DOUGH,5d0bd76c8894a4ebbfd704b8,Unknown,3.0,1.5,Bakery,1,,,,,
69c401c073b732e8fdeaca1b,PC LOADS GARLIC CAESR KIT 319G,5d0bd76b8894a4ebbfd7048a,Unknown,7.0,2.5,Produce,1,,,,,
69c402ac1f56a98113f0e877,FM ASSORTED SQUARES,6969181f05a95a3633344338,Unknown,11.0,5.5,Bakery,1,,,,,
69c402c62b6d2ad7b70b9165,MINI CINNAMON CROISSANT,6969181f05a95a3633344338,Unknown,6.0,3.0,Bakery,1,,,,,
69c402e961a0596c47a50bc6,"8"" PIE APPLE",6969181f05a95a3633344338,Unknown,6.0,3.0,Bakery,1,,,,,
69c402fd73b732e8fdeaf8e9,D'ITAL BAGELS SESAME,6969181f05a95a3633344338,Unknown,4.0,2.0,Bakery,2,,,,,
69c403210b593e3f6aea0d19,GALA MINI ANGEL FOOD CAKES,6969181f05a95a3633344338,Unknown,5.5,2.0,Bakery,1,,,,,
69c4034873b732e8fdeb08a8,PC ORIGINAL PIZZA CRUSTS,6969181f05a95a3633344338,Unknown,4.0,2.0,Bakery,1,,,,,
69c4035a62d9267f3cb5d921,PC GIGANTICO BUNS SAUSAGE,6969181f05a95a3633344338,Unknown,4.69,1.5,Bakery,1,,,,,
69c404b10b593e3f6aea4c70,PN CHICKEN DRUM FR,6969181f05a95a3633344338,Unknown,10.0,5.0,Meat,2,,,,,
69c404b861a0596c47a56e61,ACE CIABATTA LUNGA CLSTER PRBK,5d0bd76c8894a4ebbfd704b8,Unknown,3.75,1.87,Bakery,1,,,,,
69c4054ec06aaf868e551735,ACE BAGUETTE DEMI WHITE,5d0bd76c8894a4ebbfd704b8,Unknown,3.25,1.62,Bakery,1,,,,,
69c4055bc06aaf868e551acc,Ace Harvst Multigrain Baguette,5d0bd76c8894a4ebbfd704b8,Unknown,3.75,1.87,Bakery,1,,,,,
69c405a30b593e3f6aea7661,BAGUETTE WHEAT,5d0bd76c8894a4ebbfd704b8,Unknown,1.0,0.5,Bakery,1,,,,,
69c405a52b6d2ad7b70c4277,Ace Sesame baguette,5d0bd76c8894a4ebbfd704b8,Unknown,3.75,1.88,Bakery,1,,,,,
69c405d12b6d2ad7b70c4ad2,ITALIAN GARLIC BREAD,5d0bd76c8894a4ebbfd704b8,Unknown,3.0,1.5,Bakery,1,,,,,
69c405fa0b593e3f6aea8972,ATLANTIC SALMON PORTIONS,6969181f05a95a3633344338,Unknown,9.45,4.72,Seafood,4,,,,,
69c4062573b732e8fdeb94bf,BREAD CINNAMON RAISIN,5d0bd76c8894a4ebbfd704b8,Unknown,4.25,2.12,Bakery,1,,,,,
69c406512b6d2ad7b70c6917,MINI BAGEL PLAIN 8PK,5d0bd76c8894a4ebbfd704b8,Unknown,4.5,2.25,Bakery,2,,,,,
69c4066ec06aaf868e554eba,WHITE BREAD,5d0bd76c8894a4ebbfd704b8,Unknown,3.0,1.5,Bakery,2,,,,,
69c406840b593e3f6aeaa4e6,MINI CINNAMON RAISIN BAGEL 8PK,5d0bd76c8894a4ebbfd704b8,Unknown,4.5,2.25,Bakery,5,,,,,
69c407bf1f56a98113f1f870,SOCKEY SALMON FILLET,6969181f05a95a3633344338,Unknown,7.67,3.84,Seafood,7,,,,,
69c407e42b6d2ad7b70cb9e3,ATLANTIC SALMON STEAK,6969181f05a95a3633344338,Unknown,8.53,4.0,Seafood,6,,,,,
