item_id,item_name,store_id,store_name,original_price,price,category,stock_0930,stock_1630,stock_2030,change_1,change_2,change_3
68213c05b14699806189b2b0,Wildrose Herbal D-TOX Kit 12day Program,67ffcc6581edee2219c54e94,Unknown,64.99,54.99,Health & Wellness,9,,,,,
682bbc06c8802244e1542253,Banat Toothbrush Pack Of 2,67ffcc6581edee2219c54e94,Unknown,4.99,2.99,Grocery,6,,,,,
682bbf183e6e6efab73a3fb7,Meditation Incense Cones,67ffcc6581edee2219c54e94,Unknown,12.99,6.99,Grocery,8,,,,,
6869b846e76ab7f39234f42b,Sour Strips Green Apple,685f076cae659ef8e57956fc,Unknown,8.99,7.99,Snacks & Drinks,3,,,,,
6869b8b6e76ab7f3923502a3,Sour Strips Strawberry,685f076cae659ef8e57956fc,Unknown,8.99,7.99,Snacks & Drinks,4,,,,,
6869b96c26c9413d166fc310,Sour Strips Watermelon,685f076cae659ef8e57956fc,Unknown,8.99,7.99,Snacks & Drinks,1,,,,,
6869b9bdd45286d9ce5ea147,Sour Strips Tropical Mango,685f076cae659ef8e57956fc,Unknown,8.99,7.99,Snacks & Drinks,1,,,,,
6869ba9ee76ab7f392353a9d,Sour Strips Pink Lemonade,685f076cae659ef8e57956fc,Unknown,8.99,7.99,Snacks & Drinks,5,,,,,
6869bae4d45286d9ce5ec328,Sour Strips Wild Cherry,685f076cae659ef8e57956fc,Unknown,8.99,7.99,Snacks & Drinks,3,,,,,
686af3f226c9413d168f16fa,Pringles Original Party Pack,685f076cae659ef8e57956fc,Unknown,5.99,5.5,Snacks & Drinks,4,,,,,
68a523bee4d63010325aea25,Herbafresh Dead Sea Bath Salt 500g,67ffcc6581edee2219c54e94,Unknown,8.99,3.99,Grocery,15,,,,,
68bc5e026e06f3f1d9451757,L'Oreal Paris Feria Smokey Silver S1 Silver Grey Permanent Hair Dye Kit (1 ct),65e8f30bcb43951cbd853f59,Unknown,21.29,10.65,Beauty,1,,,,,
691f6eb770ccf1c96852c9f3,Coconut Cashews,691b59a5669ef62168a65bdb,Unknown,3.5,2.0,Nuts & Snacks,18,,,,,
691f6f952363bcbd857e1d3e,Milk Choco Covered Salted Caramel Peanuts,691b59a5669ef62168a65bdb,Unknown,4.5,3.5,Nuts & Snacks,9,,,,,
692e5b5c7aaefcde17875128,Everland Himalayan Crystal Salt 500g,67ffcc6581edee2219c54e94,Unknown,5.99,2.99,Grocery,5,,,,,
695807500c79613ef47ed200,Pretzel Pzazz Sour Cream & Chive,685f076cae659ef8e57956fc,Unknown,4.49,3.49,Snacks & Drinks,2,,,,,
695807dba1132e12bc69c1a4,Haribo Peaches,685f076cae659ef8e57956fc,Unknown,4.79,4.19,Snacks & Drinks,6,,,,,
69714698a0eb91f622f82d6c,Whisky Kiss Almonds,691b59a5669ef62168a65bdb,Unknown,3.5,2.0,Nuts & Snacks,29,,,,,
697146fbe2f09d0b9327b973,Salted Caramel Cashew,691b59a5669ef62168a65bdb,Unknown,3.5,2.0,Nuts & Snacks,10,,,,,
6971473140e632216a673804,Butter Toffee Almonds,691b59a5669ef62168a65bdb,Unknown,3.5,2.0,Nuts & Snacks,10,,,,,
6971481f077af9138bbd30d3,Matcha Choco Dipped Almonds,691b59a5669ef62168a65bdb,Unknown,4.5,3.5,Nuts & Snacks,2,,,,,
697148999f875680704e521a,Choco Salted Caramel Cashews,691b59a5669ef62168a65bdb,Unknown,4.5,3.5,Nuts & Snacks,7,,,,,
6976ba764bb7d7af11f788f7,New World Almond Butter Crunchy Roasted 500g,67ffcc6581edee2219c54e94,Unknown,14.99,8.99,Grocery,41,,,,,
6976bbec7717e37fa681e259,Karma Sparkling Watermelon Hydration Drink 285ml,67ffcc6581edee2219c54e94,Unknown,3.99,1.99,Beverages,25,,,,,
6976bce23695546c5d4594c5,Karma Apple Soda 285ml,67ffcc6581edee2219c54e94,Unknown,3.99,1.99,Beverages,19,,,,,
6976bd304e0f1abfeaaeefcf,Karma Berry Soda 285ml,67ffcc6581edee2219c54e94,Unknown,3.99,1.99,Beverages,23,,,,,
698a6de210bcc888935c3465,Dark Choco Gingers,691b59a5669ef62168a65bdb,Unknown,4.5,3.0,Nuts & Snacks,1,,,,,
698f97126b722fca3c676d2d,Clamato Extra Spicy Rimmer,65bd257956f2d4f45a3da0e2,Unknown,4.99,2.49,Centre of Store,1,,,,,
6990a5f7f3da2e15883cfdb8,Clearblue Digital & Visual Pregnancy Test Combo Pack (2 ct),65e8f30bcb43951cbd853f59,Unknown,24.99,24.99,Personal Care,1,,,,,
69b9d6eadb0f1efc55b0f9b7,"Mixed Artisan Loaf  , High Quality",67e6b1577b5f59b1bba8c7c4,Unknown,14.0,4.0,Artisan Crosta,9,,,,,
69b9d74adb0f1efc55b10093,"Mixed Pastry , Frozen",67e6b1577b5f59b1bba8c7c4,Unknown,18.0,5.0,Tuscan,5,,,,,
69cb1ea76e02b353d0bc310b,Preparation H Ointment with Bio-Dyne Multi-Symptom Hemorrhoid Treatment (25 g),65e8f30bcb43951cbd853f59,Unknown,11.49,5.74,Medicine,9,,,,,
69cc4e096e02b353d0cadafc,Yogurt Raisins,691b59a5669ef62168a65bdb,Unknown,4.5,3.5,Nuts & Snacks,5,,,,,
69cc4e9e58ea93478c52e670,Choco Salted Caremel Macadamia,691b59a5669ef62168a65bdb,Unknown,5.5,4.25,Nuts & Snacks,3,,,,,
69ccbcded80c66b9d357bff1,Knorr Premium Roasted Chicken Flavour Base (311 g),65e8f30bcb43951cbd853f59,Unknown,9.69,4.84,Pantry,1,,,,,
69ccbd35f4ba512083782519,Gerber Mealtime Garden Veggies Purée (162 ml),65e8f30bcb43951cbd853f59,Unknown,2.89,1.44,Baby,7,,,,,
69ccbd4ff4ba512083782599,Heinz Mango Habanero Mayo,65e8f30bcb43951cbd853f59,Unknown,4.99,2.49,Pantry,1,,,,,
69ccc993d80c66b9d357dc1c,Gerber Mealtime Garden Veggies Purée (162 ml),67bdc806855e4112ad907797,Unknown,2.89,1.44,Baby,2,,,,,
69cdcbda1ac0c5f87401509e,SUNRYPE FRUIT2GO WLDBRY BULK,65bd257956f2d4f45a3da0e2,Unknown,0.49,0.24,Grocery,26,,,,,
69cdcc28b4eced6e6b0c7c44,SUNRYPE FRUIT2GO WLDBRY BULK,65bd257956f2d4f45a3da0e2,Unknown,0.49,0.24,Grocery,28,,,,,
69cdcc60b4eced6e6b0c7eb5,SUNRYPE FRUIT2GO WLDBRY BULK,65bd257956f2d4f45a3da0e2,Unknown,0.49,0.24,Grocery,47,,,,,
69cdcccd945e120abf6176ce,SUNRYPE FRUIT2GO WLDBRY BULK,65bd257956f2d4f45a3da0e2,Unknown,0.49,0.24,Grocery,44,,,,,
69cdccfb3090f65b97bc9763,SUNRYPE FRUIT2GO WLDBRY BULK,65bd257956f2d4f45a3da0e2,Unknown,0.49,0.24,Grocery,19,,,,,
69ce109d895133c51abde6d1,Imodium Mint Calming Liquid (240 ml),65e8f30bcb43951cbd853f59,Unknown,18.88,9.44,Medicine,3,,,,,
69ce10af898156d0cb8b984e,Buckley's Chest Congestion Liquid (150 ml),65e8f30bcb43951cbd853f59,Unknown,16.99,8.49,Medicine,2,,,,,
69ce115b898156d0cb8b9ad7,Enfamil A+ Stage 1 Concentrated Liquid Infant Formula (385 ml x 12 ct),65e8f30bcb43951cbd853f59,Unknown,67.97,33.98,Baby,2,,,,,
69ce19fc8f4c07a18fdaba16,Enfamil A+ Stage 1 Powder Formula Refill (992 g),67bdc806855e4112ad907797,Unknown,59.97,29.98,Baby,2,,,,,
69cf61374620fe6c27dcdefc,Biore Clear & Breathable Acne Clearing Cleanser (200 ml),65e8f30bcb43951cbd853f59,Unknown,13.49,6.74,Beauty,5,,,,,
69d0b53ab0510d31b8d3fa01,Hidden Valley Ranch Spicy,65e8f30bcb43951cbd853f59,Unknown,4.49,2.25,Pantry,4,,,,,
69d0b5588f4c07a18ffd69c4,IAMS Advanced Health Skin & Coat Chicken & Salmon Dry Adult Dog Food (2.72 kg),65e8f30bcb43951cbd853f59,Unknown,23.29,11.64,Pet Care,1,,,,,
69d1fef7ef88569bc4f4955a,Vegeta Food Seasoning (500 g),67bdc806855e4112ad907797,Unknown,8.29,4.14,Pantry,1,,,,,
69d2026cef88569bc4f49fdc,Barilla Pappardelle Pasta (450 g),65e8f30bcb43951cbd853f59,Unknown,5.79,2.89,Pantry,8,,,,,
69d352f5e7757e7592fd127c,Ben's Original Street Food Fried Rice with Vegetables Bowl (255 g),65e8f30bcb43951cbd853f59,Unknown,5.79,2.89,Pantry,1,,,,,
69d4a2f16eddcecfdaaf5b44,Mama Sita's Barbecue Marinade Sauce (350 ml),67bdc806855e4112ad907797,Unknown,5.59,2.79,Pantry,16,,,,,
69d4a2f1e7757e75920d974e,Mama Sita's Barbecue Marinade Mix (50 g),67bdc806855e4112ad907797,Unknown,1.17,0.58,Pantry,15,,,,,
69d4add36eddcecfdaaf73ed,Kraft Calorie-Wise Catalina Dressing (425 ml),65e8f30bcb43951cbd853f59,Unknown,4.29,2.14,Pantry,10,,,,,
69d4aed6e7757e75920db18f,Mama Sita's Tocino Marinating Mix (75 g),65e8f30bcb43951cbd853f59,Unknown,1.89,0.94,Pantry,10,,,,,
69d4aefab17bdf94ec873a7f,Mama Sita's Barbecue Marinade Mix (50 g),65e8f30bcb43951cbd853f59,Unknown,1.89,0.94,Pantry,11,,,,,
69d4af33e7757e75920db1fc,Mama Sita's Barbecue Marinade Mix (50 g),65e8f30bcb43951cbd853f59,Unknown,1.89,0.94,Pantry,8,,,,,
69d4af7f6eddcecfdaaf7713,Mama Sita's Tocino Marinating Mix (75 g),65e8f30bcb43951cbd853f59,Unknown,1.89,0.94,Pantry,4,,,,,
69d4afa5e7757e75920db28f,Mama Sita's Barbecue Marinade Sauce (350 ml),65e8f30bcb43951cbd853f59,Unknown,5.59,2.79,Pantry,16,,,,,
69d56d073c37af8a28b641cd,Gits Dosa Breakfast Mix,65e8f30bcb43951cbd853f59,Unknown,1.99,1.0,Pantry,7,,,,,
69d56dab667d9f75c4481228,Trojan Ultra Ribbed Condoms,65e8f30bcb43951cbd853f59,Unknown,14.99,7.5,Personal Care,1,,,,,
69d5f9879b04f23cb0999582,Hellmann's Spicy Mayonnaise Squeeze Bottle (340 ml),65e8f30bcb43951cbd853f59,Unknown,6.39,3.19,Pantry,9,,,,,
69d5fa539b04f23cb09996e0,Hellmann's Spicy Mayonnaise Squeeze Bottle (340 ml),67bdc806855e4112ad907797,Unknown,6.39,3.19,Pantry,4,,,,,
69d896be1ee129cbea2d307c,IAMS Proactive Health Minichunks Chicken & Whole Grains Recipe Dry Dog Food (3.18 kg),65e8f30bcb43951cbd853f59,Unknown,23.29,11.64,Pet Care,4,,,,,
69d89b6d1ba276ef1d7a652c,Mama Sita's Palabok Oriental Gravy Mix (57 g),65e8f30bcb43951cbd853f59,Unknown,1.89,0.94,Pantry,1,,,,,
69d9e9661ba276ef1d8cd990,Paldo Seafood Noodle Soup Bowl (86 g),65e8f30bcb43951cbd853f59,Unknown,1.99,0.99,Pantry,12,,,,,
69d9e9ef8f5487e41dc67cce,KFI Tikka Cooking Paste (275 g),65e8f30bcb43951cbd853f59,Unknown,6.69,3.34,Pantry,4,,,,,
69dc9600d154903247661d85,Quaker Blueberry Buttermilk Muffin Mix (900 g),65e8f30bcb43951cbd853f59,Unknown,7.49,3.74,Pantry,7,,,,,
69dc993ed15490324766257b,Quaker Blueberry Buttermilk Muffin Mix (900 g),67bdc806855e4112ad907797,Unknown,7.49,3.74,Pantry,2,,,,,
69dede0c8f5487e41d03f26e,Karma Sparkling Watermelon Hydration Drink Pack Of 4*285ml,67ffcc6581edee2219c54e94,Unknown,8.99,3.99,Beverages,4,,,,,
69dfa93c1ba276ef1dd380f7,Vanilla Rolled Wafers (case of 6),686ffde536c2d6774d41f590,Unknown,60.0,36.0,Grocery,45,,,,,
69e03ada874a7fbdf2682b15,Karma Sparkling Grape Hydration Drink Pack of 4*285ml,67ffcc6581edee2219c54e94,Unknown,8.99,3.99,Beverages,12,,,,,
69e03c50d154903247953c73,Karma Berry Soda  Pack of 6*285ml,67ffcc6581edee2219c54e94,Unknown,10.99,4.99,Beverages,10,,,,,
69e03cbbd154903247954425,Karma Apple Soda Pack of 6*285ml,67ffcc6581edee2219c54e94,Unknown,10.99,4.99,Beverages,10,,,,,
69e082d51ee129cbea95d5e2,Old El Paso Mild Taco Seasoning Mix (24 g),67bdc806855e4112ad907797,Unknown,1.59,0.79,Pantry,1,,,,,
69e08514874a7fbdf26a7145,Frank's RedHot Garlic Parmesan Thick Sauce (354 ml),65e8f30bcb43951cbd853f59,Unknown,5.59,2.79,Pantry,2,,,,,
69e085551ba276ef1de28226,Tamam Rose Water (300 ml),65e8f30bcb43951cbd853f59,Unknown,2.27,1.13,Pantry,22,,,,,
69e1d5af86fe4a35edfebbd6,Oreo Golden Mini Cookies Snak Paks (25 g x 6 ct),67bdc806855e4112ad907797,Unknown,3.99,1.99,Snacks,3,,,,,
69e2d536a2ee7a44f30e2d12,WINDSOR SAFE-T PLUS ECO,65bd257956f2d4f45a3da0e2,Unknown,12.0,6.0,Home & Ent.,1,,,,,
69e2d572e8f36f87acbf7369,PC GOURMET BBQ SAUCE,65bd257956f2d4f45a3da0e2,Unknown,5.69,2.84,Grocery,4,,,,,
69e2d5eca2ee7a44f30e4290,PC CHICKEN RIB BBQ SAUCE,65bd257956f2d4f45a3da0e2,Unknown,5.69,2.84,Grocery,8,,,,,
69e2d601e8f36f87acbf85ab,PC CHICKEN RIB BBQ SAUCE,65bd257956f2d4f45a3da0e2,Unknown,5.69,2.84,Grocery,2,,,,,
69e2d8fca22758b420c9c66d,ZINCOFAX ORIG OINT,65bd257956f2d4f45a3da0e2,Unknown,6.24,3.12,HABA,8,,,,,
69e2e41986fe4a35ed0ebe6e,Gerber Mealtime Garden Veggies Purée (162 ml),65e8f30bcb43951cbd853f59,Unknown,2.89,2.6,Baby,12,,,,,
69e2e43de91caefa0096f960,Quaker Dipps Chocolate Chip Granola Bars (156 g),65e8f30bcb43951cbd853f59,Unknown,3.99,3.59,Snacks,10,,,,,
69e3292dcecf3738ccac13ec,Vatika Naturals Henna Burgundy Hair Dye (60 g),65e8f30bcb43951cbd853f59,Unknown,6.09,3.04,Beauty,5,,,,,
69e3294b86fe4a35ed10dc0f,Icy Hot Pro Pain Relief Dry Spray (118 ml),65e8f30bcb43951cbd853f59,Unknown,19.99,9.99,Medicine,1,,,,,
69e32aba59545b3c4803d4e2,naturSource Original Salad Topper (625 g),65e8f30bcb43951cbd853f59,Unknown,15.39,7.69,Pantry,7,,,,,
69e33242e91caefa00994b5a,naturSource Original Salad Topper (625 g),67bdc806855e4112ad907797,Unknown,15.39,7.69,Pantry,4,,,,,
69e4209d86fe4a35ed1e8652,M.Y San Graham Crackers ,65e8f30bcb43951cbd853f59,Unknown,2.17,1.95,Snacks,7,,,,,
69e477abcecf3738ccbc0c13,Heinz Mayochup Mayonnaise Style Sauce (340 ml),67bdc806855e4112ad907797,Unknown,4.99,2.49,Pantry,5,,,,,
69e477abe91caefa00aadd37,Delectables Stew Chicken & Seafood Lickable Wet Cat Treats Variety Pack (12 ct),67bdc806855e4112ad907797,Unknown,17.39,8.69,Pet Care,3,,,,,
69e478fd59545b3c4813dc09,Heinz Mayochup Mayonnaise Style Sauce (340 ml),65e8f30bcb43951cbd853f59,Unknown,4.99,2.49,Pantry,4,,,,,
69e5c9f37e1c4562b64d4cfd,Axis-Y Glow Your Own Way Gift Set (1 ct),65e8f30bcb43951cbd853f59,Unknown,72.99,36.49,Beauty,3,,,,,
69e5ca3586fe4a35ed307472,Sunasia Garlic Puffed Chicharrones (75 g),65e8f30bcb43951cbd853f59,Unknown,2.99,1.49,Snacks,7,,,,,
69e719b6cecf3738ccda906c,Dunkaroos Biscuits au chocolat / Chocolate Cookies & Double Chocolate Frosting (168 g),65e8f30bcb43951cbd853f59,Unknown,5.99,2.99,Snacks,1,,,,,
69e719cbcecf3738ccda90d9,Icy Hot Hydrogel Fast Acting Pro Pain Relief Patch (5 ct),65e8f30bcb43951cbd853f59,Unknown,19.99,9.99,Medicine,2,,,,,
69e719f5cecf3738ccda9178,Hershey's Delicious Strawberry Syrup (472 ml),65e8f30bcb43951cbd853f59,Unknown,7.79,3.89,Pantry,5,,,,,
69e72054e91caefa00ccef60,Astro Snacks Freeze-Dried Marshmallows Candy (50 g),67bdc806855e4112ad907797,Unknown,11.99,5.99,Candy,6,,,,,
69e86f697e1c4562b66fb8cc,Baken-Ets Hot 'N Spicy Pork Rinds (70 g),65e8f30bcb43951cbd853f59,Unknown,3.29,1.64,Snacks,2,,,,,
69e86f857e1c4562b66fb8ef,Jack Link's Hickory Smoked Bacon Jerky (65 g),65e8f30bcb43951cbd853f59,Unknown,7.99,3.99,Snacks,4,,,,,
69e870c7cecf3738ccea3809,Baken-Ets Hot 'N Spicy Pork Rinds (70 g),65e8f30bcb43951cbd853f59,Unknown,3.29,1.64,Snacks,3,,,,,
69e870dfcecf3738ccea383f,Baken-Ets Traditional Pork Rinds (70 g),65e8f30bcb43951cbd853f59,Unknown,3.29,1.64,Snacks,1,,,,,
69e8712c86fe4a35ed511d98,Ritz Original Crackers (350 g),65e8f30bcb43951cbd853f59,Unknown,6.59,3.29,Snacks,9,,,,,
69e8769159b619d258ca0319,NESTLE TURTLES CHOC ORIGINAL,5d0bd76c8894a4ebbfd704b8,Unknown,16.0,8.0,Grocery,67,,,,,
69e8ff030513be7ea4c66e41,cannoli chips,5ddef30c9af4e045c44b9d67,Unknown,5.0,1.0,Bakery,4,,,,,
69e970a752b2689171ce09a3,Pedialyte Unflavoured Electrolyte Oral Rehydration Solution (1 L),65e8f30bcb43951cbd853f59,Unknown,12.99,11.69,Drinks,4,,,,,
69e9715715a31ba3643b49f7,Cesar New York Strip Wet Dog Food (100 g),65e8f30bcb43951cbd853f59,Unknown,2.39,1.19,Pet Care,24,,,,,
69e9bbcd801ae9157372b268,Pure J.L. Kraft Miso Lime Ginger Dressing & Marinade (355 ml),65e8f30bcb43951cbd853f59,Unknown,5.79,2.89,Pantry,1,,,,,
69e9bc2e801ae9157372b32a,Anua Heartleaf 77% Soothing Toner (500 ml),65e8f30bcb43951cbd853f59,Unknown,49.99,24.99,Beauty,2,,,,,
69e9bc8b15a31ba3643e152a,Carnaby Sweet Peanut Butter Choco-Crunch Ice Cream & Dessert Topping (100 g),65e8f30bcb43951cbd853f59,Unknown,3.79,1.89,Pantry,10,,,,,
69e9c2d83f52967133b7af49,Carnaby Sweet Peanut Butter Choco-Crunch Ice Cream & Dessert Topping (100 g),67bdc806855e4112ad907797,Unknown,3.79,1.89,Pantry,10,,,,,
69e9c2d8bdaca3bf0af1f0b6,Anua Heartleaf 77% Soothing Toner (500 ml),67bdc806855e4112ad907797,Unknown,49.99,24.99,Beauty,1,,,,,
69ea7760535d03f9395efe91,FM Cinnamon Rolls,5ddef30c9af4e045c44b9d67,Unknown,4.94,2.0,Bakery,38,,,,,
69eb1306c8b3587b5aee5161,Nongshim Cuttlefish Snack (260 g),65e8f30bcb43951cbd853f59,Unknown,7.29,3.64,Snacks,4,,,,,
69eb133c49ced8759eb8af44,Earth's Best Organic Strawberry Banana Fruit Yogurt Smoothie (125 ml),65e8f30bcb43951cbd853f59,Unknown,2.99,1.49,Baby,7,,,,,
69eb1361c8b3587b5aee526d,Earth's Best Organic Mixed Berry Fruit Yogurt Smoothie (125 ml),65e8f30bcb43951cbd853f59,Unknown,2.99,1.49,Baby,1,,,,,
69eb138249ced8759eb8afb9,Maxwell House Dark Roast K-Cup Coffee Pods (30 ct),65e8f30bcb43951cbd853f59,Unknown,23.99,11.99,Pantry,3,,,,,
69ec6226c8b3587b5aff27bd,Coffee-Mate Double Double-mate Liquid Coffee Enhancer (946 ml),65e8f30bcb43951cbd853f59,Unknown,6.99,3.49,Dairy & Eggs,1,,,,,
69ec67812aa383c49a012a81,Frank's RedHot Buffalo 'N Ranch Thick Sauce (354 ml),65e8f30bcb43951cbd853f59,Unknown,5.59,2.79,Pantry,3,,,,,
69edb0812aa383c49a10d6be,Kraft Calorie-Wise Creamy Poppyseed Dressing (425 ml),65e8f30bcb43951cbd853f59,Unknown,4.29,2.14,Pantry,10,,,,,
69edb09abdaca3bf0a21cdb6,Nissin Chicken Instant Noodle Bowl (114 g),65e8f30bcb43951cbd853f59,Unknown,2.69,1.34,Pantry,3,,,,,
69ee30cc1c7aa1a760976fdd,PCO FIELD GREENS SLD MX 142G,5fac3e09d7528a3c966b13d0,Unknown,5.99,2.99,Produce,5,,,,,
69ee93932cfbc7c71d7897de,Yellow Onion 10lb,65bd257956f2d4f45a3da0e2,Unknown,9.49,4.74,Produce,7,,,,,
69eefd83646306611015c6bc,Dairyland 18% Sour Cream (450 ml),65e8f30bcb43951cbd853f59,Unknown,5.29,2.64,Dairy & Eggs,4,,,,,
69eefdfcbdaca3bf0a306313,Tre Stelle Mascarpone Cheese (475 g),65e8f30bcb43951cbd853f59,Unknown,17.29,8.64,Dairy & Eggs,1,,,,,
69ef00ab49ced8759ee686e5,Surati Chakri/Muruku Extruded Flour Twist Snacks (250 g),65e8f30bcb43951cbd853f59,Unknown,3.49,1.74,Snacks,13,,,,,
69ef00d0646306611015d13d,Oh Henry! Candy Bites Pouch (200 g),65e8f30bcb43951cbd853f59,Unknown,7.39,3.69,Candy,2,,,,,
69ef00ee646306611015d1ab,old dutch crunchys extreme cheddar corn snacks,65e8f30bcb43951cbd853f59,Unknown,5.29,2.64,Snacks,6,,,,,
69ef01472aa383c49a202185,Betty Crocker Milk Chocolate Whipped Frosting (340 g),65e8f30bcb43951cbd853f59,Unknown,2.69,1.34,Pantry,6,,,,,
69ef01adc8b3587b5a1dcd29,SunnyD Smooth (240 ml x 6 ct),65e8f30bcb43951cbd853f59,Unknown,4.77,2.38,Drinks,1,,,,,
69ef106549ced8759ee6aa4b,Betty Crocker Milk Chocolate Whipped Frosting (340 g),67bdc806855e4112ad907797,Unknown,2.69,1.34,Pantry,2,,,,,
69ef1065c8b3587b5a1debe3,Pedigree DentaStix Medium Beef Flavour Dog Treats (972 g),67bdc806855e4112ad907797,Unknown,22.99,11.49,Pet Care,3,,,,,
69f010a8c8b3587b5a2c3aff,Grass-Fed Boneless Stewing Beef (approx 454 g),67bdc806855e4112ad907797,Unknown,14.99,7.49,Meat & Fish,2,,,,,
69f057b7bdaca3bf0a409da4,La Rocca Strawberries and Cream Cake,65e8f30bcb43951cbd853f59,Unknown,18.79,9.39,Bakery,1,,,,,
69f057d7646306611025f136,Dairyland chocolate milk 946ml,65e8f30bcb43951cbd853f59,Unknown,4.29,2.14,Dairy & Eggs,3,,,,,
69f058942aa383c49a3148b6,Lindt Lindor Tiramisu Milk Chocolate Truffles (150 g),65e8f30bcb43951cbd853f59,Unknown,12.89,6.44,Candy,1,,,,,
69f058adbdaca3bf0a409fba,Lindt Lindor Milk Chocolate Truffles (150 g),65e8f30bcb43951cbd853f59,Unknown,13.29,6.64,Candy,3,,,,,
69f059052aa383c49a31497b,Ghirardelli Caramel Assorted Chocolate Squares Bag (153 g),65e8f30bcb43951cbd853f59,Unknown,8.99,4.49,Candy,1,,,,,
69f05941646306611025f384,Milka White chocolate ,65e8f30bcb43951cbd853f59,Unknown,3.39,1.69,Candy,10,,,,,
69f0599abdaca3bf0a40a16b,Starburst Sour Gummies (255 g),65e8f30bcb43951cbd853f59,Unknown,6.99,3.49,Candy,10,,,,,
69f059ca646306611025f4ee,Lindt Lindor Milk Chocolate Fudge Swirl Truffles (150 g),65e8f30bcb43951cbd853f59,Unknown,13.29,6.64,Candy,2,,,,,
69f05bb649ced8759ef6ada1,Lee Kum Kee Sriracha Mayonnaise (445 ml),65e8f30bcb43951cbd853f59,Unknown,8.99,4.49,Pantry,3,,,,,
69f05ea52aa383c49a315551,Dairyland Chocolate milk,67bdc806855e4112ad907797,Unknown,4.29,2.14,Dairy & Eggs,1,,,,,
69f05ea5c8b3587b5a2e83b8,Dairyland Chocolate Milk (2L),67bdc806855e4112ad907797,Unknown,5.79,2.89,Dairy & Eggs,2,,,,,
69f0622c2aa383c49a315ae0,Starburst Sour Gummies (255 g),67bdc806855e4112ad907797,Unknown,6.99,3.49,Candy,4,,,,,
69f0622c49ced8759ef6b9ab,Pedigree DentaStix Medium Original Flavour Dog Treats (608 g),67bdc806855e4112ad907797,Unknown,13.29,6.64,Pet Care,2,,,,,
69f0622c646306611026041c,Vatika Naturals Henna Burgundy Hair Dye (60 g),67bdc806855e4112ad907797,Unknown,6.09,3.04,Beauty,3,,,,,
69f0622cc8b3587b5a2e88fb,Lindt Lindor 70% Cocoa Extra Dark Chocolate Bar (100 g),67bdc806855e4112ad907797,Unknown,5.29,2.64,Candy,2,,,,,
69f0622d49ced8759ef6b9b8,Blistex Daily Conditioning Cocoa Butter & Vitamin E SPF 20 Lip Treatment (1 ct),67bdc806855e4112ad907797,Unknown,5.99,2.99,Beauty,1,,,,,
69f06300bdaca3bf0a40b2ec,Sugarfina Kuromi: Pink Skulls Gummy Candy Small Cube (1 ct),67bdc806855e4112ad907797,Unknown,11.49,5.74,Candy,6,,,,,
69f06300c8b3587b5a2e89ea,Ghirardelli Caramel Assorted Chocolate Squares Bag (153 g),67bdc806855e4112ad907797,Unknown,8.99,4.49,Candy,3,,,,,
69f064506463066110260751,Milka White Chocolate (90 g),67bdc806855e4112ad907797,Unknown,3.39,1.7,Candy,5,,,,,
69f0c805eadda114cdb23573,A Chunk SCH BEEF BOLOGNA 690gr,5d0bd76c8894a4ebbfd704b8,Unknown,28.29,4.0,Deli,1,,,,,
69f0f3199901603efa61dbed,Lunch Mate Nacho,5ddef30c9af4e045c44b9d67,Unknown,4.5,1.0,Meat,10,,,,,
69f0f385a911635dafbf58f4,Harvest Ham Sausage Ring,5ddef30c9af4e045c44b9d67,Unknown,11.0,5.5,Meat,1,,,,,
69f10ee89901603efa66ba15,Mixed Produce Box #610,5d0bd76c8894a4ebbfd704b8,Unknown,5.0,5.0,Produce,1,,,,,
69f10f21eadda114cdbfe385,Mixed Produce Box #614,5d0bd76c8894a4ebbfd704b8,Unknown,5.0,5.0,Produce,1,,,,,
69f10f9391961f5cad18ca0a,Mixed Produce Box #749,5d0bd76c8894a4ebbfd704b8,Unknown,5.0,5.0,Produce,1,,,,,
69f10fd8ad98bc184b287a6b,Mixed Produce Box #719,5d0bd76c8894a4ebbfd704b8,Unknown,5.0,5.0,Produce,1,,,,,
69f1105dad98bc184b2889d5,Mixed Produce Box #751,5d0bd76c8894a4ebbfd704b8,Unknown,5.0,5.0,Produce,1,,,,,
69f1117b1c7aa1a760f66767,Mixed Produce Box #750,5d0bd76c8894a4ebbfd704b8,Unknown,5.0,5.0,Produce,1,,,,,
69f111c61c7aa1a760f66fb4,Mixed Produce Box #716,5d0bd76c8894a4ebbfd704b8,Unknown,5.0,5.0,Produce,1,,,,,
69f113751c7aa1a760f6c2f0,Mixed Produce Box #610,5d0bd76c8894a4ebbfd704b8,Unknown,5.0,5.0,Produce,1,,,,,
69f113c61c7aa1a760f6d0a9,Mixed Produce Box #618,5d0bd76c8894a4ebbfd704b8,Unknown,5.0,5.0,Produce,1,,,,,
69f117428ec9ad942d9f36c8,BC SAUS PORK BREAKFAST,5fac3e04d7528a3c966b13a4,Unknown,10.0,5.0,Meat,3,,,,,
69f11fa88ec9ad942da06f37,organic russet potatoes 3lb,5fac3e09d7528a3c966b13d0,Unknown,6.49,2.0,Produce,13,,,,,
69f1a8476463066110363e69,Ziggy's Smoked Kolbassa Sausage (375 g),65e8f30bcb43951cbd853f59,Unknown,8.79,4.39,Meat & Fish,2,,,,,
69f1a9fa49ced8759e070269,Kraft Dinner Jalapeno Macaroni & Cheese Cup (58 g),65e8f30bcb43951cbd853f59,Unknown,2.29,1.14,Pantry,9,,,,,
69f1aaadc8b3587b5a3fab93,Oh Henry! Chocolate Bites Peg Bag (104 g),65e8f30bcb43951cbd853f59,Unknown,4.29,2.14,Candy,1,,,,,
69f1aabe2aa383c49a42bb31,Deep Relief Extra Strength Pain Relief Heat Spray (150 ml),65e8f30bcb43951cbd853f59,Unknown,11.99,5.99,Medicine,1,,,,,
69f1aaed49ced8759e070db5,GynaCan Vaginal Yeast Infection Treatment Capsules (30 ct),65e8f30bcb43951cbd853f59,Unknown,29.99,14.99,Personal Care,3,,,,,
69f1abe26463066110365f10,Reese's Miniatures Dark Chocolate & Peanut Butter (185 g),65e8f30bcb43951cbd853f59,Unknown,6.99,3.49,Candy,10,,,,,
69f1aee06463066110366318,Dairyland 33% Whipping Cream Carton (473 ml),67bdc806855e4112ad907797,Unknown,3.47,1.73,Dairy & Eggs,12,,,,,
69f1aee0c8b3587b5a3fb3de,Las Margaritas Hot Salsa (500 ml),67bdc806855e4112ad907797,Unknown,8.79,4.39,Easy Meals,4,,,,,
69f1b12649ced8759e0718ae,Nature Valley Soft baked Blueberry Muffin bars,67bdc806855e4112ad907797,Unknown,7.49,3.74,Snacks,3,,,,,
69f1b126646306611036671a,La Baguetterie Bakery White Baguette (326 g),67bdc806855e4112ad907797,Unknown,3.29,1.64,Bakery,1,,,,,
69f1b126bdaca3bf0a50ddba,Reese's Miniatures Dark Chocolate & Peanut Butter (185 g),67bdc806855e4112ad907797,Unknown,6.99,3.49,Candy,11,,,,,
69f1b126c8b3587b5a3fb84a,KFI Tikka Masala Sauce (375 ml),67bdc806855e4112ad907797,Unknown,5.79,2.89,Pantry,2,,,,,
69f1b1272aa383c49a42c7a3,Old Dutch Dill Pickle Potato Chips (220 g),67bdc806855e4112ad907797,Unknown,5.29,2.64,Snacks,4,,,,,
69f1b12fbdaca3bf0a50ddd4,School Safe Birthday cake mini loaves,67bdc806855e4112ad907797,Unknown,5.29,2.65,Bakery,1,,,,,
69f1b2fd49ced8759e071d8e,Living World Timothy Hay for Small Animals (560 g),67bdc806855e4112ad907797,Unknown,13.49,6.74,Pet Care,3,,,,,
69f1b2fd6463066110366bc0,Taco Bell Crunchwrap Supreme Cravings Kit (642 g),67bdc806855e4112ad907797,Unknown,9.29,4.64,Pantry,2,,,,,
69f1b2fdbdaca3bf0a50e18a,MISSHA Ultra Powerproof Brown Pencil Liner (1 ct),67bdc806855e4112ad907797,Unknown,13.99,6.99,Beauty,2,,,,,
69f203db4f8f58ec8cf72887,Mixed Produce Box #409,5d0bd76b8894a4ebbfd7048a,Unknown,5.0,5.0,Produce,1,,,,,
69f203ee19a3f0247b5203b7,Mixed Produce Box #410,5d0bd76b8894a4ebbfd7048a,Unknown,5.0,5.0,Produce,1,,,,,
69f205b519a3f0247b52734c,Mixed Produce Box #417,5d0bd76b8894a4ebbfd7048a,Unknown,5.0,5.0,Produce,1,,,,,
69f205cd1c7aa1a7600cfd6f,Mixed Produce Box #416,5d0bd76b8894a4ebbfd7048a,Unknown,5.0,5.0,Produce,1,,,,,
69f23c4ddfec707295cfb50b,FRESH ASC TILAPIA FILLETS REG,5d0bd76c8894a4ebbfd704b8,Unknown,12.41,6.2,Seafood,1,,,,,
69f249dafd9cf3028de38391,Organic Celery 2ct,65bd257956f2d4f45a3da0e2,Unknown,5.99,2.99,Produce,3,,,,,
69f24ad019a3f0247b60dd85,PCO MUSHROOM WHITE 227G,65bd257956f2d4f45a3da0e2,Unknown,3.49,1.74,Produce,3,,,,,
69f24b0c1c7aa1a7601d5ff1,Cauliflower,65bd257956f2d4f45a3da0e2,Unknown,4.99,2.49,Produce,1,,,,,
69f24b8919a3f0247b60f892,PC SAGE 28 g,65bd257956f2d4f45a3da0e2,Unknown,3.0,1.5,Produce,1,,,,,
69f24ba919a3f0247b6103a2,FM ORANGE 5LB,65bd257956f2d4f45a3da0e2,Unknown,9.99,4.99,Produce,1,,,,,
69f24be764ed2f425a620e1d,Mixed Produce Box #418,5d0bd76c8894a4ebbfd704b8,Unknown,5.0,5.0,Produce,1,,,,,
69f24be819a3f0247b610dd7,PCO MUSHRM WHLE CREMINI 454G,65bd257956f2d4f45a3da0e2,Unknown,6.49,3.24,Produce,1,,,,,
69f24c00cffc691a0c793af2,Mixed Produce Box #416,5d0bd76c8894a4ebbfd704b8,Unknown,5.0,5.0,Produce,1,,,,,
69f24c191c7aa1a7601d937c,Mixed Produce Box #411,5d0bd76c8894a4ebbfd704b8,Unknown,5.0,5.0,Produce,1,,,,,
69f24c27fd9cf3028de3d948,Mixed Produce Box #410,5d0bd76c8894a4ebbfd704b8,Unknown,5.0,5.0,Produce,1,,,,,
69f24c301c7aa1a7601d9a72,Mixed Produce Box #415,5d0bd76c8894a4ebbfd704b8,Unknown,5.0,5.0,Produce,1,,,,,
69f24c4219a3f0247b611c00,Mixed Produce Box #414,5d0bd76c8894a4ebbfd704b8,Unknown,5.0,5.0,Produce,1,,,,,
69f24c47fd9cf3028de3e179,Mixed Produce Box #413,5d0bd76c8894a4ebbfd704b8,Unknown,5.0,5.0,Produce,1,,,,,
69f24c81fd9cf3028de3ebc4,pepperoni pizza,5fac3e04d7528a3c966b13a4,Unknown,3.0,1.5,Meat,15,,,,,
69f24ca3fd9cf3028de3ef3c,FNMO CHORIZO DRY SAUSAGE,5fac3e04d7528a3c966b13a4,Unknown,8.49,4.24,Deli,4,,,,,
69f24cd51c7aa1a7601db3fd,Mixed Produce Box #403,5d0bd76c8894a4ebbfd704b8,Unknown,5.0,5.0,Produce,1,,,,,
69f24ce5fd9cf3028de3fa96,Mixed Produce Box #402,5d0bd76c8894a4ebbfd704b8,Unknown,5.0,5.0,Produce,1,,,,,
69f24d009901603efa8eac3c,Mixed Produce Box #406,5d0bd76c8894a4ebbfd704b8,Unknown,5.0,5.0,Produce,1,,,,,
69f24d0c1c7aa1a7601dbe27,Mixed Produce Box #405,5d0bd76c8894a4ebbfd704b8,Unknown,5.0,5.0,Produce,1,,,,,
69f24d15eadda114cde647f5,PC ORRI MANDARIN 2LB,65bd257956f2d4f45a3da0e2,Unknown,8.49,4.24,Produce,1,,,,,
69f24d2119a3f0247b6149a3,Mixed Produce Box #409,5d0bd76c8894a4ebbfd704b8,Unknown,5.0,5.0,Produce,1,,,,,
