69f24d29eadda114cde64be9,Mixed Produce Box #408,5d0bd76c8894a4ebbfd704b8,Unknown,5.0,5.0,Produce,1,,,,,
69f24d36fd9cf3028de401d5,Mixed Produce Box #407,5d0bd76c8894a4ebbfd704b8,Unknown,5.0,5.0,Produce,1,,,,,
69f25c709901603efa91334d,DAAWAT HYDERABADI BIRYANI KIT,629cec56061cc278a85326dc,Unknown,4.0,2.0,Grocery,5,,,,,
69f26719e6df5f628a705b42,Beef blade steak boneless,64a6b9d71e02c66732c06f33,Unknown,12.5,6.25,Meat,1,,,,,
69f2674bd1573e7d529a6445,Pork Loin center chops Bnls,64a6b9d71e02c66732c06f33,Unknown,7.37,3.68,Meat,1,,,,,
69f27772cb4422793f773900,Top sirloin steak,64a6b9d71e02c66732c06f33,Unknown,26.02,13.01,Meat,1,,,,,
69f277fdd1adfce106285f7d,Ziggy's Balogna,64a6b9d71e02c66732c06f33,Unknown,9.0,3.5,Deli,1,,,,,
69f279666813ee606eb2d819,PC Maple breakfast sausages,64a6b9d71e02c66732c06f33,Unknown,8.0,4.0,Meat,1,,,,,
69f2c8f7ed5a2f28587cf043,SUFRA HALAL CHKN DRUMS TP FR,629cec56061cc278a85326dc,Unknown,10.0,5.0,Meat,6,,,,,
69f2d041f35701f5614a70ac,ASSORTED ROLLS 12PK,5d0bd76c8894a4ebbfd704b8,Unknown,4.0,2.0,Bakery,1,,,,,
69f2d04d6813ee606ebb331b,ASSORTED ROLLS 6PK,5d0bd76c8894a4ebbfd704b8,Unknown,2.75,1.37,Bakery,1,,,,,
69f2d05a6813ee606ebb33d5,ASSORTED ROLLS 12PK,5d0bd76c8894a4ebbfd704b8,Unknown,4.0,2.0,Bakery,1,,,,,
69f2f71599e4382b82ecec98,Activia Gut Health Plain Probiotic (100g x 8ct),67bdc806855e4112ad907797,Unknown,7.69,3.85,Dairy & Eggs,6,,,,,
69f2f74af8dc4f4853e0df00,Earth's Own French Vanilla Oat Creamer (946 ml),67bdc806855e4112ad907797,Unknown,6.49,3.24,Dairy & Eggs,2,,,,,
69f2f7d200771890b529f7ae,lOGO Nano Mango Yogurt Pouches (90g x 4ct),67bdc806855e4112ad907797,Unknown,4.0,2.0,Dairy & Eggs,3,,,,,
69f2f7f3f8dc4f4853e0e0c4,Sunrise Tofu,67bdc806855e4112ad907797,Unknown,3.89,1.94,Dairy & Eggs,2,,,,,
69f2f9c774150b302b8d2662,Grass-Fed Boneless Stewing Beef (approx 454 g),67bdc806855e4112ad907797,Unknown,14.99,7.49,Meat & Fish,4,,,,,
69f2f9fd74150b302b8d26ca,Heluva Good! Dill Pickle Sour Cream Dip (250 g),65e8f30bcb43951cbd853f59,Unknown,4.49,2.24,Easy Meals,6,,,,,
69f2fa2374150b302b8d2736,Ziggy's Mild Cheddar Cheese Slices (180 g),65e8f30bcb43951cbd853f59,Unknown,5.59,2.79,Dairy & Eggs,3,,,,,
69f2fa50f8dc4f4853e0e8d5,Farmer's Market Tuxedo Cake (753 g),65e8f30bcb43951cbd853f59,Unknown,15.49,7.74,Bakery,1,,,,,
69f2fa72d0cccad1caf52d80,Farmer's Market Tiramisu Cake (675 g),65e8f30bcb43951cbd853f59,Unknown,15.49,7.74,Bakery,1,,,,,
69f2fa868b75ffca2ac1d4c3,Elite Sweets Domed Tiramisu Cake (700g),65e8f30bcb43951cbd853f59,Unknown,22.99,11.49,Bakery,1,,,,,
69f2fb378b75ffca2ac1d601,Iogo Nano Mango Yogurt Pouches,65e8f30bcb43951cbd853f59,Unknown,4.49,2.25,Dairy & Eggs,2,,,,,
69f2fbad1d0c8306d800787c,Activia Gut Health Plain Probiotic ,65e8f30bcb43951cbd853f59,Unknown,7.1,3.55,Dairy & Eggs,4,,,,,
69f2fcc1a9c0c7b5657fea71,Grass-Fed Boneless Stewing Beef (approx 454 g),65e8f30bcb43951cbd853f59,Unknown,14.99,7.49,Meat & Fish,6,,,,,
69f30094488caf8bed3f5aef,Farmer's Market Old Fashioned Mini Doughnuts (600 g),67bdc806855e4112ad907797,Unknown,6.29,3.14,Bakery,2,,,,,
69f300aa59e216df70342225,Farmer's Market Butter Croissants (270 g),67bdc806855e4112ad907797,Unknown,5.89,2.94,Bakery,1,,,,,
69f300b7834420ea75dd9043,Farmer's Market Banana Chocolate Chunk Muffins (600 g),67bdc806855e4112ad907797,Unknown,7.99,3.99,Bakery,1,,,,,
69f300c459e216df7034225a,Farmer's Market Lemon Poppyseed Iced Loaf Cake (400 g),67bdc806855e4112ad907797,Unknown,6.39,3.19,Bakery,1,,,,,
69f300d8834420ea75dd9078,La Baguetterie Bakery White Baguette (326 g),67bdc806855e4112ad907797,Unknown,3.29,1.64,Bakery,1,,,,,
69f300ec488caf8bed3f5bcf,School Safe Birthday cake mini loaves,67bdc806855e4112ad907797,Unknown,5.29,2.64,Bakery,1,,,,,
69f30115834420ea75dd9122,Farmer's Market Cranberry Lemon Muffins (600 g),67bdc806855e4112ad907797,Unknown,7.99,3.99,Bakery,1,,,,,
69f30123003c189d13f09329,Farmer's Market Cinnamon Swirl Iced Loaf Cake (400 g),67bdc806855e4112ad907797,Unknown,6.39,3.19,Bakery,1,,,,,
69f3012c488caf8bed3f5cac,Farmer's Market Mini Butter Croissants (336 g),67bdc806855e4112ad907797,Unknown,6.39,3.19,Bakery,1,,,,,
69f301e2834420ea75dd9281,Ritz Cheese Nibs Sweet Chili & Sour Cream Crackers (180 g),65e8f30bcb43951cbd853f59,Unknown,4.59,2.29,Snacks,2,,,,,
69f3021b834420ea75dd9306,Farmer's Market Butter Tarts (765 g),65e8f30bcb43951cbd853f59,Unknown,7.79,3.89,Bakery,1,,,,,
69f3025e488caf8bed3f5eef,Quaker Crispy Minis Korean BBQ Flavour Brown Rice Cakes (90 g),65e8f30bcb43951cbd853f59,Unknown,3.69,1.84,Snacks,1,,,,,
69f3029659e216df70342552,Farmer's Market Boston Cream Mini Doughnuts (288 g),65e8f30bcb43951cbd853f59,Unknown,4.99,2.49,Bakery,1,,,,,
69f302c25ce17a2be275a2bd,"""Balady Bread 7"""" Whole Wheat Pita (300 g)""",65e8f30bcb43951cbd853f59,Unknown,3.69,1.84,Bakery,1,,,,,
69f302d2834420ea75dd94bd,Ocean Spray Diet Cran-Lemonade Beverage (1.89 L),65e8f30bcb43951cbd853f59,Unknown,5.29,2.64,Drinks,1,,,,,
69f302f1488caf8bed3f6035,Hidden Valley Sauce à salade crémeuse tzatziki grec / Hidden Valley Greek Tzatziki Creamy Dressing & Dip (473 ml),65e8f30bcb43951cbd853f59,Unknown,5.79,2.89,Pantry,2,,,,,
69f303395ce17a2be275a3c8,Barebells Birthday Cake Protein Bar (55 g),65e8f30bcb43951cbd853f59,Unknown,5.49,2.74,Snacks,1,,,,,
69f303565ce17a2be275a448,Old El Paso Cheesy Taco Seasoning Mix (24 g),65e8f30bcb43951cbd853f59,Unknown,1.59,0.79,Pantry,30,,,,,
69f30377488caf8bed3f61b6,Old El Paso Cheesy Taco Seasoning Mix (24 g),67bdc806855e4112ad907797,Unknown,1.59,0.79,Pantry,28,,,,,
69f3038c59e216df703426cd,Hidden Valley Sauce à salade crémeuse tzatziki grec / Hidden Valley Greek Tzatziki Creamy Dressing & Dip (473 ml),67bdc806855e4112ad907797,Unknown,5.79,2.89,Pantry,3,,,,,
69f303a259e216df703426fb,Gatorade G Fit Tropical Mango (828 ml),67bdc806855e4112ad907797,Unknown,3.99,1.99,Drinks,1,,,,,
69f303b1488caf8bed3f6267,Gatorade G Fit Blackberry Raspberry (828 ml),67bdc806855e4112ad907797,Unknown,3.99,1.99,Drinks,2,,,,,
69f373f3b23f42661a88e7b5,MANDARIN FULLY COOKED BBQ,629cec56061cc278a85326dc,Unknown,11.99,5.99,Meat,1,,,,,
69f374017b870894e9126c9b,DAYSTARTERS SAUSAGE TURKEY,629cec56061cc278a85326dc,Unknown,7.5,3.75,Meat,1,,,,,
69f37856314ec69f2bf2c0ed,PACE MEAT LOVER'S PIZZA,6969181f05a95a3633344338,Unknown,7.79,3.89,HMR,1,,,,,
69f3786e2bbbfe21ae52871f,BONELESS COMBO CHOPS TP,6969181f05a95a3633344338,Unknown,5.98,2.99,Meat,2,,,,,
69f378b57b870894e9135a6a,BEEF STRIPLOIN STEAK BBQ,6969181f05a95a3633344338,Unknown,11.85,5.92,Meat,1,,,,,
69f378d1b23f42661a8a0782,MARC ANGELO BACON WRAPPED BEEF,6969181f05a95a3633344338,Unknown,15.0,7.5,Meat,3,,,,,
69f378f1e96759b7f8255244,NO NAME WIENERS REGULAR,6969181f05a95a3633344338,Unknown,4.5,2.25,Meat,1,,,,,
69f3795c9c6d98450d788b01,SHHR MILD ROAST BEEF PPK,6969181f05a95a3633344338,Unknown,5.94,2.97,Deli,8,,,,,
69f37993314ec69f2bf2fd9a,SUFRA HAL GF STRIP LOIN STEAK,6969181f05a95a3633344338,Unknown,13.66,6.83,Meat,4,,,,,
69f379cdb23f42661a8a4160,BEEF BONELESS STEW BEEF,6969181f05a95a3633344338,Unknown,17.25,8.62,Meat,6,,,,,
69f379f9b23f42661a8a4cb7,PK SHOULDER BLADE STEAKS,6969181f05a95a3633344338,Unknown,8.52,4.26,Meat,8,,,,,
69f37a322bbbfe21ae52daf4,BEEF BRAISING RIB,6969181f05a95a3633344338,Unknown,21.29,10.64,Meat,3,,,,,
69f37a382bbbfe21ae52db95,PC MILD ITALIAN PK SAUSG 500G,6969181f05a95a3633344338,Unknown,8.0,3.89,Meat,8,,,,,
69f37a679f3264739120fc35,SHHR CAJUN TRKY BREAST PPK,6969181f05a95a3633344338,Unknown,7.99,3.99,Deli,18,,,,,
69f37ac19f32647391210a1f,WONDER BREAD SAND WHITE THIN,6969181f05a95a3633344338,Unknown,2.5,1.25,Bakery,5,,,,,
69f37ac92bbbfe21ae52f8ea,LA BAGUETTERIE MICHE SLICED,6969181f05a95a3633344338,Unknown,5.29,2.64,Bakery,1,,,,,
69f37adc7b870894e913d782,SSFE MINI BIRTHDAY CAKE LOAF,6969181f05a95a3633344338,Unknown,5.0,2.5,Bakery,1,,,,,
69f37ae49f32647391210c8b,PC GLUTEN FREE HOT DOG BUNS,6969181f05a95a3633344338,Unknown,5.99,2.99,Bakery,3,,,,,
69f37af4314ec69f2bf33eec,PC GIGANTICO BUNS SAUSAGE,6969181f05a95a3633344338,Unknown,4.69,1.88,Bakery,2,,,,,
69f37b739f3264739121212f,PC GIGANTICO BUNS HAMBURGER,6969181f05a95a3633344338,Unknown,4.69,2.34,Bakery,2,,,,,
69f37b7f9f3264739121226b,Babylos white pita,6969181f05a95a3633344338,Unknown,1.19,0.6,Bakery,1,,,,,
69f37b932bbbfe21ae531e27,PC GIGANTICO BUNS HAMBURGER,6969181f05a95a3633344338,Unknown,4.69,2.34,Bakery,2,,,,,
69f37bbc314ec69f2bf364ed,PC THINS BUNS MULTI GRAIN,6969181f05a95a3633344338,Unknown,4.5,2.25,Bakery,6,,,,,
69f37bdb314ec69f2bf3693c,PC FLATBREAD ORIGINAL,6969181f05a95a3633344338,Unknown,3.79,1.89,Bakery,2,,,,,
69f37c079c6d98450d791015,PC ORIGINAL PIZZA CRUSTS,6969181f05a95a3633344338,Unknown,4.69,2.34,Bakery,4,,,,,
69f37c15314ec69f2bf371cf,FM SANDWICH CROISSANT,6969181f05a95a3633344338,Unknown,5.75,2.3,Bakery,3,,,,,
69f37c38b23f42661a8ad4d9,WONDER BREAD WHITE W FIBRE,6969181f05a95a3633344338,Unknown,2.5,1.25,Bakery,12,,,,,
