item_id,item_name,store_id,store_name,original_price,price,category,stock_0930,stock_1630,stock_2030,change_1,change_2,change_3
672d9fe0ce2a4ce4e780b931,Winx Health Restart Morning After Pill Levonorgestrel 1.5 mg Tablet,66c41b55de1f5583d3c6db69,Unknown,41.99,21.0,Personal Care,10,10,10,0,0,0
677dfd51e9250f1b38627880,Morton & Basset Ground Nutmeg (2.3oz),66c41b55de1f5583d3c6db69,Unknown,16.99,6.8,Pantry,1,1,1,0,0,0
68649894d45286d9ced79f69,Genabio COVID-19 Rapid Self-Test Kit (2 ct),66c41b55200426fac142f110,Unknown,11.69,4.68,Personal Care,8,8,8,0,0,0
6864ac8a26c9413d16dda12e,Banana Boat After Sun Soothing Aloe Gel (16 oz),66c41b55200426fac142f110,Unknown,10.39,4.16,Personal Care,1,1,1,0,0,0
6864b0dbd45286d9ced9740d,Vaseline Healing Petroleum Jelly Original Unscented (1.75 oz),66c41b55200426fac142f110,Unknown,5.19,2.08,Personal Care,5,5,5,0,0,0
6864dca2e76ab7f392b50e37,Plan B One-Step Emergency Contraceptive Tablet,66c41b55200426fac142f110,Unknown,45.99,18.4,Personal Care,1,1,1,0,0,0
687021d0ec9500620a8fa5e3,beech nut,66c41b55de1f5583d3c6db69,Unknown,2.79,1.12,Baby,2,2,2,0,0,0
687a9c2e4b996a2220ad4556,A&W Zero Sugar Soda Root Beer (20 oz),66c41b55de1f5583d3c6db69,Unknown,3.29,1.32,Drinks,1,1,1,0,0,0
68a2d9d5b964b54ef38d2717,Crest 3D White Radiant Mint Fluoride Anticavity Toothpaste (0.85 oz),66c41b55200426fac142f110,Unknown,3.69,1.48,Personal Care,9,9,9,0,0,0
68a2dad6b964b54ef38d2a00,Desitin Maximum Strength Diaper Rash Paste (4 oz),66c41b55200426fac142f110,Unknown,10.29,4.12,Baby,10,10,10,0,0,0
68a2e0cfb964b54ef38d3bc5,Tylenol Childrens Pain and Fever Reliever Grape Oral Suspension (4 oz),66c41b55200426fac142f110,Unknown,14.29,5.72,Medicine,6,6,6,0,0,0
68a2e1099a475e1ca50ae559,Mylicon Infants' Dye-Free Drops Gas Relief Syrup (1 oz),66c41b55200426fac142f110,Unknown,12.89,5.16,Medicine,3,3,3,0,0,0
68a2e12ef3e307fa672b8ce9,Pepto-Bismol Kids Bubble Gum Flavor Chewable Tablets (24ct),66c41b55200426fac142f110,Unknown,11.69,4.68,Medicine,6,6,6,0,0,0
68a2e16df3e307fa672b8d4c,Zarbee's Naturals Children's Sleep Chewable Tablets with Melatonin (30 ct),66c41b55200426fac142f110,Unknown,10.39,4.16,Medicine,4,4,4,0,0,0
68a2e1f5d584e763e3612bc8,Coppertone Baby Pure & Simple SPF 50 100% Mineral Sunscreen Lotion (6 oz),66c41b55200426fac142f110,Unknown,16.89,6.76,Personal Care,2,2,2,0,0,0
68ba4efaddf4c4ea82be1eb8,Nut Harvest Salted Whole Peanuts,66c41b55de1f5583d3c6db69,Unknown,1.99,0.8,Snacks,56,56,56,0,0,0
68ec77666305f489a3dbc1d3,McCormick Oregano Leaves (0.75oz),66c41b55200426fac142f110,Unknown,4.39,2.2,Pantry,3,3,3,0,0,0
68ec7acc6305f489a3dbeb5d,McCormick Black Pepper ,66c41b55200426fac142f110,Unknown,7.99,2.4,Pantry,11,11,11,0,0,0
68ec7bbe16a25ac6c1882c5d,McCormick Chili Powder (2.5 oz),66c41b55200426fac142f110,Unknown,4.89,2.45,Pantry,4,4,4,0,0,0
68f6bcc05c6c2e79c3c8a73e,Suave Deodorant ,66c41b55200426fac142f110,Unknown,2.99,1.5,Personal Care,9,9,9,0,0,0
68feb0bd7cd892ca5617f2e4,Moonglade Craft Soda Organic Root Beer 4 pack,66c41b55de1f5583d3c6db69,Unknown,12.99,5.2,Drinks,3,3,3,0,0,0
690849870a37bb93e974ec28,Cera Ce foaming cleanser ,66c41b55200426fac142f110,Unknown,17.19,6.88,Personal Care,5,5,5,0,0,0
6927fb17c25da3ef8d1c8676,Plan B One-Step Emergency Contraceptive Tablet,66c41b55200426fac142f110,Unknown,45.99,18.4,Personal Care,3,3,3,0,0,0
6938d9c6b9dff1ccb892db41,Mari Wine Vinegar,6915e6d23ab36474aacadcbc,Unknown,1.99,1.0,Grocery,18,18,18,0,0,0
6943df2d00bf04afcf256458,New Creation Krümkake Butter Pecan Cream Soda (12 oz),66c41b55de1f5583d3c6db69,Unknown,1.99,0.8,Drinks,16,16,16,0,0,0
694f2b1dbd714bcff186efc2,Brach's Classic Candy Corn 11 oz,6915e6d23ab36474aacadcbc,Unknown,3.49,1.75,Grocery,4,4,4,0,0,0
6950e4520c79613ef4053c6d,Soy Vay Marinade & Sauce Veri Veri Teriyaki (21 oz),66c41b55200426fac142f110,Unknown,7.19,2.16,Pantry,5,5,5,0,0,0
6950e518bd714bcff1a35da5,Trojan BareSkin Condoms Lubricated Latex (10 ct),66c41b55200426fac142f110,Unknown,14.29,5.72,Personal Care,3,3,2,0,1,1
6950f1ed00bf04afcff346a9,Ghirardelli Premium Brownie Mix Double Chocolate Box (18 oz),66c41b55200426fac142f110,Unknown,7.79,2.34,Pantry,4,4,4,0,0,0
6950f27ca1132e12bce86d8c,Fruit Gushers Snacks Tropical (4.25 oz),66c41b55200426fac142f110,Unknown,2.89,0.87,Snacks,23,23,23,0,0,0
6950f3815e79deb3be798390,Pure Leaf Sweet Real Brewed Iced Tea (64 oz),66c41b55200426fac142f110,Unknown,5.19,2.08,Drinks,6,6,6,0,0,0
6950f5f600bf04afcff34ecf,Smoked Spicy Gouda ,66c41b55200426fac142f110,Unknown,6.99,3.5,Dairy & Eggs,9,9,9,0,0,0
6951a478bd714bcff1b0edc1,Baby Ruth Fun Size Candy Bar 10.2 oz,6915e6d23ab36474aacadcbc,Unknown,6.99,3.49,Grocery,9,9,9,0,0,0
6951a5bd5e79deb3be858f03,Hershey's Snack Size Milk Chocolate 10.35 oz,6915e6d23ab36474aacadcbc,Unknown,6.99,3.49,Grocery,9,9,9,0,0,0
6951bc0d00bf04afcf01da20,Sun Luck Gluten-Free Yum Yum Sauce 13 oz Bottle,6915e6d23ab36474aacadcbc,Unknown,6.99,3.99,Grocery,1,1,1,0,0,0
6951bce900bf04afcf01ed9f,4 Sisters Tony Tomato Rice,6915e6d23ab36474aacadcbc,Unknown,4.49,2.24,Grocery,3,3,3,0,0,0
695328310c79613ef42dfbbc,Absolutely! Gluten Free Grain Free Everything Flatbreads 5.29 oz,6915e6d23ab36474aacadcbc,Unknown,7.99,1.99,Grocery,11,11,11,0,0,0
695402dda1132e12bc23f6a2,Premium Original Saltine Crackers 12 ea,6915e6d23ab36474aacadcbc,Unknown,16.99,4.99,Grocery,3,3,3,0,0,0
695c47a1a1132e12bcbd04b0,La Viuda Sanchez,690a5bff765cb78193ff6130,Unknown,15.99,12.0,Grocery,2,2,2,0,0,0
695f22d34ca25d90756c7fe2,Snapple Kiwi Strawberry 6 pack,66c41b55200426fac142f110,Unknown,6.49,3.25,Drinks,2,2,2,0,0,0
696d590a3e76e9ec14beb727,Amy's Kitchen Bowls Broccoli and Cheddar Bake (9.5 oz),66c41b55de1f5583d3c6db69,Unknown,8.49,5.09,Frozen,9,9,9,0,0,0
696d5d67e4d68b246f3a3689,TRESemme Extra Hold Hairspray 1.5oz can,66c41b55de1f5583d3c6db69,Unknown,3.49,1.4,Personal Care,9,9,9,0,0,0
696d5e163e76e9ec14bf4666,Revlon Colorsilk Permanent Hair Dye Shade 10 Black,66c41b55de1f5583d3c6db69,Unknown,5.49,2.2,Personal Care,5,5,5,0,0,0
696d5f2ff3eeb6c636a71210,Gerber Puffs Blueberry 1.48oz,66c41b55de1f5583d3c6db69,Unknown,4.29,1.29,Baby,1,1,1,0,0,0
696e129372737f94913f008a,Lucas Polvos Watermelon Flavored Candy,66c41b55de1f5583d3c6db69,Unknown,0.99,0.3,Candy,1,1,1,0,0,0
696e12bae4d68b246f448600,AI Freeze Dried Nerdy Bursts Candy (1 oz),66c41b55de1f5583d3c6db69,Unknown,6.29,1.89,Candy,3,3,3,0,0,0
696f547b3e76e9ec14e27b0e,U by Kotex Click Compact Super Plus Unscented Tampons (16 ct),66c41b55de1f5583d3c6db69,Unknown,9.09,3.64,Personal Care,6,6,6,0,0,0
696f5542e4d68b246f61cac2,"""Equalline Small 2""""x2"""" Sterile Gauze Pads (25ct)""",66c41b55de1f5583d3c6db69,Unknown,3.99,1.6,Other,1,1,1,0,0,0
6973ed7e3695546c5d1067d6,cooked shrimp,66c41b55200426fac142f110,Unknown,12.99,7.79,Frozen,9,9,9,0,0,0
6973eda74bb7d7af11bb5369,orange sherbet ice cream,66c41b55200426fac142f110,Unknown,5.99,2.4,Ice Cream,2,2,2,0,0,0
6973ee067717e37fa64549a2,GF chicken tenders ,66c41b55200426fac142f110,Unknown,8.99,5.39,Frozen,11,11,11,0,0,0
697d8c8bd0ddd9320a939eeb,Bolci Dubai Chocolate Bar ,66c41b55de1f5583d3c6db69,Unknown,14.79,4.44,Candy,133,133,133,0,0,0
697fc425861645b84c5c497f,Lean Cuisine Apple Cranberry Chicken Ready Meal (9oz),66c41b55de1f5583d3c6db69,Unknown,4.49,2.69,Frozen,8,8,8,0,0,0
6988e3fe60a3aaa4970d02df,Minute Maid Juice Fruit Punch (59 oz),66c41b55de1f5583d3c6db69,Unknown,2.99,2.09,Drinks,6,6,6,0,0,0
6988ec0038ce139b25f5ed42,damaged Kool Aid Bursts Soda Berry Blue Artificially Flavored (6.75 oz x 6 ct),66c41b55de1f5583d3c6db69,Unknown,3.29,1.97,Drinks,1,1,1,0,0,0
6988ec1910bcc888933c15bb,solo pomodoro mutti Parma sauce for pizza Napoli,66c41b55de1f5583d3c6db69,Unknown,6.99,4.19,Pantry,1,1,1,0,0,0
6988ec4738ce139b25f5f7a5,Popcorners White Cheddar Popped-Corn Snack (7oz),66c41b55de1f5583d3c6db69,Unknown,6.39,4.47,Snacks,1,1,1,0,0,0
6988ec5b10bcc888933c2058,La Costena Pickled Jalapeno Peppers (26 oz),66c41b55de1f5583d3c6db69,Unknown,3.89,2.51,Pantry,1,1,1,0,0,0
6988ec71631683bc346d8f0d,Orville Redenbacher's Popcorn Kettle Corn (3.29 oz x 6 ct),66c41b55de1f5583d3c6db69,Unknown,7.79,2.34,Snacks,2,2,2,0,0,0
6988ed9f10bcc888933c5453,Arrowhead 100% Mountain Spring Water Plastic Bottles (16.9 oz x 6 ct),66c41b55de1f5583d3c6db69,Unknown,3.89,2.33,Drinks,1,1,1,0,0,0
698dffab3887249b9e49aa11,Snack Factory Pretzel Crisps Garlic Parmesan (7.2 oz),66c41b55de1f5583d3c6db69,Unknown,4.59,2.41,Snacks,10,10,10,0,0,0
698dffab9f2f71d05b158346,Gulden's Spicy Brown Mustard (12 oz),66c41b55de1f5583d3c6db69,Unknown,4.59,2.75,Pantry,9,9,9,0,0,0
