item_id,item_name,store_id,store_name,original_price,price,category,stock_0930,stock_1630,stock_2030,change_1,change_2,change_3
68213c05b14699806189b2b0,Wildrose Herbal D-TOX Kit 12day Program,67ffcc6581edee2219c54e94,Unknown,64.99,54.99,Health & Wellness,9,,,,,
682bbc06c8802244e1542253,Banat Toothbrush Pack Of 2,67ffcc6581edee2219c54e94,Unknown,4.99,2.99,Grocery,6,,,,,
682bbe4326bdd6612a51d31e,Auroshikha 18 Fragrance (Mini Palette),67ffcc6581edee2219c54e94,Unknown,10.99,4.99,Grocery,4,,,,,
682bbf183e6e6efab73a3fb7,Meditation Incense Cones,67ffcc6581edee2219c54e94,Unknown,12.99,6.99,Grocery,8,,,,,
6850875cf14056777f0acbd8,Desert Essence Red Raspberry Shampoo 237ml,67ffcc6581edee2219c54e94,Unknown,15.99,7.99,Grocery,2,,,,,
6869b846e76ab7f39234f42b,Sour Strips Green Apple,685f076cae659ef8e57956fc,Unknown,8.99,7.99,Snacks & Drinks,3,,,,,
6869b8b6e76ab7f3923502a3,Sour Strips Strawberry,685f076cae659ef8e57956fc,Unknown,8.99,7.99,Snacks & Drinks,4,,,,,
6869b96c26c9413d166fc310,Sour Strips Watermelon,685f076cae659ef8e57956fc,Unknown,8.99,7.99,Snacks & Drinks,1,,,,,
6869b9bdd45286d9ce5ea147,Sour Strips Tropical Mango,685f076cae659ef8e57956fc,Unknown,8.99,7.99,Snacks & Drinks,1,,,,,
6869ba9ee76ab7f392353a9d,Sour Strips Pink Lemonade,685f076cae659ef8e57956fc,Unknown,8.99,7.99,Snacks & Drinks,5,,,,,
6869bae4d45286d9ce5ec328,Sour Strips Wild Cherry,685f076cae659ef8e57956fc,Unknown,8.99,7.99,Snacks & Drinks,3,,,,,
686af3f226c9413d168f16fa,Pringles Original Party Pack,685f076cae659ef8e57956fc,Unknown,5.99,5.5,Snacks & Drinks,4,,,,,
68a523bee4d63010325aea25,Herbafresh Dead Sea Bath Salt 500g,67ffcc6581edee2219c54e94,Unknown,8.99,3.99,Grocery,15,,,,,
68bc5e026e06f3f1d9451757,L'Oreal Paris Feria Smokey Silver S1 Silver Grey Permanent Hair Dye Kit (1 ct),65e8f30bcb43951cbd853f59,Unknown,21.29,10.65,Beauty,1,,,,,
691f6eb770ccf1c96852c9f3,Coconut Cashews,691b59a5669ef62168a65bdb,Unknown,3.5,2.0,Nuts & Snacks,20,,,,,
692b87b2ddfa836f5a2ef579,CanadaDry Tonic Water,65e8f30bcb43951cbd853f59,Unknown,2.0,1.0,Drinks,4,,,,,
692e5b5c7aaefcde17875128,Everland Himalayan Crystal Salt 500g,67ffcc6581edee2219c54e94,Unknown,5.99,2.99,Grocery,6,,,,,
695807500c79613ef47ed200,Pretzel Pzazz Sour Cream & Chive,685f076cae659ef8e57956fc,Unknown,4.49,3.49,Snacks & Drinks,2,,,,,
695807dba1132e12bc69c1a4,Haribo Peaches,685f076cae659ef8e57956fc,Unknown,4.79,4.19,Snacks & Drinks,6,,,,,
695809afa1132e12bc6a0f28,Trolli Sweet Peach,685f076cae659ef8e57956fc,Unknown,4.49,3.69,Snacks & Drinks,8,,,,,
69580a580c79613ef47f3b0e,Arizona Fruit Snacks,685f076cae659ef8e57956fc,Unknown,5.79,4.29,Snacks & Drinks,4,,,,,
696de627f3eeb6c636b06463,Gits Sambhar Mix (100 g),65e8f30bcb43951cbd853f59,Unknown,2.39,1.19,Pantry,1,,,,,
69714698a0eb91f622f82d6c,Whisky Kiss Almonds,691b59a5669ef62168a65bdb,Unknown,3.5,2.0,Nuts & Snacks,34,,,,,
697146fbe2f09d0b9327b973,Salted Caramel Cashew,691b59a5669ef62168a65bdb,Unknown,3.5,2.0,Nuts & Snacks,22,,,,,
6971473140e632216a673804,Butter Toffee Almonds,691b59a5669ef62168a65bdb,Unknown,3.5,2.0,Nuts & Snacks,20,,,,,
6971479b40e632216a6747a2,Durian Choco Dipped Almonds,691b59a5669ef62168a65bdb,Unknown,4.5,3.5,Nuts & Snacks,16,,,,,
697147e9077af9138bbd2b71,Strawberry Choco Dipped Almonds,691b59a5669ef62168a65bdb,Unknown,4.5,3.5,Nuts & Snacks,12,,,,,
6971481f077af9138bbd30d3,Matcha Choco Dipped Almonds,691b59a5669ef62168a65bdb,Unknown,4.5,3.5,Nuts & Snacks,8,,,,,
697148999f875680704e521a,Choco Salted Caramel Cashews,691b59a5669ef62168a65bdb,Unknown,4.5,3.5,Nuts & Snacks,11,,,,,
6976ba764bb7d7af11f788f7,New World Almond Butter Crunchy Roasted 500g,67ffcc6581edee2219c54e94,Unknown,14.99,9.99,Grocery,45,,,,,
6976bb2dcf5c56b4f1144310,Bestropics Coconut Smoothie 355ml,67ffcc6581edee2219c54e94,Unknown,3.49,1.99,Beverages,49,,,,,
6976bbec7717e37fa681e259,Karma Sparkling Watermelon Hydration Drink 285ml,67ffcc6581edee2219c54e94,Unknown,3.99,1.99,Beverages,25,,,,,
6976bc9ccf5c56b4f114614f,Karma Sparkling Grape Hydration Drink 285ml,67ffcc6581edee2219c54e94,Unknown,3.99,1.99,Beverages,24,,,,,
6976bce23695546c5d4594c5,Karma Apple Soda 285ml,67ffcc6581edee2219c54e94,Unknown,3.99,1.99,Beverages,24,,,,,
6976bd304e0f1abfeaaeefcf,Karma Berry Soda 285ml,67ffcc6581edee2219c54e94,Unknown,3.99,1.99,Beverages,28,,,,,
6981b06c865b087577e6a294,Kraft Calorie-Wise Catalina Dressing (425 ml),65e8f30bcb43951cbd853f59,Unknown,4.49,2.24,Pantry,9,,,,,
6981b0a5d0ddd9320ae3b5f4,Carnaby Sweet Sour Watermelon Syrup (428 ml),65e8f30bcb43951cbd853f59,Unknown,5.49,2.74,Pantry,11,,,,,
6981b13fd0ddd9320ae3b689,Greetalia Honey Dill Sauce (500ml),65e8f30bcb43951cbd853f59,Unknown,4.7,2.35,Easy Meals,3,,,,,
6981b184865b087577e6a5df,Kraft Stove Top Lower Sodium Chicken Stuffing Mix (120 g),65e8f30bcb43951cbd853f59,Unknown,2.89,1.44,Pantry,3,,,,,
6981b348861645b84c82754e,Mama Sita's Tocino Marinating Mix (75 g),67bdc806855e4112ad907797,Unknown,1.89,0.94,Pantry,14,,,,,
6981b348ee5a6123d41bf74e,Carnaby Sweet Sour Watermelon Syrup (428 ml),67bdc806855e4112ad907797,Unknown,5.49,2.74,Pantry,11,,,,,
6981b351ee5a6123d41bf76f,Greetalia Honey Dill sauce,67bdc806855e4112ad907797,Unknown,4.99,2.5,Pantry,2,,,,,
6982f85b861645b84c9e0c87,Carnaby Sweet Cotton Candy Syrup (428 ml),65e8f30bcb43951cbd853f59,Unknown,5.49,2.74,Pantry,6,,,,,
6982fcea861645b84c9e1ba9,Carnaby Sweet Cotton Candy Syrup (428 ml),65e8f30bcb43951cbd853f59,Unknown,5.49,2.74,Pantry,6,,,,,
6982fcfb861645b84c9e1bfd,Gatorade Zero Lemon-Lime Powder Packets (10 ct),65e8f30bcb43951cbd853f59,Unknown,9.99,4.99,Drinks,5,,,,,
698301c4865b08757701d107,Carnaby Sweet Cotton Candy Syrup (428 ml),67bdc806855e4112ad907797,Unknown,5.49,2.74,Pantry,10,,,,,
6984486b861645b84cbaf00d,Mama Sita's Caldereta Spicy Sauce Mix (50 g),65e8f30bcb43951cbd853f59,Unknown,1.89,0.94,Pantry,21,,,,,
698448a5d0ddd9320a1a6514,Knorr Zero Salt Roasted Garlic Bouillon Powder (160 g),65e8f30bcb43951cbd853f59,Unknown,9.29,4.64,Pantry,7,,,,,
69845853e9a0a7e95df67630,Kraft Calorie-Wise Catalina Dressing (425 ml),67bdc806855e4112ad907797,Unknown,4.49,2.24,Pantry,9,,,,,
69845853e9a0a7e95df6763d,Knorr Zero Salt Roasted Garlic Bouillon Powder (160 g),67bdc806855e4112ad907797,Unknown,9.29,4.64,Pantry,6,,,,,
6984d7afee5a6123d46250de,Mixed Frozen Pastry  3 Pc,67e6b1577b5f59b1bba8c7c4,Unknown,20.0,5.0,Pizza Dough,2,,,,,
6984d853e9a0a7e95dffd353,2 Pizza Dough FRESH,67e6b1577b5f59b1bba8c7c4,Unknown,12.0,4.99,Pizza Dough,8,,,,,
6984d8d7ee5a6123d4628adf,1 Mixed Artisan Frozen,67e6b1577b5f59b1bba8c7c4,Unknown,6.99,2.0,Sourdough,2,,,,,
6984d96dee5a6123d462a3da,"250 Ml Soup ,1 Loaf Bread  , Croissant",67e6b1577b5f59b1bba8c7c4,Unknown,18.0,9.0,Pizza Dough,7,,,,,
6985991c865b08757739c1c8,Taco Bell Mild Taco Seasoning Mix (28 g),65e8f30bcb43951cbd853f59,Unknown,1.79,0.89,Pantry,3,,,,,
6985992fd0ddd9320a36731d,PAM No-Stick Air Fryer Cooking Spray (141 g),65e8f30bcb43951cbd853f59,Unknown,7.29,3.64,Pantry,7,,,,,
69859c26ee5a6123d4782428,Kraft Zesty Italian Dressing (425 ml),65e8f30bcb43951cbd853f59,Unknown,4.49,2.24,Pantry,4,,,,,
69859fe3e9a0a7e95d158c88,PAM No-Stick Air Fryer Cooking Spray (141 g),67bdc806855e4112ad907797,Unknown,7.29,3.64,Pantry,4,,,,,
6985a013e9a0a7e95d158d0f,Knorr Zero Salt Beef Bouillon Powder (160 g),67bdc806855e4112ad907797,Unknown,9.29,4.64,Pantry,6,,,,,
6985a050d0ddd9320a3692bb,Taco Bell Mild Taco Seasoning Mix (28 g),67bdc806855e4112ad907797,Unknown,1.79,0.89,Pantry,7,,,,,
6986e8e860a3aaa497e27c54,Knorr Poudre de bouillon de bœuf sans sel / Zero Salt Beef Bouillon Powder (160 g),65e8f30bcb43951cbd853f59,Unknown,9.29,4.64,Pantry,10,,,,,
6989925138ce139b25038e07,Club House La Grille Spicy Montreal Steak Spice Seasoning (157 g),65e8f30bcb43951cbd853f59,Unknown,7.59,3.79,Pantry,1,,,,,
698a6de210bcc888935c3465,Dark Choco Gingers,691b59a5669ef62168a65bdb,Unknown,4.5,3.0,Nuts & Snacks,9,,,,,
698a6f4260a3aaa497307211,Fancy Nut Mix,691b59a5669ef62168a65bdb,Unknown,15.0,11.0,Nuts & Snacks,3,,,,,
698a6fc110bcc888935c6c25,Inshell Peanuts Salted,691b59a5669ef62168a65bdb,Unknown,4.0,2.5,Nuts & Snacks,6,,,,,
698c2ea85f6e0bbdf062e31a,WAKEMAKE Water Glow Coating Foundation #23 Beige (30 ml),65e8f30bcb43951cbd853f59,Unknown,39.99,19.99,Beauty,3,,,,,
698c2f0d730afb77e7253193,Little Sheep Plain Hot Pot Soup Base (130 g),65e8f30bcb43951cbd853f59,Unknown,6.39,3.19,Pantry,7,,,,,
698c3f25730afb77e72565ec,WAKEMAKE Water Glow Coating Foundation #23 Beige (30 ml),67bdc806855e4112ad907797,Unknown,39.99,19.99,Beauty,2,,,,,
698c3f25cef1e3f1e10f49af,Little Sheep Plain Hot Pot Soup Base (130 g),67bdc806855e4112ad907797,Unknown,6.39,3.19,Pantry,17,,,,,
698d861f9f2f71d05b103a2e,Taco Bell Mild Sauce (207 ml),65e8f30bcb43951cbd853f59,Unknown,4.29,2.14,Pantry,13,,,,,
698f49f4b00680d6ddef4fed,marine box seaweed snacks,5ddef30c9af4e045c44b9d67,Unknown,7.99,3.99,Grocery,5,,,,,
698f94792e0c6b02d5d00d6d,soup mix,65bd257956f2d4f45a3da0e2,Unknown,2.0,1.0,Grocery,1,,,,,
698f97126b722fca3c676d2d,Clamato Extra Spicy Rimmer,65bd257956f2d4f45a3da0e2,Unknown,4.99,2.49,Centre of Store,4,,,,,
698f973b6b722fca3c67762d,Clamato Chunky Pub Style Rimmer,65bd257956f2d4f45a3da0e2,Unknown,4.99,2.49,Centre of Store,6,,,,,
698f974aef2f3a8ea588e559,Clamato Rimmer,65bd257956f2d4f45a3da0e2,Unknown,4.99,2.49,Centre of Store,4,,,,,
698f97e11af04775da117eea,Single Strength Lime Juice,65bd257956f2d4f45a3da0e2,Unknown,2.99,1.49,Centre of Store,6,,,,,
69902a8419ce08acfab607e0,Mother's Recipe Mixed Pickle (500 g),65e8f30bcb43951cbd853f59,Unknown,4.49,2.24,Pantry,4,,,,,
6990a4dc23539fc0dede8364,Life Brand Extra Strength Ibuprofen,65e8f30bcb43951cbd853f59,Unknown,8.19,4.1,Medicine,4,,,,,
6990a5f7f3da2e15883cfdb8,Clearblue Digital & Visual Pregnancy Test Combo Pack (2 ct),65e8f30bcb43951cbd853f59,Unknown,24.99,24.99,Personal Care,1,,,,,
69941f4e36a8b368c3dacd2b,Taco Bell Crunchy Taco Cravings Kit (260 g),65e8f30bcb43951cbd853f59,Unknown,5.79,2.89,Pantry,5,,,,,
69956973c9e320d4254176ac,Cerelac Honey & Wheat with Milk Baby Cereal (400 g),65e8f30bcb43951cbd853f59,Unknown,11.89,5.94,Baby,5,,,,,
69956b327da7af90d30c4fc5,Super Q Golden Bihon Cornstarch Sticks (454 g),67bdc806855e4112ad907797,Unknown,2.69,1.34,Pantry,5,,,,,
6996bdf1a8e94948047832db,Maple Leaf Flakes of Turkey (156 g),65e8f30bcb43951cbd853f59,Unknown,4.29,2.14,Pantry,13,,,,,
6996be64ab5d5abe6dd9ee53,Hershey's Chipits Chips de caramel au beurre / Butterscotch Chips (270 g),65e8f30bcb43951cbd853f59,Unknown,6.99,3.49,Pantry,4,,,,,
6996c1b738830975c28424e6,Maple Leaf Flakes of Turkey (156 g),67bdc806855e4112ad907797,Unknown,4.29,2.14,Pantry,8,,,,,
69980c5a8e5e05cc772d2ff1,WAKEMAKE Defining Cover Concealer #13 Porcelain (6 g),67bdc806855e4112ad907797,Unknown,14.99,7.49,Beauty,3,,,,,
69980c5b38830975c2a02e5f,Taco Bell Soft Taco Cravings Kit (420 g),67bdc806855e4112ad907797,Unknown,5.79,2.89,Pantry,5,,,,,
69980ce91e537211774a0f00,Tuna Helper Au Gratin Pasta Kit (206 g),65e8f30bcb43951cbd853f59,Unknown,3.39,1.69,Pantry,8,,,,,
69980eec8e5e05cc772d3b2c,Betty Crocker Reese's Mini Pieces Cookie Mix (337 g),65e8f30bcb43951cbd853f59,Unknown,4.79,2.39,Pantry,8,,,,,
69980f201e537211774a16ba,WAKEMAKE Defining Cover Concealer #13 Porcelain (6 g),65e8f30bcb43951cbd853f59,Unknown,14.99,7.49,Beauty,2,,,,,
699810c9ab5d5abe6df7a24e,Betty Crocker Reese's Mini Pieces Cookie Mix (337 g),65e8f30bcb43951cbd853f59,Unknown,4.79,2.39,Pantry,7,,,,,
69981141ab5d5abe6df7a4c8,Taco Bell Soft Taco Cravings Kit (420 g),65e8f30bcb43951cbd853f59,Unknown,5.79,2.89,Pantry,12,,,,,
6999164e38830975c2be86ec,Garnier Belle Color: ColorEase Creme 11 Very Intense Black Permanent Hair Dye Kit (1 ct),65e8f30bcb43951cbd853f59,Unknown,11.29,5.64,Beauty,1,,,,,
699917b48e5e05cc774e386f,Haldiram's Snacks Chatpata Dal (150 g),65e8f30bcb43951cbd853f59,Unknown,2.39,1.19,Snacks,12,,,,,
699962e6ab5d5abe6d1b312e,Leclerc White Glaze Drizzle Birthday Cake Mini Cookies (200 g),67bdc806855e4112ad907797,Unknown,5.89,2.94,Snacks,10,,,,,
699964da8e5e05cc775256fb,Sunfeast Yippee! Magic Masala Noodles Multipack (280 g),65e8f30bcb43951cbd853f59,Unknown,2.69,1.34,Pantry,20,,,,,
6999675f1e537211776c9edc,Leclerc White Glaze Drizzle Birthday Cake Mini Cookies (200 g),65e8f30bcb43951cbd853f59,Unknown,5.89,2.94,Snacks,7,,,,,
699ab8db8e5e05cc77706f93,Surati Chakri/Muruku Extruded Flour Twist Snacks (250 g),67bdc806855e4112ad907797,Unknown,3.49,1.74,Snacks,2,,,,,
699ab8f01e5372117788d7de,Taco Bell Crunchy & Soft Taco Cravings Kit (370 g),67bdc806855e4112ad907797,Unknown,5.79,2.89,Pantry,1,,,,,
699c0562a8e9494804e7a4de,Leclerc White Glaze Drizzle Cookies & Creme Mini Cookies (200 g),65e8f30bcb43951cbd853f59,Unknown,5.99,2.99,Snacks,9,,,,,
699c0cfbab5d5abe6d544af3,Gatorade Water (1 L),67bdc806855e4112ad907797,Unknown,4.09,2.04,Drinks,10,,,,,
699c0e21a8e9494804e7bcfd,Leclerc White Glaze Drizzle Cookies & Creme Mini Cookies (200 g),67bdc806855e4112ad907797,Unknown,5.99,2.99,Snacks,8,,,,,
699d56241e53721177bfda66,Kit Kat Pops Box (70 g),67bdc806855e4112ad907797,Unknown,3.29,1.64,Candy,3,,,,,
699d5a0638830975c212feda,Kit Kat Pops Box (70 g),65e8f30bcb43951cbd853f59,Unknown,3.29,1.64,Candy,6,,,,,
699ea76c6e6a45b075d64b12,Baken-Ets Hot 'N Spicy Pork Rinds (70 g),65e8f30bcb43951cbd853f59,Unknown,3.29,1.64,Snacks,1,,,,,
699ea7cc3523a0e94c0686cf,Kraft Creamy Poppy Seed Dressing (425 ml),65e8f30bcb43951cbd853f59,Unknown,4.49,2.24,Pantry,6,,,,,
699ead1c6e6a45b075d66039,Kraft Creamy Poppy Seed Dressing (425 ml),67bdc806855e4112ad907797,Unknown,4.49,2.24,Pantry,1,,,,,
699ffd53764a4317ab60f3b7,Reese's Puffs Jumbo Cereal (884 g),65e8f30bcb43951cbd853f59,Unknown,12.29,6.14,Pantry,1,,,,,
69a0003cbd948ea62253d8ec,Carnaby Sweet Dirt & Worms Ice Cream & Dessert Topping (100 g),67bdc806855e4112ad907797,Unknown,3.89,1.94,Pantry,6,,,,,
69a00167bd948ea62253dbed,Derlea Foods Turmeric Puree (120 g),65e8f30bcb43951cbd853f59,Unknown,3.99,1.99,Pantry,4,,,,,
69a001c5764a4317ab610232,Nesquik Loaded with Vanilla Creme Filling Cereal (368 g),65e8f30bcb43951cbd853f59,Unknown,5.89,2.94,Pantry,6,,,,,
69a001f6c0df151e7575b546,Carnaby Sweet Dirt & Worms Ice Cream & Dessert Topping (100 g),65e8f30bcb43951cbd853f59,Unknown,3.89,1.94,Pantry,7,,,,,
69a0804dda60c9dfbdad038a,Soft Drink Go Bananas,629cec56061cc278a85326dc,Unknown,1.0,0.5,Centre of Store,43,,,,,
69a084b0bd96ba29c98f9ba0,Feastable Milk Chocolate 35g,69379713a3687e3a3db2d8bc,Unknown,2.69,1.0,Grocery,9,,,,,
69a146c4bd948ea6226e693d,Yoggu! Original (450 g),65e8f30bcb43951cbd853f59,Unknown,9.99,4.99,Dairy & Eggs,2,,,,,
69a149f994d00ccc15395367,Polysporin Original Antibiotic Cream (30 g),65e8f30bcb43951cbd853f59,Unknown,15.59,7.79,Medicine,3,,,,,
69a14a44764a4317ab7ef2f9,Mama Pork Instant Noodles (60 g x 5 pk),65e8f30bcb43951cbd853f59,Unknown,4.69,2.34,Pantry,1,,,,,
69a1502594d00ccc15396f58,Old El Paso Smart Fiesta Taco Seasoning Mix (24 g),67bdc806855e4112ad907797,Unknown,1.89,0.94,Pantry,4,,,,,
69a1cb3bd1ed9322f74d2bc7,Butterball Turkey Bacon style,64a6b9d71e02c66732c06f33,Unknown,8.5,4.25,Meat,2,,,,,
69a1f05fe83bf78a3f5830a8,All-Beef Wieners,5ddef30c9af4e045c44b9d67,Unknown,6.99,2.5,Meat,9,,,,,
69a29da642f1b200d4ed9307,Gatorade G Fit Blackberry Raspberry (828 ml),65e8f30bcb43951cbd853f59,Unknown,3.99,1.99,Drinks,1,,,,,
69a2a0d4b21135ee52dd024e,Kraft Vinaigrette Ranch aux Trois Fromages / Three Cheese Ranch Dressing (425 ml),67bdc806855e4112ad907797,Unknown,4.49,2.24,Pantry,2,,,,,
69a2a39c5c370550ffc1cdfb,Astro Snacks Freeze-Dried Chamoy & Tajin Skittles Candy (110 g),67bdc806855e4112ad907797,Unknown,12.99,6.49,Candy,9,,,,,
69a3cca92b0bd254a2f9762c,Mixed Produce Box #2,61c39e3eb18e950dea37d276,Unknown,5.0,5.0,Produce,1,,,,,
69a3d094e83bf78a3fba9703,Mixed Produce Box #6,61c39e3eb18e950dea37d276,Unknown,5.0,5.0,Produce,1,,,,,
69a3d0ab05a3271aa5313509,Mixed Produce Box #8,61c39e3eb18e950dea37d276,Unknown,5.0,5.0,Produce,1,,,,,
69a3e74842f1b200d4070e3a,Yoplait Source Protien 0% Strawberry Yogurt (650 g),65e8f30bcb43951cbd853f59,Unknown,4.99,2.49,Dairy & Eggs,1,,,,,
69a3ea74b21135ee52f66112,Foodaholic Nourishing Sepia Color Cream 1min 7N Natural Brown Hair Dye (60 g),65e8f30bcb43951cbd853f59,Unknown,7.99,3.99,Beauty,10,,,,,
69a3f43d42f1b200d4074555,Cholula Chipotle Hot Sauce (150 ml),67bdc806855e4112ad907797,Unknown,6.99,3.49,Pantry,5,,,,,
69a46cd5e83bf78a3fd6c189,Fresh Indian Herb Blend,5fac3e09d7528a3c966b13d0,Unknown,3.0,1.5,Produce,6,,,,,
69a46d3b05a3271aa54d14f2,Fresh Thai Herb Blend,5fac3e09d7528a3c966b13d0,Unknown,3.0,1.5,Produce,4,,,,,
69a4ef968ea43dd0604035a8,Mixed Produce Box #103,5d0bd76c8894a4ebbfd704b8,Unknown,5.0,5.0,Produce,1,,,,,
69a4f0f8e83bf78a3ffc00c5,Mixed Produce Box #110,5d0bd76c8894a4ebbfd704b8,Unknown,5.0,5.0,Produce,1,,,,,
69a4f1368ea43dd06040767f,Fruit Box #1,5d0bd76c8894a4ebbfd704b8,Unknown,5.0,5.0,Produce,1,,,,,
69a4f1cde83bf78a3ffc2047,Fruit Box #5,5d0bd76c8894a4ebbfd704b8,Unknown,5.0,5.0,Produce,1,,,,,
69a4f22e8ea43dd06040968c,Fruit Box #8,5d0bd76c8894a4ebbfd704b8,Unknown,5.0,5.0,Produce,1,,,,,
69a5178742f1b200d41eb7fb,Mixed Produce Bundle #30,65e8f30bcb43951cbd853f59,Unknown,5.0,5.0,Produce,1,,,,,
69a53b9b42f1b200d41fbeb5,Iogo Duo Strawberry Peach Creamy Yogurt (650 g),65e8f30bcb43951cbd853f59,Unknown,4.99,2.49,Dairy & Eggs,2,,,,,
69a53be642f1b200d41fbfd6,Clean Gourmet Fully Cooked Sweet Pepper Chicken Sausages (375 g),65e8f30bcb43951cbd853f59,Unknown,8.4,4.2,Meat & Fish,5,,,,,
69a5400542f1b200d41fcf92,Sun Bum SPF 30 Premium Sunscreen Lotion (177 ml),67bdc806855e4112ad907797,Unknown,19.99,9.99,Beauty,2,,,,,
69a540055c370550fff51353,Emergen-C Immune Support Strawberry Crystals (24 ct),67bdc806855e4112ad907797,Unknown,20.89,10.44,Vitamins&Supplements,3,,,,,
69a540055c370550fff5135c,Children's Advil Fever & Pain Relief Fruit Flavour Oral Suspension Liquid (100 ml),67bdc806855e4112ad907797,Unknown,12.99,6.49,Medicine,4,,,,,
69a54005b21135ee520f26eb,Buckley's Mucus & Phlegm Fast Relief Cough Syrup (250 ml),67bdc806855e4112ad907797,Unknown,21.29,10.64,Medicine,1,,,,,
69a54005eaa699e29612d9c5,Durex Play 2-in-1 Ylang Ylang Massage Lubricant (200 ml),67bdc806855e4112ad907797,Unknown,19.99,9.99,Personal Care,2,,,,,
69a54006eaa699e29612d9d2,Durex Play 2-in-1 Aloe Vera Massage Lubricant (200 ml),67bdc806855e4112ad907797,Unknown,19.99,9.99,Personal Care,1,,,,,
69a540a942f1b200d41fd142,"Alpo Cookout Classics Pork, Beef, Chicken, & Veggie Dog Food (7.2 kg)",67bdc806855e4112ad907797,Unknown,26.29,13.14,Pet Care,2,,,,,
69a540d5da92734cc0777901,Purina One +Plus Healthy Puppy Lamb Dry Puppy Food (6 kg),67bdc806855e4112ad907797,Unknown,39.49,19.74,Other,2,,,,,
69a54189b21135ee520f2b7b,Purina One Microbiome Balance Chicken & Rice Dry Dog Food (1.81 kg),67bdc806855e4112ad907797,Unknown,15.59,7.79,Pet Care,1,,,,,
69a541b85c370550fff51825,Beneful Originals Dry Dog Food with Real Chicken (7 kg),67bdc806855e4112ad907797,Unknown,33.29,16.64,Pet Care,2,,,,,
69a541e642f1b200d41fd544,Gatorade Zero Orange Powder Packets (10 ct),65e8f30bcb43951cbd853f59,Unknown,9.59,4.79,Vitamins&Supplements,5,,,,,
69a5420142f1b200d41fd5ac,Astro Snacks Freeze-Dried Caramel M&M's Candy (70 g),65e8f30bcb43951cbd853f59,Unknown,11.99,5.99,Candy,2,,,,,
69a545015c370550fff522f1,Gatorade Zero Orange Powder Packets (10 ct),67bdc806855e4112ad907797,Unknown,9.59,4.79,Vitamins&Supplements,4,,,,,
69a54560eaa699e29612ebd5,Clif Bar Chocolate Almond Fudge (68 g),67bdc806855e4112ad907797,Unknown,3.39,1.69,Snacks,2,,,,,
69a54706da92734cc0778d9c,Motrin Regular Strength Ibuprofen Liquid Gel Capsules (16 ct),65e8f30bcb43951cbd853f59,Unknown,7.79,3.89,Medicine,2,,,,,
69a547465c370550fff527db,Nature's Way Fruit Flavoured Vitamin D3 Gummies (60 ct),65e8f30bcb43951cbd853f59,Unknown,14.79,7.39,Vitamins&Supplements,1,,,,,
69a5477d42f1b200d41fe52f,Kit Kat Chunky Drumstick Chocolate Bar (44 g),65e8f30bcb43951cbd853f59,Unknown,2.19,1.09,Candy,5,,,,,
69a56877c0f5d697ba6ab0cb,Mixed Produce Box #17,5d0bd76b8894a4ebbfd7048a,Unknown,1.0,1.0,Produce,1,,,,,
69a568bd26961ccd2513530b,Mixed Produce Box #31,5d0bd76b8894a4ebbfd7048a,Unknown,1.0,1.0,Produce,1,,,,,
69a59356c0f5d697ba733b42,Mixed Produce Box #64,5d0bd76b8894a4ebbfd7048a,Unknown,1.0,1.0,Produce,1,,,,,
69a5b6faef4f6821c97bb749,Mixed Produce Box #2,629cec56061cc278a85326dc,Unknown,5.0,5.0,Produce,1,,,,,
69a5de35d5cafd97c2cdf9f6,"Sour Cream Dip, French Onion",5d0bd76b8894a4ebbfd7048a,Unknown,3.19,1.2,Dairy and Eggs,10,,,,,
69a5e527a7c94f56e4183fa7,Outside Round Steak,64a6b9d71e02c66732c06f33,Unknown,11.24,5.62,Beef,1,,,,,
69a5e568c84b98d3a1c0832c,Outside Round Steak,64a6b9d71e02c66732c06f33,Unknown,12.82,6.41,Beef,1,,,,,
69a5e58bc84b98d3a1c08d89,Outside Round Steak,64a6b9d71e02c66732c06f33,Unknown,11.57,5.78,Beef,1,,,,,
69a5e5a695f323af589189eb,Outside Round Steak,64a6b9d71e02c66732c06f33,Unknown,11.77,5.88,Beef,1,,,,,
69a5e670a7c94f56e4189d31,Seasoned Pork Loin Roast Maple Apple Flavour,64a6b9d71e02c66732c06f33,Unknown,13.99,6.99,Meat,1,,,,,
69a5e7422ec94e0364ea0a87,Outside Round Steak,64a6b9d71e02c66732c06f33,Unknown,10.91,5.45,Beef,1,,,,,
69a5eb6b95f323af58936a3d,Butterball Turkey Bacon style,64a6b9d71e02c66732c06f33,Unknown,8.5,4.25,Meat,2,,,,,
69a5ebdac84b98d3a1c2eb6d,chicken bacon style,64a6b9d71e02c66732c06f33,Unknown,7.0,3.5,Meat,2,,,,,
69a5ec36a7c94f56e41abe8f,Outside Round Steak,64a6b9d71e02c66732c06f33,Unknown,10.97,5.48,Beef,1,,,,,
69a5f70a95f323af5897a04a,White Shimeji Mushrooms,5fac3e09d7528a3c966b13d0,Unknown,2.99,1.49,Produce,19,,,,,
69a5f769c84b98d3a1c69486,Brown Shimeji Mushrooms,5fac3e09d7528a3c966b13d0,Unknown,2.99,1.49,Produce,32,,,,,
69a60b24a7c94f56e4269fb4,Mixed Produce Box #82,64a6b9d71e02c66732c06f33,Unknown,5.0,5.0,Produce,1,,,,,
69a616152ec94e0364f900dc,Cabernet Sauvignon Dealcoholized Wine,65bd257956f2d4f45a3da0e2,Unknown,8.5,4.25,Centre of Store,1,,,,,
69a620fe2ec94e0364fb9fd4,Pre-Cooked Yellow Corn Meal,65bd257956f2d4f45a3da0e2,Unknown,4.29,2.14,Centre of Store,1,,,,,
69a623d6d8e0b8d49f36bd26,Mixed Produce Box #112,5d0bd76c8894a4ebbfd704b8,Unknown,5.0,5.0,Produce,1,,,,,
69a624cbd8e0b8d49f36f7dc,Fruit Box #12,5d0bd76c8894a4ebbfd704b8,Unknown,5.0,5.0,Produce,1,,,,,
69a62552c84b98d3a1d3fa4c,Fruit Box #14,5d0bd76c8894a4ebbfd704b8,Unknown,5.0,5.0,Produce,1,,,,,
69a62561d8e0b8d49f37208d,Fruit Box #15,5d0bd76c8894a4ebbfd704b8,Unknown,5.0,5.0,Produce,1,,,,,
69a625f5a7c94f56e42e0e92,Fruit Box #17,5d0bd76c8894a4ebbfd704b8,Unknown,5.0,5.0,Produce,1,,,,,
69a6267dd5cafd97c2e78158,Fruit Box #19,5d0bd76c8894a4ebbfd704b8,Unknown,5.0,5.0,Produce,1,,,,,
69a626b82ec94e0364fcfe8b,Denture Adhesive Cream Power Hold + Seal Flavour Free,65bd257956f2d4f45a3da0e2,Unknown,10.99,5.49,Centre of Store,1,,,,,
69a626eaa7c94f56e42e4fea,Fruit Box #21,5d0bd76c8894a4ebbfd704b8,Unknown,5.0,5.0,Produce,1,,,,,
69a62a3da7c94f56e42f27af,Flexible Paper Straws 100 Pack,65bd257956f2d4f45a3da0e2,Unknown,3.0,1.5,Home & Entertainment,1,,,,,
69a63be32ec94e0364016a7f,Cabernet Sauvignon Dealcoholized Wine,65bd257956f2d4f45a3da0e2,Unknown,8.5,4.25,Centre of Store,3,,,,,
69a679a5a7c94f56e4392abd,Mixed Produce Box #9,61c39e3eb18e950dea37d276,Unknown,5.0,5.0,Produce,1,,,,,
69a679bda7c94f56e4392b71,Mixed Produce Box #11,61c39e3eb18e950dea37d276,Unknown,5.0,5.0,Produce,1,,,,,
69a68c0cf9d8fe4c78fc3bf6,Dairyland Skim Milk Carton (1 L),65e8f30bcb43951cbd853f59,Unknown,2.89,1.44,Dairy & Eggs,9,,,,,
69a68c19f9d8fe4c78fc3c37,Dairyland chocolate milk 946ml,65e8f30bcb43951cbd853f59,Unknown,3.0,1.5,Dairy & Eggs,4,,,,,
69a68c2afcaf623e655367c6,Dairyland 33% Whipping Cream Carton (946 ml),65e8f30bcb43951cbd853f59,Unknown,7.69,3.84,Dairy & Eggs,5,,,,,
69a68f526623a9b168460670,Oreo Thins Golden Sandwich Cookies (261 g),65e8f30bcb43951cbd853f59,Unknown,4.27,2.13,Snacks,1,,,,,
69a68f6c6d87d0ba3f610da7,Kraft Dinner Poutine Macaroni & Cheese Cup (58 g),65e8f30bcb43951cbd853f59,Unknown,2.79,1.39,Pantry,4,,,,,
69a68f826623a9b16846075f,Kraft Dinner Spicy Buffalo Macaroni & Cheese Cup (58 g),65e8f30bcb43951cbd853f59,Unknown,1.97,0.98,Pantry,5,,,,,
69a68fa06d87d0ba3f610ead,CeraVe Acne Control Cleanser with Oil-Absorbing Technology (355 ml),65e8f30bcb43951cbd853f59,Unknown,20.87,10.43,Beauty,2,,,,,
69a68ffc6d87d0ba3f6110a8,Beneful Originals Dry Dog Food with Real Salmon (7 kg),67bdc806855e4112ad907797,Unknown,33.29,16.64,Pet Care,1,,,,,
69a69012fcaf623e655376c4,Purina One +Plus Indoor Advantage Turkey Dry Cat Food (3 kg),67bdc806855e4112ad907797,Unknown,26.99,13.49,Pet Care,2,,,,,
69a6903ef9d8fe4c78fc4d41,Purina Beyond Chicken & Whole Oatmeal Recipe Dry Cat Food (1.36 kg),67bdc806855e4112ad907797,Unknown,17.89,8.94,Pet Care,3,,,,,
69a6909b6d87d0ba3f6112e6,Whiskas Catmilk Cat Drink Treat (200 ml),67bdc806855e4112ad907797,Unknown,2.99,1.5,Pet Care,18,,,,,
69a691fdf9d8fe4c78fc5278,Durex Play 2-in-1 Guarana Massage Lubricant (200 ml),65e8f30bcb43951cbd853f59,Unknown,19.99,9.99,Personal Care,1,,,,,
69a692cb6623a9b168461131,Kraft Dinner Poutine Macaroni & Cheese Cup (58 g),67bdc806855e4112ad907797,Unknown,2.79,1.39,Pantry,10,,,,,
69a6938f20ac153a0fa83f5b,Children's Motrin Fever Relief Grape Oral Suspension (120 ml),67bdc806855e4112ad907797,Unknown,11.99,5.99,Medicine,2,,,,,
69a6938f6623a9b1684612db,Durex Play 2-in-1 Guarana Massage Lubricant (200 ml),67bdc806855e4112ad907797,Unknown,19.99,9.99,Personal Care,2,,,,,
69a6938ff9d8fe4c78fc5653,Vicks Early Defence Cold Virus Blocker Nasal Spray (15 ml),67bdc806855e4112ad907797,Unknown,17.99,8.99,Medicine,1,,,,,
69a6938ff9d8fe4c78fc5661,Reno Liver Spread (78 g),67bdc806855e4112ad907797,Unknown,3.49,1.74,Pantry,3,,,,,
69a6938ffcaf623e655380ba,Advil Junior Very Berry Chewable Tablets (40 ct),67bdc806855e4112ad907797,Unknown,19.29,9.64,Medicine,1,,,,,
69a693db6d87d0ba3f611d26,Kosa Brown Sugar Bubble Tea (490 ml),67bdc806855e4112ad907797,Unknown,4.49,2.24,Drinks,5,,,,,
69a69411fcaf623e655381d5,Kosa Taro Bubble Tea (490 ml),67bdc806855e4112ad907797,Unknown,4.49,2.24,Drinks,16,,,,,
69a6941d20ac153a0fa84089,Kraft Dinner Spicy Buffalo Macaroni & Cheese Cup (58 g),67bdc806855e4112ad907797,Unknown,2.07,1.03,Pantry,2,,,,,
69a694aef9d8fe4c78fc5971,Kosa Taro Bubble Tea (490 ml),67bdc806855e4112ad907797,Unknown,4.49,2.24,Drinks,8,,,,,
69a703e748c9d5db21e0de3b,Spring Mix,5d0bd76b8894a4ebbfd7048a,Unknown,7.0,3.0,Produce,6,,,,,
