item_id,item_name,store_id,store_name,original_price,price,category,stock_0930,stock_1630,stock_2030,change_1,change_2,change_3
68213c05b14699806189b2b0,Wildrose Herbal D-TOX Kit 12day Program,67ffcc6581edee2219c54e94,Unknown,64.99,54.99,Health & Wellness,9,,,,,
682bbc06c8802244e1542253,Banat Toothbrush Pack Of 2,67ffcc6581edee2219c54e94,Unknown,4.99,2.99,Grocery,6,,,,,
682bbe4326bdd6612a51d31e,Auroshikha 18 Fragrance (Mini Palette),67ffcc6581edee2219c54e94,Unknown,10.99,4.99,Grocery,4,,,,,
682bbf183e6e6efab73a3fb7,Meditation Incense Cones,67ffcc6581edee2219c54e94,Unknown,12.99,6.99,Grocery,8,,,,,
6850875cf14056777f0acbd8,Desert Essence Red Raspberry Shampoo 237ml,67ffcc6581edee2219c54e94,Unknown,15.99,7.99,Grocery,2,,,,,
6869b846e76ab7f39234f42b,Sour Strips Green Apple,685f076cae659ef8e57956fc,Unknown,8.99,7.99,Snacks & Drinks,3,,,,,
6869b8b6e76ab7f3923502a3,Sour Strips Strawberry,685f076cae659ef8e57956fc,Unknown,8.99,7.99,Snacks & Drinks,4,,,,,
6869b96c26c9413d166fc310,Sour Strips Watermelon,685f076cae659ef8e57956fc,Unknown,8.99,7.99,Snacks & Drinks,1,,,,,
6869b9bdd45286d9ce5ea147,Sour Strips Tropical Mango,685f076cae659ef8e57956fc,Unknown,8.99,7.99,Snacks & Drinks,1,,,,,
6869ba9ee76ab7f392353a9d,Sour Strips Pink Lemonade,685f076cae659ef8e57956fc,Unknown,8.99,7.99,Snacks & Drinks,5,,,,,
6869bae4d45286d9ce5ec328,Sour Strips Wild Cherry,685f076cae659ef8e57956fc,Unknown,8.99,7.99,Snacks & Drinks,3,,,,,
686af3f226c9413d168f16fa,Pringles Original Party Pack,685f076cae659ef8e57956fc,Unknown,5.99,5.5,Snacks & Drinks,4,,,,,
68a523bee4d63010325aea25,Herbafresh Dead Sea Bath Salt 500g,67ffcc6581edee2219c54e94,Unknown,8.99,3.99,Grocery,15,,,,,
68bc5e026e06f3f1d9451757,L'Oreal Paris Feria Smokey Silver S1 Silver Grey Permanent Hair Dye Kit (1 ct),65e8f30bcb43951cbd853f59,Unknown,21.29,10.65,Beauty,1,,,,,
691f6eb770ccf1c96852c9f3,Coconut Cashews,691b59a5669ef62168a65bdb,Unknown,3.5,2.0,Nuts & Snacks,20,,,,,
692b87b2ddfa836f5a2ef579,CanadaDry Tonic Water,65e8f30bcb43951cbd853f59,Unknown,2.0,1.0,Drinks,2,,,,,
692e5b5c7aaefcde17875128,Everland Himalayan Crystal Salt 500g,67ffcc6581edee2219c54e94,Unknown,5.99,2.99,Grocery,6,,,,,
695807500c79613ef47ed200,Pretzel Pzazz Sour Cream & Chive,685f076cae659ef8e57956fc,Unknown,4.49,3.49,Snacks & Drinks,2,,,,,
695807dba1132e12bc69c1a4,Haribo Peaches,685f076cae659ef8e57956fc,Unknown,4.79,4.19,Snacks & Drinks,6,,,,,
695809afa1132e12bc6a0f28,Trolli Sweet Peach,685f076cae659ef8e57956fc,Unknown,4.49,3.69,Snacks & Drinks,8,,,,,
69580a580c79613ef47f3b0e,Arizona Fruit Snacks,685f076cae659ef8e57956fc,Unknown,5.79,4.29,Snacks & Drinks,4,,,,,
69714698a0eb91f622f82d6c,Whisky Kiss Almonds,691b59a5669ef62168a65bdb,Unknown,3.5,2.0,Nuts & Snacks,34,,,,,
697146fbe2f09d0b9327b973,Salted Caramel Cashew,691b59a5669ef62168a65bdb,Unknown,3.5,2.0,Nuts & Snacks,22,,,,,
6971473140e632216a673804,Butter Toffee Almonds,691b59a5669ef62168a65bdb,Unknown,3.5,2.0,Nuts & Snacks,19,,,,,
6971479b40e632216a6747a2,Durian Choco Dipped Almonds,691b59a5669ef62168a65bdb,Unknown,4.5,3.5,Nuts & Snacks,16,,,,,
697147e9077af9138bbd2b71,Strawberry Choco Dipped Almonds,691b59a5669ef62168a65bdb,Unknown,4.5,3.5,Nuts & Snacks,12,,,,,
6971481f077af9138bbd30d3,Matcha Choco Dipped Almonds,691b59a5669ef62168a65bdb,Unknown,4.5,3.5,Nuts & Snacks,8,,,,,
697148999f875680704e521a,Choco Salted Caramel Cashews,691b59a5669ef62168a65bdb,Unknown,4.5,3.5,Nuts & Snacks,11,,,,,
6976ba764bb7d7af11f788f7,New World Almond Butter Crunchy Roasted 500g,67ffcc6581edee2219c54e94,Unknown,14.99,9.99,Grocery,42,,,,,
6976bb2dcf5c56b4f1144310,Bestropics Coconut Smoothie 355ml,67ffcc6581edee2219c54e94,Unknown,3.49,1.99,Beverages,49,,,,,
6976bbec7717e37fa681e259,Karma Sparkling Watermelon Hydration Drink 285ml,67ffcc6581edee2219c54e94,Unknown,3.99,1.99,Beverages,25,,,,,
6976bc9ccf5c56b4f114614f,Karma Sparkling Grape Hydration Drink 285ml,67ffcc6581edee2219c54e94,Unknown,3.99,1.99,Beverages,24,,,,,
6976bce23695546c5d4594c5,Karma Apple Soda 285ml,67ffcc6581edee2219c54e94,Unknown,3.99,1.99,Beverages,19,,,,,
6976bd304e0f1abfeaaeefcf,Karma Berry Soda 285ml,67ffcc6581edee2219c54e94,Unknown,3.99,1.99,Beverages,23,,,,,
6984d7afee5a6123d46250de,Mixed Frozen Pastry  3 Pc,67e6b1577b5f59b1bba8c7c4,Unknown,20.0,5.0,Pizza Dough,1,,,,,
6984d853e9a0a7e95dffd353,2 Pizza Dough FRESH,67e6b1577b5f59b1bba8c7c4,Unknown,12.0,4.99,Pizza Dough,1,,,,,
6984d96dee5a6123d462a3da,"250 Ml Soup ,1 Loaf Bread  , Croissant",67e6b1577b5f59b1bba8c7c4,Unknown,18.0,9.0,Pizza Dough,1,,,,,
698a6de210bcc888935c3465,Dark Choco Gingers,691b59a5669ef62168a65bdb,Unknown,4.5,3.0,Nuts & Snacks,9,,,,,
698a6f4260a3aaa497307211,Fancy Nut Mix,691b59a5669ef62168a65bdb,Unknown,15.0,11.0,Nuts & Snacks,3,,,,,
698a6fc110bcc888935c6c25,Inshell Peanuts Salted,691b59a5669ef62168a65bdb,Unknown,4.0,2.5,Nuts & Snacks,6,,,,,
698c2ea85f6e0bbdf062e31a,WAKEMAKE Water Glow Coating Foundation #23 Beige (30 ml),65e8f30bcb43951cbd853f59,Unknown,39.99,19.99,Beauty,3,,,,,
698c2f0d730afb77e7253193,Little Sheep Plain Hot Pot Soup Base (130 g),65e8f30bcb43951cbd853f59,Unknown,6.39,3.19,Pantry,5,,,,,
698c3f25730afb77e72565ec,WAKEMAKE Water Glow Coating Foundation #23 Beige (30 ml),67bdc806855e4112ad907797,Unknown,39.99,19.99,Beauty,2,,,,,
698c3f25cef1e3f1e10f49af,Little Sheep Plain Hot Pot Soup Base (130 g),67bdc806855e4112ad907797,Unknown,6.39,3.19,Pantry,16,,,,,
698d861f9f2f71d05b103a2e,Taco Bell Mild Sauce (207 ml),65e8f30bcb43951cbd853f59,Unknown,4.29,2.14,Pantry,13,,,,,
698f49f4b00680d6ddef4fed,marine box seaweed snacks,5ddef30c9af4e045c44b9d67,Unknown,7.99,3.99,Grocery,2,,,,,
698f97126b722fca3c676d2d,Clamato Extra Spicy Rimmer,65bd257956f2d4f45a3da0e2,Unknown,4.99,2.49,Centre of Store,4,,,,,
698f973b6b722fca3c67762d,Clamato Chunky Pub Style Rimmer,65bd257956f2d4f45a3da0e2,Unknown,4.99,2.49,Centre of Store,6,,,,,
698f974aef2f3a8ea588e559,Clamato Rimmer,65bd257956f2d4f45a3da0e2,Unknown,4.99,2.49,Centre of Store,2,,,,,
698f97e11af04775da117eea,Single Strength Lime Juice,65bd257956f2d4f45a3da0e2,Unknown,2.99,1.49,Centre of Store,5,,,,,
69902a8419ce08acfab607e0,Mother's Recipe Mixed Pickle (500 g),65e8f30bcb43951cbd853f59,Unknown,4.49,2.24,Pantry,3,,,,,
6990a4dc23539fc0dede8364,Life Brand Extra Strength Ibuprofen,65e8f30bcb43951cbd853f59,Unknown,8.19,4.1,Medicine,4,,,,,
6990a5f7f3da2e15883cfdb8,Clearblue Digital & Visual Pregnancy Test Combo Pack (2 ct),65e8f30bcb43951cbd853f59,Unknown,24.99,24.99,Personal Care,1,,,,,
69941f4e36a8b368c3dacd2b,Taco Bell Crunchy Taco Cravings Kit (260 g),65e8f30bcb43951cbd853f59,Unknown,5.79,2.89,Pantry,4,,,,,
69956973c9e320d4254176ac,Cerelac Honey & Wheat with Milk Baby Cereal (400 g),65e8f30bcb43951cbd853f59,Unknown,11.89,5.94,Baby,5,,,,,
69956b327da7af90d30c4fc5,Super Q Golden Bihon Cornstarch Sticks (454 g),67bdc806855e4112ad907797,Unknown,2.69,1.34,Pantry,3,,,,,
6996bdf1a8e94948047832db,Maple Leaf Flakes of Turkey (156 g),65e8f30bcb43951cbd853f59,Unknown,4.29,2.14,Pantry,13,,,,,
6996be64ab5d5abe6dd9ee53,Hershey's Chipits Chips de caramel au beurre / Butterscotch Chips (270 g),65e8f30bcb43951cbd853f59,Unknown,6.99,3.49,Pantry,2,,,,,
6996c1b738830975c28424e6,Maple Leaf Flakes of Turkey (156 g),67bdc806855e4112ad907797,Unknown,4.29,2.14,Pantry,8,,,,,
69980c5a8e5e05cc772d2ff1,WAKEMAKE Defining Cover Concealer #13 Porcelain (6 g),67bdc806855e4112ad907797,Unknown,14.99,7.49,Beauty,3,,,,,
69980c5b38830975c2a02e5f,Taco Bell Soft Taco Cravings Kit (420 g),67bdc806855e4112ad907797,Unknown,5.79,2.89,Pantry,3,,,,,
69980ce91e537211774a0f00,Tuna Helper Au Gratin Pasta Kit (206 g),65e8f30bcb43951cbd853f59,Unknown,3.39,1.69,Pantry,8,,,,,
69980eec8e5e05cc772d3b2c,Betty Crocker Reese's Mini Pieces Cookie Mix (337 g),65e8f30bcb43951cbd853f59,Unknown,4.79,2.39,Pantry,7,,,,,
69980f201e537211774a16ba,WAKEMAKE Defining Cover Concealer #13 Porcelain (6 g),65e8f30bcb43951cbd853f59,Unknown,14.99,7.49,Beauty,2,,,,,
699810c9ab5d5abe6df7a24e,Betty Crocker Reese's Mini Pieces Cookie Mix (337 g),65e8f30bcb43951cbd853f59,Unknown,4.79,2.39,Pantry,6,,,,,
69981141ab5d5abe6df7a4c8,Taco Bell Soft Taco Cravings Kit (420 g),65e8f30bcb43951cbd853f59,Unknown,5.79,2.89,Pantry,11,,,,,
6999164e38830975c2be86ec,Garnier Belle Color: ColorEase Creme 11 Very Intense Black Permanent Hair Dye Kit (1 ct),65e8f30bcb43951cbd853f59,Unknown,11.29,5.64,Beauty,1,,,,,
699917b48e5e05cc774e386f,Haldiram's Snacks Chatpata Dal (150 g),65e8f30bcb43951cbd853f59,Unknown,2.39,1.19,Snacks,8,,,,,
699964da8e5e05cc775256fb,Sunfeast Yippee! Magic Masala Noodles Multipack (280 g),65e8f30bcb43951cbd853f59,Unknown,2.69,1.34,Pantry,18,,,,,
699ea7cc3523a0e94c0686cf,Kraft Creamy Poppy Seed Dressing (425 ml),65e8f30bcb43951cbd853f59,Unknown,4.49,2.24,Pantry,6,,,,,
69a00167bd948ea62253dbed,Derlea Foods Turmeric Puree (120 g),65e8f30bcb43951cbd853f59,Unknown,3.99,1.99,Pantry,3,,,,,
69a001c5764a4317ab610232,Nesquik Loaded with Vanilla Creme Filling Cereal (368 g),65e8f30bcb43951cbd853f59,Unknown,5.89,2.94,Pantry,6,,,,,
69a0804dda60c9dfbdad038a,Soft Drink Go Bananas,629cec56061cc278a85326dc,Unknown,1.0,0.5,Centre of Store,43,,,,,
69a149f994d00ccc15395367,Polysporin Original Antibiotic Cream (30 g),65e8f30bcb43951cbd853f59,Unknown,15.59,7.79,Medicine,3,,,,,
69a14a44764a4317ab7ef2f9,Mama Pork Instant Noodles (60 g x 5 pk),65e8f30bcb43951cbd853f59,Unknown,4.69,2.34,Pantry,1,,,,,
69a1502594d00ccc15396f58,Old El Paso Smart Fiesta Taco Seasoning Mix (24 g),67bdc806855e4112ad907797,Unknown,1.89,0.94,Pantry,1,,,,,
69a2a0d4b21135ee52dd024e,Kraft Vinaigrette Ranch aux Trois Fromages / Three Cheese Ranch Dressing (425 ml),67bdc806855e4112ad907797,Unknown,4.49,2.24,Pantry,2,,,,,
69a2a39c5c370550ffc1cdfb,Astro Snacks Freeze-Dried Chamoy & Tajin Skittles Candy (110 g),67bdc806855e4112ad907797,Unknown,12.99,6.49,Candy,9,,,,,
69a3ea74b21135ee52f66112,Foodaholic Nourishing Sepia Color Cream 1min 7N Natural Brown Hair Dye (60 g),65e8f30bcb43951cbd853f59,Unknown,7.99,3.99,Beauty,10,,,,,
69a3f43d42f1b200d4074555,Cholula Chipotle Hot Sauce (150 ml),67bdc806855e4112ad907797,Unknown,6.99,3.49,Pantry,2,,,,,
69a540055c370550fff51353,Emergen-C Immune Support Strawberry Crystals (24 ct),67bdc806855e4112ad907797,Unknown,20.89,10.44,Vitamins&Supplements,2,,,,,
69a540055c370550fff5135c,Children's Advil Fever & Pain Relief Fruit Flavour Oral Suspension Liquid (100 ml),67bdc806855e4112ad907797,Unknown,12.99,6.49,Medicine,4,,,,,
69a54005b21135ee520f26eb,Buckley's Mucus & Phlegm Fast Relief Cough Syrup (250 ml),67bdc806855e4112ad907797,Unknown,21.29,10.64,Medicine,1,,,,,
69a54005eaa699e29612d9c5,Durex Play 2-in-1 Ylang Ylang Massage Lubricant (200 ml),67bdc806855e4112ad907797,Unknown,19.99,9.99,Personal Care,2,,,,,
69a54006eaa699e29612d9d2,Durex Play 2-in-1 Aloe Vera Massage Lubricant (200 ml),67bdc806855e4112ad907797,Unknown,19.99,9.99,Personal Care,1,,,,,
69a540a942f1b200d41fd142,"Alpo Cookout Classics Pork, Beef, Chicken, & Veggie Dog Food (7.2 kg)",67bdc806855e4112ad907797,Unknown,26.29,13.14,Pet Care,2,,,,,
69a540d5da92734cc0777901,Purina One +Plus Healthy Puppy Lamb Dry Puppy Food (6 kg),67bdc806855e4112ad907797,Unknown,39.49,19.74,Other,2,,,,,
69a54189b21135ee520f2b7b,Purina One Microbiome Balance Chicken & Rice Dry Dog Food (1.81 kg),67bdc806855e4112ad907797,Unknown,15.59,7.79,Pet Care,1,,,,,
69a541b85c370550fff51825,Beneful Originals Dry Dog Food with Real Chicken (7 kg),67bdc806855e4112ad907797,Unknown,33.29,16.64,Pet Care,2,,,,,
69a541e642f1b200d41fd544,Gatorade Zero Orange Powder Packets (10 ct),65e8f30bcb43951cbd853f59,Unknown,9.59,4.79,Vitamins&Supplements,5,,,,,
69a5420142f1b200d41fd5ac,Astro Snacks Freeze-Dried Caramel M&M's Candy (70 g),65e8f30bcb43951cbd853f59,Unknown,11.99,5.99,Candy,2,,,,,
69a54706da92734cc0778d9c,Motrin Regular Strength Ibuprofen Liquid Gel Capsules (16 ct),65e8f30bcb43951cbd853f59,Unknown,7.79,3.89,Medicine,1,,,,,
69a547465c370550fff527db,Nature's Way Fruit Flavoured Vitamin D3 Gummies (60 ct),65e8f30bcb43951cbd853f59,Unknown,14.79,7.39,Vitamins&Supplements,1,,,,,
69a620fe2ec94e0364fb9fd4,Pre-Cooked Yellow Corn Meal,65bd257956f2d4f45a3da0e2,Unknown,4.29,2.14,Centre of Store,1,,,,,
69a62a3da7c94f56e42f27af,Flexible Paper Straws 100 Pack,65bd257956f2d4f45a3da0e2,Unknown,3.0,1.5,Home & Entertainment,1,,,,,
69a68fa06d87d0ba3f610ead,CeraVe Acne Control Cleanser with Oil-Absorbing Technology (355 ml),65e8f30bcb43951cbd853f59,Unknown,20.87,10.43,Beauty,1,,,,,
69a68ffc6d87d0ba3f6110a8,Beneful Originals Dry Dog Food with Real Salmon (7 kg),67bdc806855e4112ad907797,Unknown,33.29,16.64,Pet Care,1,,,,,
69a69012fcaf623e655376c4,Purina One +Plus Indoor Advantage Turkey Dry Cat Food (3 kg),67bdc806855e4112ad907797,Unknown,26.99,13.49,Pet Care,1,,,,,
69a6903ef9d8fe4c78fc4d41,Purina Beyond Chicken & Whole Oatmeal Recipe Dry Cat Food (1.36 kg),67bdc806855e4112ad907797,Unknown,17.89,8.94,Pet Care,2,,,,,
69a6909b6d87d0ba3f6112e6,Whiskas Catmilk Cat Drink Treat (200 ml),67bdc806855e4112ad907797,Unknown,2.99,1.5,Pet Care,16,,,,,
69a691fdf9d8fe4c78fc5278,Durex Play 2-in-1 Guarana Massage Lubricant (200 ml),65e8f30bcb43951cbd853f59,Unknown,19.99,9.99,Personal Care,1,,,,,
69a692cb6623a9b168461131,Kraft Dinner Poutine Macaroni & Cheese Cup (58 g),67bdc806855e4112ad907797,Unknown,2.79,1.39,Pantry,5,,,,,
69a6938f20ac153a0fa83f5b,Children's Motrin Fever Relief Grape Oral Suspension (120 ml),67bdc806855e4112ad907797,Unknown,11.99,5.99,Medicine,2,,,,,
69a6938ff9d8fe4c78fc5653,Vicks Early Defence Cold Virus Blocker Nasal Spray (15 ml),67bdc806855e4112ad907797,Unknown,17.99,8.99,Medicine,1,,,,,
69a6938ffcaf623e655380ba,Advil Junior Very Berry Chewable Tablets (40 ct),67bdc806855e4112ad907797,Unknown,19.29,9.64,Medicine,1,,,,,
69a7df063cb0c5aebafe72e1,Mama Sita's Annatto Powder (10 g),65e8f30bcb43951cbd853f59,Unknown,1.07,0.53,Pantry,50,,,,,
69a7e56f3cb0c5aebafe8c3d,Kurkure Chilli Chatka (270 g),67bdc806855e4112ad907797,Unknown,5.09,2.54,Snacks,2,,,,,
69a7e63d3cb0c5aebafe8fb5,Hubba Bubba Mixed Fruit Flavoured Bubble Gum Variety Pack (4 pk),67bdc806855e4112ad907797,Unknown,2.67,1.33,Candy,7,,,,,
69a7e63d8db9227a2f5afd30,Pedigree Vitality+ Hearty Beef & Vegetable Dry Dog Food (8 kg),67bdc806855e4112ad907797,Unknown,30.99,15.5,Pet Care,1,,,,,
69a7e63dfa487e269a865747,Mama Sita's Annatto Powder (10 g),67bdc806855e4112ad907797,Unknown,1.07,0.53,Pantry,42,,,,,
69a868b5c504d7296cb6e27d,"Vegan Delight Coconut Milk, Raspberry & Blackcurrant",5d0bd76b8894a4ebbfd7048a,Unknown,7.99,3.99,Natural Foods,1,,,,,
69a86cf25d8ced93820411f8,"Brew Over Ice Hazelnut, Medium Roast, K-Cup Coffee Pods 10 Count",5d0bd76c8894a4ebbfd704b8,Unknown,16.99,8.49,Centre of Store,6,,,,,
69a93437852a6b90cf1a42e1,Taco Bell Hot Sauce (207 ml),67bdc806855e4112ad907797,Unknown,3.27,1.63,Pantry,3,,,,,
69a93437c5a4a00fc224cf6d,Propel Raisin Electrolyte water (500 ml × 6 ct),67bdc806855e4112ad907797,Unknown,8.19,4.09,Drinks,1,,,,,
69a93437d0e22cde60985244,SunnyD Smooth (240 ml x 6 ct),67bdc806855e4112ad907797,Unknown,5.59,2.79,Drinks,1,,,,,
69a939e0c7d0f8576092699a,Taco Bell Hot Sauce (207 ml),65e8f30bcb43951cbd853f59,Unknown,3.27,1.63,Pantry,6,,,,,
69a99fbf6fed980a5b127a16,"Tea Biscuits, Cheddar Cheese",5ddef30c9af4e045c44b9d67,Unknown,6.29,3.14,Bakery,8,,,,,
69a9a19ba64b9ef0045eeeaf,Tropical Cake,5ddef30c9af4e045c44b9d67,Unknown,2.0,1.0,Bakery,24,,,,,
69a9d4f49033370c523ac1aa,Tic Tac Sour Apple 29g,69379713a3687e3a3db2d8bc,Unknown,3.45,1.0,Grocery,6,,,,,
69a9fe8767203a17607cca39,"Bowl, Round",629cec56061cc278a85326dc,Unknown,4.0,1.5,Home & Entertainment,6,,,,,
69a9feb15b144fdb1fe4fb15,"Bowl, Round",629cec56061cc278a85326dc,Unknown,4.0,1.5,Home & Entertainment,7,,,,,
69aa7e4ff2fd8b41ac8e3ae8,Yoplait Source Protien 0% Vanilla Yogurt (650 g),65e8f30bcb43951cbd853f59,Unknown,4.99,2.49,Dairy & Eggs,4,,,,,
69aa80bd7a386e0fe0821015,Kraft vinaigrette rancher's choice / Rancher's Choice Dressing (425 ml),65e8f30bcb43951cbd853f59,Unknown,4.29,2.14,Pantry,3,,,,,
69aa84e57a386e0fe0822121,Kraft Dinner Gluten-Free Original Macaroni & Cheese (170 g),67bdc806855e4112ad907797,Unknown,3.99,1.99,Pantry,4,,,,,
69aa8770d29e11fcf5859558,Wet Hypoallergenic Water-Based Original Lubricant (93 ml),67bdc806855e4112ad907797,Unknown,17.99,8.99,Personal Care,1,,,,,
69aae5a4dc93a73d9358a341,top dogs,5fac3e04d7528a3c966b13a4,Unknown,5.99,2.0,Meat,3,,,,,
69ab324b429312c67072d1a0,Street Cart Sausages™ Cheddar Cheese,5ddef30c9af4e045c44b9d67,Unknown,8.49,2.97,Hot Dogs,3,,,,,
69ab339f6c6b430755dd2baa,Blue Ribbon Bologna Classic,5ddef30c9af4e045c44b9d67,Unknown,11.0,2.97,Meat,2,,,,,
69ab34186c6b430755dd575a,"Salami, Sliced",5ddef30c9af4e045c44b9d67,Unknown,4.79,1.47,Meat,2,,,,,
69abc3598b8d919d53d9538a,Mixed Produce Box #53,61c39e3eb18e950dea37d276,Unknown,5.0,5.0,Produce,1,,,,,
69abd4915e9c327ae53bf627,Yoggu! Strawberry (450 g),65e8f30bcb43951cbd853f59,Unknown,9.29,4.64,Dairy & Eggs,5,,,,,
69abd8db0debb1c475581efb,Rockstar Zero Sugar Raspberry Sour Energy Drink (473 ml),65e8f30bcb43951cbd853f59,Unknown,3.99,1.99,Drinks,1,,,,,
69abd8fe0debb1c475581f6b,Rockstar Zero Sugar Berry Freeze Energy Drink (473 ml),65e8f30bcb43951cbd853f59,Unknown,3.99,1.99,Drinks,6,,,,,
69abd9320debb1c47558206b,Clif Crunchy Peanut Butter Mini Snack Bars (28 g x 10 ct),65e8f30bcb43951cbd853f59,Unknown,16.69,8.34,Snacks,2,,,,,
69abd9670debb1c4755821cd,Smarties Milk Chocolate Candies Mini Boxes (25 ct),65e8f30bcb43951cbd853f59,Unknown,7.67,3.83,Candy,10,,,,,
69abdb3b65f21b711816e830,Paldo Seafood Noodle Soup Bowl (86 g),65e8f30bcb43951cbd853f59,Unknown,1.99,0.99,Pantry,3,,,,,
69ac4d813b6d48e5a4492e5f,"Planet First Wheat Stalk Straws, Compostable, 200 Straws",629cec56061cc278a85326dc,Unknown,6.0,3.0,Home & Entertainment,2,,,,,
69ac51098b8d919d53f85b6c,Mixed Produce Box #6,5d0bd76b8894a4ebbfd7048a,Unknown,5.0,5.0,Produce,1,,,,,
69ac5b9c3b6d48e5a44f806e,Tubeez Chocolate Plant-Based Yogurt Tubes Kids !,5d0bd76b8894a4ebbfd7048a,Unknown,7.99,3.99,Centre of Store,6,,,,,
69acabbb65f21b71182b50a8,Mixed Produce Bundle #10,65e8f30bcb43951cbd853f59,Unknown,5.0,5.0,Produce,1,,,,,
69acac741cbb3dc1f2b573e3,Mixed Produce Box #78,5d0bd76c8894a4ebbfd704b8,Unknown,5.0,5.0,Produce,1,,,,,
69acacea2897817f891732af,Mixed Produce Box #82,5d0bd76c8894a4ebbfd704b8,Unknown,5.0,5.0,Produce,1,,,,,
69acad719ff69c00ad89cab2,Mixed Produce Box #83,5d0bd76c8894a4ebbfd704b8,Unknown,5.0,5.0,Produce,1,,,,,
69acad7c9ff69c00ad89cd49,Mixed Produce Box #84,5d0bd76c8894a4ebbfd704b8,Unknown,5.0,5.0,Produce,1,,,,,
69ad19569ff69c00ad981353,Hot Italian Pork Sausages,5fac3e04d7528a3c966b13a4,Unknown,8.0,4.0,Meat,2,,,,,
69ad1979b9f04b1cc1217ff3,Free From Hot Italian Pork Sausages,5fac3e04d7528a3c966b13a4,Unknown,8.49,4.24,"Bacon, Sausages & Hot Dogs",5,,,,,
69ad27d365f21b7118346afb,Fontaine Sante Caramelized Onion Dip (250 g),67bdc806855e4112ad907797,Unknown,5.79,2.89,Easy Meals,11,,,,,
69ad27db231ae4bad88c56ea,Pringles Sweet Chili Sauce Potato Chips (131 g),67bdc806855e4112ad907797,Unknown,4.29,2.14,Snacks,1,,,,,
69ad27e95e9c327ae55a7c7b,Coffee-Mate Hazelnut Liquid Coffee Enhancer (946 ml),65e8f30bcb43951cbd853f59,Unknown,6.99,3.49,Dairy & Eggs,3,,,,,
69ad2804729860da45ab9ebb,Oikos Pro High Protein Mixed Berries Yogurt Drink (300 ml),67bdc806855e4112ad907797,Unknown,4.49,2.24,Dairy & Eggs,2,,,,,
69ad283d729860da45ab9f7a,Oikos Pro High Protein Mixed Berries Yogurt Drink (300 ml),65e8f30bcb43951cbd853f59,Unknown,4.49,2.24,Dairy & Eggs,1,,,,,
69ad288565f21b7118346ded,T&T 3-in-1 Reduced Sugar Coffee (525 g),67bdc806855e4112ad907797,Unknown,8.99,4.49,Pantry,3,,,,,
69ad289c7c68be5cd9eb095b,Kraft Coleslaw Dressing (425 ml),67bdc806855e4112ad907797,Unknown,4.29,2.14,Pantry,2,,,,,
69ad29e2231ae4bad88c5fc6,Snyder's of Hanover Twisted Butter & Garlic Pretzel Sticks (340 g),65e8f30bcb43951cbd853f59,Unknown,6.09,3.04,Snacks,2,,,,,
69ad2a06729860da45aba89c,Jack Link's Zero Sugar Mini Sticks Original All Beef Jerky (175 g),65e8f30bcb43951cbd853f59,Unknown,12.37,6.18,Snacks,1,,,,,
69ad2a1b5e9c327ae55a8730,Tamam Pomegranate Juice Concentrate Molasses (300 ml),65e8f30bcb43951cbd853f59,Unknown,5.29,2.64,Pantry,15,,,,,
69ad2bf0729860da45abb1a2,Kraft Coleslaw Dressing (425 ml),65e8f30bcb43951cbd853f59,Unknown,4.29,2.14,Pantry,7,,,,,
69ad2f595e9c327ae55a9c57,"""Balady Bread 7"""" Whole Wheat Pita (300 g)""",65e8f30bcb43951cbd853f59,Unknown,3.69,1.84,Bakery,1,,,,,
69ad2f6d65f21b71183487b3,"""Balady Bread 7"""" White Pita (300 g)""",65e8f30bcb43951cbd853f59,Unknown,3.69,1.84,Bakery,1,,,,,
69ad8c958077c6c3f93c9946,"Tilapia Fillets, Club Pack",5d0bd76c8894a4ebbfd704b8,Unknown,17.68,8.84,Meat & Seafood,3,,,,,
69ad987e2897817f893deb38,Southwest Ranch Veggie Dip,5fac3e09d7528a3c966b13d0,Unknown,6.29,3.14,Produce,4,,,,,
69ad99d72897817f893e764b,Honey Garlic Flavoured Pork Sausages,5fac3e09d7528a3c966b13d0,Unknown,8.0,4.0,Meat,3,,,,,
69ad9c128077c6c3f943420d,Greek Feta Pasta Salad,5d0bd76b8894a4ebbfd7048a,Unknown,5.99,2.99,HMR,3,,,,,
69adacf18077c6c3f94a3a34,Free From Hot Italian Pork Sausages,5fac3e04d7528a3c966b13a4,Unknown,8.49,4.24,"Bacon, Sausages & Hot Dogs",1,,,,,
69adb2d4b9f04b1cc1440757,White Bread,5d0bd76c8894a4ebbfd704b8,Unknown,3.0,1.5,Bakery,6,,,,,
69adb3102d26db0a9e61bdff,Mixed Produce Box #102,5d0bd76c8894a4ebbfd704b8,Unknown,5.0,5.0,Produce,1,,,,,
69adb37dc46ec3ade8ab7886,Mixed Produce Box #104,5d0bd76c8894a4ebbfd704b8,Unknown,5.0,5.0,Produce,1,,,,,
69adb611088311d17a5d5354,Farmers market Maple muffins,5d0bd76c8894a4ebbfd704b8,Unknown,6.5,3.25,Bakery Commercial,3,,,,,
69adbc014cee0b2f4f0427c0,Cinnamon Twists 3-Pack,5d0bd76c8894a4ebbfd704b8,Unknown,5.5,2.75,Bakery,1,,,,,
69adbd994cee0b2f4f04b125,Mixed Produce Box #3,5d0bd76b8894a4ebbfd7048a,Unknown,5.0,5.0,Produce,1,,,,,
69adbda6088311d17a5f704c,Mixed Produce Box #4,5d0bd76b8894a4ebbfd7048a,Unknown,5.0,5.0,Produce,1,,,,,
69adbdb6c46ec3ade8af9f44,Mixed Produce Box #5,5d0bd76b8894a4ebbfd7048a,Unknown,5.0,5.0,Produce,1,,,,,
69adbdc9088311d17a5f7bde,Mixed Produce Box #8,5d0bd76b8894a4ebbfd7048a,Unknown,5.0,5.0,Produce,1,,,,,
69adbfaa4cee0b2f4f0557f4,Mixed Produce Box #10,5d0bd76b8894a4ebbfd7048a,Unknown,5.0,5.0,Produce,1,,,,,
69add82a14ac4b51899983a7,Cucumbers 11 count,65bd257956f2d4f45a3da0e2,Unknown,7.99,3.99,Fruits & Vegetables,4,,,,,
69adfa13b9f04b1cc15a360c,Honey Garlic Flavoured Pork Sausages,629cec56061cc278a85326dc,Unknown,8.0,4.0,Meat,2,,,,,
69ae3449a7e2dcb72bf6114b,assorted bulk hotdog and panini rolls 12 pack,5d0bd76c8894a4ebbfd704b8,Unknown,6.5,4.0,Bakery Instore,1,,,,,
69ae345ab9f04b1cc164ef33,assorted bulk hotdog and panini rolls 12 pack,5d0bd76c8894a4ebbfd704b8,Unknown,6.5,4.0,Bakery Instore,1,,,,,
69ae346ec46ec3ade8cdd19b,assorted bulk bagels 6 pack,5d0bd76c8894a4ebbfd704b8,Unknown,4.5,2.75,Bakery,1,,,,,
69ae348214ac4b5189addc63,assorted bulk bagels 6 pack,5d0bd76c8894a4ebbfd704b8,Unknown,4.5,2.75,Bakery,1,,,,,
69ae4dbeb59f424c52d12e14,Mixed Produce Box #1,61c39e3eb18e950dea37d276,Unknown,5.0,5.0,Produce,1,,,,,
69ae4dc5a7e2dcb72bf808ec,Mixed Produce Box #2,61c39e3eb18e950dea37d276,Unknown,5.0,5.0,Produce,1,,,,,
69ae66c2231ae4bad8a504e4,Dairyland 5% Sour Cream (500 ml),65e8f30bcb43951cbd853f59,Unknown,5.29,2.64,Dairy & Eggs,1,,,,,
69ae681c65f21b71184e7adc,IAMS Proactive Health Indoor Weight & Hairball Care Chicken & Turkey Dry Cat Food (3.18 kg),65e8f30bcb43951cbd853f59,Unknown,31.29,15.64,Pet Care,4,,,,,
69ae6843729860da45c54aee,Quaker Protein Oat Cereal (465 g),65e8f30bcb43951cbd853f59,Unknown,7.49,3.74,Pantry,2,,,,,
69ae6864729860da45c54b83,Slim Jim Giant Original (27.5 g),65e8f30bcb43951cbd853f59,Unknown,2.59,1.29,Snacks,13,,,,,
69ae6924729860da45c5506b,Red Bull Sugar Free Energy Drink (355 ml),65e8f30bcb43951cbd853f59,Unknown,4.99,2.49,Drinks,1,,,,,
69ae6937729860da45c550c6,Taco Bell Crunch Wrap Supreme Cravings Kit(642 g),65e8f30bcb43951cbd853f59,Unknown,9.29,4.64,Pantry,4,,,,,
69ae697b7c68be5cd9041941,Old Dutch Rip-L Ketchup Veggie Crisps (200 g),65e8f30bcb43951cbd853f59,Unknown,5.29,2.64,Snacks,7,,,,,
69ae6af8729860da45c557ff,Siggi's 3.6% Creamy Skyr Plain Yogurt (750 g),67bdc806855e4112ad907797,Unknown,7.99,3.99,Dairy & Eggs,1,,,,,
69ae6b1765f21b71184e8aeb,Tre Stelle Traditional Ricotta Cheese (475 g),67bdc806855e4112ad907797,Unknown,9.69,4.84,Dairy & Eggs,1,,,,,
69ae6b3c65f21b71184e8bcf,International Delight Caramel Macchiato Cold Foam (396 g),67bdc806855e4112ad907797,Unknown,8.29,4.14,Dairy & Eggs,1,,,,,
69ae6b4e231ae4bad8a51d07,Silk Cold Foam White Chocolate Oat Coffee enchancer,67bdc806855e4112ad907797,Unknown,6.99,3.49,Dairy & Eggs,2,,,,,
69ae6d5b5e9c327ae5751dbe,Farmer's Market Butter Tarts (765 g),67bdc806855e4112ad907797,Unknown,7.79,3.89,Bakery,1,,,,,
69ae6da37c68be5cd9042d01,Farmer's Market Banana Chocolate Chunk Muffins (600 g),67bdc806855e4112ad907797,Unknown,7.99,3.99,Bakery,2,,,,,
69ae6dc1231ae4bad8a5286a,Farmer's Market Chocolate Chip Muffins (600 g),67bdc806855e4112ad907797,Unknown,7.99,3.99,Bakery,1,,,,,
69ae6ec77c68be5cd90433e6,Taco Bell Crunchwrap Supreme Cravings Kit (642 g),67bdc806855e4112ad907797,Unknown,9.29,4.64,Pantry,3,,,,,
69ae6eed7c68be5cd90434c2,Quaker Protein Oat Cereal (465 g),67bdc806855e4112ad907797,Unknown,7.49,3.74,Pantry,2,,,,,
69ae6f25231ae4bad8a530a1,Monster Assault Energy Drink (473 ml),67bdc806855e4112ad907797,Unknown,3.69,1.84,Drinks,1,,,,,
69aec3a8c46ec3ade8dc8693,Mixed Produce Box #2,5d0bd76b8894a4ebbfd7048a,Unknown,5.0,5.0,Produce,1,,,,,
69aec3b0c46ec3ade8dc8b53,Mixed Produce Box #1,5d0bd76b8894a4ebbfd7048a,Unknown,5.0,5.0,Produce,1,,,,,
69aec40014ac4b5189bcbc2b,Mixed Produce Box #3,5d0bd76b8894a4ebbfd7048a,Unknown,5.0,5.0,Produce,1,,,,,
69aec435a7e2dcb72b04bb0a,Mixed Produce Box #4,5d0bd76b8894a4ebbfd7048a,Unknown,5.0,5.0,Produce,1,,,,,
69aec44814ac4b5189bce324,Mixed Produce Box #5,5d0bd76b8894a4ebbfd7048a,Unknown,5.0,5.0,Produce,1,,,,,
69aec45cc46ec3ade8dccc48,Mixed Produce Box #6,5d0bd76b8894a4ebbfd7048a,Unknown,5.0,5.0,Produce,1,,,,,
69aec467a7e2dcb72b04d403,Mixed Produce Box #7,5d0bd76b8894a4ebbfd7048a,Unknown,5.0,5.0,Produce,1,,,,,
69aec49114ac4b5189bcfe19,Mixed Produce Box #9,5d0bd76b8894a4ebbfd7048a,Unknown,5.0,5.0,Produce,1,,,,,
69aec4a314ac4b5189bd0cae,Mixed Produce Box #10,5d0bd76b8894a4ebbfd7048a,Unknown,5.0,5.0,Produce,1,,,,,
