item_id,item_name,store_id,store_name,original_price,price,category,stock_0930,stock_1630,stock_2030,change_1,change_2,change_3
68213c05b14699806189b2b0,Wildrose Herbal D-TOX Kit 12day Program,67ffcc6581edee2219c54e94,Unknown,64.99,54.99,Health & Wellness,9,,,,,
682bbc06c8802244e1542253,Banat Toothbrush Pack Of 2,67ffcc6581edee2219c54e94,Unknown,4.99,2.99,Grocery,6,,,,,
682bbe4326bdd6612a51d31e,Auroshikha 18 Fragrance (Mini Palette),67ffcc6581edee2219c54e94,Unknown,10.99,4.99,Grocery,4,,,,,
682bbf183e6e6efab73a3fb7,Meditation Incense Cones,67ffcc6581edee2219c54e94,Unknown,12.99,6.99,Grocery,8,,,,,
6850875cf14056777f0acbd8,Desert Essence Red Raspberry Shampoo 237ml,67ffcc6581edee2219c54e94,Unknown,15.99,7.99,Grocery,2,,,,,
6869b846e76ab7f39234f42b,Sour Strips Green Apple,685f076cae659ef8e57956fc,Unknown,8.99,7.99,Snacks & Drinks,3,,,,,
6869b8b6e76ab7f3923502a3,Sour Strips Strawberry,685f076cae659ef8e57956fc,Unknown,8.99,7.99,Snacks & Drinks,4,,,,,
6869b92126c9413d166fb8bf,Sour Strips Cotton Candy,685f076cae659ef8e57956fc,Unknown,8.99,7.99,Snacks & Drinks,1,,,,,
6869b96c26c9413d166fc310,Sour Strips Watermelon,685f076cae659ef8e57956fc,Unknown,8.99,7.99,Snacks & Drinks,1,,,,,
6869b9bdd45286d9ce5ea147,Sour Strips Tropical Mango,685f076cae659ef8e57956fc,Unknown,8.99,7.99,Snacks & Drinks,1,,,,,
6869ba9ee76ab7f392353a9d,Sour Strips Pink Lemonade,685f076cae659ef8e57956fc,Unknown,8.99,7.99,Snacks & Drinks,5,,,,,
6869bae4d45286d9ce5ec328,Sour Strips Wild Cherry,685f076cae659ef8e57956fc,Unknown,8.99,7.99,Snacks & Drinks,3,,,,,
686af3f226c9413d168f16fa,Pringles Original Party Pack,685f076cae659ef8e57956fc,Unknown,5.99,5.5,Snacks & Drinks,4,,,,,
689d126ad4eefc4286f0c86b,Halloween Sprinkles (186g),65e8f30bcb43951cbd853f59,Unknown,7.99,3.99,Pantry,1,,,,,
68a523bee4d63010325aea25,Herbafresh Dead Sea Bath Salt 500g,67ffcc6581edee2219c54e94,Unknown,8.99,3.99,Grocery,15,,,,,
68bc5e026e06f3f1d9451757,L'Oreal Paris Feria Smokey Silver S1 Silver Grey Permanent Hair Dye Kit (1 ct),65e8f30bcb43951cbd853f59,Unknown,21.29,10.65,Beauty,1,,,,,
691f6eb770ccf1c96852c9f3,Coconut Cashews,691b59a5669ef62168a65bdb,Unknown,3.5,2.0,Nuts & Snacks,26,,,,,
692b87b2ddfa836f5a2ef579,CanadaDry Tonic Water,65e8f30bcb43951cbd853f59,Unknown,2.0,1.0,Drinks,4,,,,,
692ddf41ddfa836f5a52b63f,Sandwiches Frozen ( 1 sandwich),67e6b1577b5f59b1bba8c7c4,Unknown,13.0,3.0,Pizza Dough,9,,,,,
692e5b5c7aaefcde17875128,Everland Himalayan Crystal Salt 500g,67ffcc6581edee2219c54e94,Unknown,5.99,2.99,Grocery,6,,,,,
693afbd1d3fd4f887138df8c,"Mixed Artisan Loaf , Frozen ( 4 Loaves )",67e6b1577b5f59b1bba8c7c4,Unknown,30.0,9.99,Artisan Crosta,19,,,,,
6941ca5d3da7f42e08c87057,Cinnamon Banana Chips,691b59a5669ef62168a65bdb,Unknown,2.0,1.0,Nuts & Snacks,18,,,,,
694f4f235e79deb3be62174a,TRESemme Extra Hold Hairspray (311 g),65e8f30bcb43951cbd853f59,Unknown,11.79,5.89,Beauty,1,,,,,
695807500c79613ef47ed200,Pretzel Pzazz Sour Cream & Chive,685f076cae659ef8e57956fc,Unknown,4.49,3.49,Snacks & Drinks,2,,,,,
695807dba1132e12bc69c1a4,Haribo Peaches,685f076cae659ef8e57956fc,Unknown,4.79,4.19,Snacks & Drinks,6,,,,,
695808f35e79deb3beeece5d,Warheads Sour Galactic Cubes,685f076cae659ef8e57956fc,Unknown,4.29,3.69,Snacks & Drinks,2,,,,,
695809afa1132e12bc6a0f28,Trolli Sweet Peach,685f076cae659ef8e57956fc,Unknown,4.49,3.69,Snacks & Drinks,8,,,,,
69580a580c79613ef47f3b0e,Arizona Fruit Snacks,685f076cae659ef8e57956fc,Unknown,5.79,4.29,Snacks & Drinks,4,,,,,
69652c1c4af2f7687af33324,Milk Crate,69379713a3687e3a3db2d8bc,Unknown,0.25,0.01,General Merchandise,7,,,,,
696746f2d19b1cd887bcac80,Maple Leaf Vienna Sausage (113 g),65e8f30bcb43951cbd853f59,Unknown,1.67,0.83,Pantry,4,,,,,
69689ba1ec5bd6df663bb105,Frank's RedHot Spicy Buffalo Wings Sauce (354 ml),65e8f30bcb43951cbd853f59,Unknown,5.79,2.89,Pantry,2,,,,,
69689ccf72737f9491dae2ae,Gerber Lil' Entrées Mashed Potato & Gravy with Roasted Chicken & Carrots Baby Food (187 g),65e8f30bcb43951cbd853f59,Unknown,3.69,1.84,Baby,1,,,,,
69689d43ec5bd6df663bb585,Mrs. Dash Lemon Pepper Seasoning Blend (70 g),65e8f30bcb43951cbd853f59,Unknown,5.89,2.94,Pantry,1,,,,,
6968a886ec5bd6df663bd843,Gerber Lil' Entrées Mashed Potato & Gravy with Roasted Chicken & Carrots Baby Food (187 g),67bdc806855e4112ad907797,Unknown,3.69,1.84,Baby,2,,,,,
696b3c4ee4d68b246f0e4639,Chef Boyardee ABC123 Pasta in Tomato Sauce (425 g),65e8f30bcb43951cbd853f59,Unknown,2.69,1.34,Pantry,1,,,,,
696de627f3eeb6c636b06463,Gits Sambhar Mix (100 g),65e8f30bcb43951cbd853f59,Unknown,2.39,1.19,Pantry,1,,,,,
696f38c1f3eeb6c636cde93a,Gerber Meals Cheese Ravioli in Tomato Sauce with Mixed Vegetables Baby Food (187 g),65e8f30bcb43951cbd853f59,Unknown,3.69,1.84,Baby,8,,,,,
696f3e28f3eeb6c636cdf9e4,Gerber Meals Cheese Ravioli in Tomato Sauce with Mixed Vegetables Baby Food (187 g),67bdc806855e4112ad907797,Unknown,3.69,1.84,Baby,6,,,,,
69714698a0eb91f622f82d6c,Whisky Kiss Almonds,691b59a5669ef62168a65bdb,Unknown,3.5,2.0,Nuts & Snacks,36,,,,,
697146fbe2f09d0b9327b973,Salted Caramel Cashew,691b59a5669ef62168a65bdb,Unknown,3.5,2.0,Nuts & Snacks,25,,,,,
6971473140e632216a673804,Butter Toffee Almonds,691b59a5669ef62168a65bdb,Unknown,3.5,2.0,Nuts & Snacks,22,,,,,
6971479b40e632216a6747a2,Durian Choco Dipped Almonds,691b59a5669ef62168a65bdb,Unknown,4.5,3.5,Nuts & Snacks,17,,,,,
697147e9077af9138bbd2b71,Strawberry Choco Dipped Almonds,691b59a5669ef62168a65bdb,Unknown,4.5,3.5,Nuts & Snacks,16,,,,,
6971481f077af9138bbd30d3,Matcha Choco Dipped Almonds,691b59a5669ef62168a65bdb,Unknown,4.5,3.5,Nuts & Snacks,15,,,,,
6971485c9f875680704e4823,Yogurt Almonds,691b59a5669ef62168a65bdb,Unknown,4.5,2.25,Nuts & Snacks,2,,,,,
697148999f875680704e521a,Choco Salted Caramel Cashews,691b59a5669ef62168a65bdb,Unknown,4.5,3.5,Nuts & Snacks,15,,,,,
6971dd5fcf5c56b4f1afbd3a,SmartSweets Jolly Gems Assorted Flavour Hard Candy (70 g),65e8f30bcb43951cbd853f59,Unknown,9.99,4.99,Candy,2,,,,,
6971ddb8cf5c56b4f1afbe84,Jennyhouse Salon Code Glam Hair Color Glam Black Hair Dye (70 ml x 2 ct),65e8f30bcb43951cbd853f59,Unknown,17.99,8.99,Beauty,1,,,,,
69732c3e4bb7d7af11a91f93,Gatorade Orange Powder Packets (10 ct),65e8f30bcb43951cbd853f59,Unknown,9.59,4.79,Vitamins&Supplements,2,,,,,
697330594e0f1abfea691014,Pearl Milling Company Lite Syrup (710 ml),67bdc806855e4112ad907797,Unknown,5.29,2.64,Pantry,1,,,,,
697515eee4fe4341353ac7de,Frozen Bananas,5d0bd76b8894a4ebbfd7048a,Unknown,0.0,1.0,Produce,2,,,,,
6975ce314e0f1abfea9c5cc8,Heinz Sriracha Mayonnaise,67bdc806855e4112ad907797,Unknown,4.99,2.49,Pantry,2,,,,,
6976ba764bb7d7af11f788f7,New World Almond Butter Crunchy Roasted 500g,67ffcc6581edee2219c54e94,Unknown,14.99,9.99,Grocery,46,,,,,
6976bb2dcf5c56b4f1144310,Bestropics Coconut Smoothie 355ml,67ffcc6581edee2219c54e94,Unknown,3.49,1.99,Beverages,49,,,,,
6976bbec7717e37fa681e259,Karma Sparkling Watermelon Hydration Drink 285ml,67ffcc6581edee2219c54e94,Unknown,3.99,1.99,Beverages,26,,,,,
6976bc9ccf5c56b4f114614f,Karma Sparkling Grape Hydration Drink 285ml,67ffcc6581edee2219c54e94,Unknown,3.99,1.99,Beverages,25,,,,,
6976bce23695546c5d4594c5,Karma Apple Soda 285ml,67ffcc6581edee2219c54e94,Unknown,3.99,1.99,Beverages,25,,,,,
6976bd304e0f1abfeaaeefcf,Karma Berry Soda 285ml,67ffcc6581edee2219c54e94,Unknown,3.99,1.99,Beverages,29,,,,,
69771ab14e0f1abfeab3331f,Gerber Lil' Entrées Mac & Cheese with Peas & Carrots Baby Food (187 g),65e8f30bcb43951cbd853f59,Unknown,4.49,2.24,Baby,8,,,,,
697723d0cf5c56b4f11902fb,Gerber Meals Mac & Cheese with Peas & Carrots Baby Food (187 g),67bdc806855e4112ad907797,Unknown,4.49,2.24,Baby,7,,,,,
697877287717e37fa6a37ac5,Quaker Carrot Muffin Mix (900 g),65e8f30bcb43951cbd853f59,Unknown,5.07,2.53,Pantry,7,,,,,
697879cc3695546c5d633170,Quaker Carrot Muffin Mix (900 g),67bdc806855e4112ad907797,Unknown,5.07,2.53,Pantry,9,,,,,
6979bddc4e0f1abfeae5589b,Gatorade Zero Glacier Cherry Powder Packets (10 ct),65e8f30bcb43951cbd853f59,Unknown,9.99,4.99,Drinks,5,,,,,
697b0a40e41ad7f03835403a,Schneider's Juicy Jumbo Three Cheese Jalapeno Loaded Wieners (375 g),65e8f30bcb43951cbd853f59,Unknown,11.39,5.69,Meat & Fish,4,,,,,
697b101b07574c87e30b2880,Knorr Beef Bouillon Cubes (63 g),65e8f30bcb43951cbd853f59,Unknown,3.99,1.99,Pantry,20,,,,,
697b1070f9dbb16ff2ffa653,Knorr Mexican Beef Bouillon Cubes (63 g),65e8f30bcb43951cbd853f59,Unknown,2.77,1.39,Pantry,21,,,,,
697b115fcf0decd78831b8f8,Super Q Golden Bihon Cornstarch Sticks (454 g),65e8f30bcb43951cbd853f59,Unknown,2.69,1.34,Pantry,4,,,,,
697b1262f9dbb16ff2ffaf5a,Betty Crocker Walnut Banana Bread Mix (348 g),65e8f30bcb43951cbd853f59,Unknown,4.69,2.34,Pantry,5,,,,,
697b12c9f9dbb16ff2ffb1d4,Heinz Mango Habanero Mayo,65e8f30bcb43951cbd853f59,Unknown,4.0,2.0,Pantry,1,,,,,
697b1a42cf0decd78831d942,Knorr Beef Bouillon Cubes (63 g),67bdc806855e4112ad907797,Unknown,3.99,1.99,Pantry,16,,,,,
697b1c53cf0decd78831de09,Betty Crocker Walnut Banana Bread Mix (348 g),67bdc806855e4112ad907797,Unknown,4.69,2.34,Pantry,6,,,,,
697b1c53e41ad7f038357be5,Knorr Mexican Beef Bouillon Cubes (63 g),67bdc806855e4112ad907797,Unknown,2.77,1.38,Pantry,13,,,,,
697b1c5be41ad7f038357c14,Heinz Mayonnaise Style Mango Habanero Sauce,67bdc806855e4112ad907797,Unknown,4.99,2.5,Pantry,9,,,,,
697c6b5e9a94d1f5707d5618,Hershey's Fudge Brownie ,67bdc806855e4112ad907797,Unknown,3.79,1.89,Candy,2,,,,,
697c6bee2144d4a53d58fe1d,Honibe Immune Boost Honey Lozenges (10 ct),67bdc806855e4112ad907797,Unknown,5.89,2.94,Medicine,3,,,,,
697c6c27b18d7c28790198a9,Children's Motrin Fever & Pain Relief Dye-Free Berry Oral Suspension (120 ml),67bdc806855e4112ad907797,Unknown,11.99,5.99,Medicine,1,,,,,
697c6c34b18d7c28790198c2,Emergen-C Immune Support Strawberry Crystals (24 ct),67bdc806855e4112ad907797,Unknown,20.89,10.44,Vitamins&Supplements,1,,,,,
697c6cc02144d4a53d590063,Imodium Complete Caplets (20 ct),67bdc806855e4112ad907797,Unknown,33.49,16.74,Medicine,6,,,,,
697c6ced99d3c5ddb47f96c2,Blistex Deep Moisture Renewal Broad Spectrum SPF 15 Lip Protectant (1 ct),67bdc806855e4112ad907797,Unknown,6.39,3.19,Beauty,4,,,,,
697c6d3e99d3c5ddb47f9800,Purina One +Plus Healthy Puppy Lamb Dry Puppy Food (1.81 kg),67bdc806855e4112ad907797,Unknown,15.59,7.79,Pet Care,2,,,,,
697c6d5c99d3c5ddb47f9886,Purina Dog Chow Complete Adult Dry Dog Food (8 kg),67bdc806855e4112ad907797,Unknown,28.59,14.29,Pet Care,1,,,,,
697d3bf2d96ad3ac17016eb7,Honibe Immune Boost Honey Lozenges (10 ct),65e8f30bcb43951cbd853f59,Unknown,5.89,2.94,Medicine,1,,,,,
697d3c47719e3aa44e7ea49d,Old Spice Sweat Defense Stronger Swagger Dry Spray Antiperspirant (122 g),65e8f30bcb43951cbd853f59,Unknown,12.49,6.24,Personal Care,1,,,,,
697d3cadd96ad3ac17018653,Gaviscon Max Relief Berry Blend Acid Reflux & Heartburn Relief Tablets (50 ct),65e8f30bcb43951cbd853f59,Unknown,20.89,10.44,Medicine,1,,,,,
697d3cf47d3c1497a47220a9,Gerber Mealtime Beef & Veggies Purée (160 ml),65e8f30bcb43951cbd853f59,Unknown,2.99,1.49,Baby,2,,,,,
697d3dbabcbf3ae52d1f0219,Blistex Complete Moisture Lip Balm (1 ct),65e8f30bcb43951cbd853f59,Unknown,5.89,2.94,Beauty,151,,,,,
697db336e9a0a7e95d6182b0,"Alpo Cookout Classics Pork, Beef, Chicken, & Veggie Dog Food (7.2 kg)",65e8f30bcb43951cbd853f59,Unknown,26.29,13.15,Pet Care,1,,,,,
697db7f7861645b84c325593,Enfamil A+ Stage 1 Powder Formula Refill (992 g),65e8f30bcb43951cbd853f59,Unknown,75.99,37.99,Baby,2,,,,,
697db857ee5a6123d4c57e5c,Durex Play 2-in-1 Ylang Ylang Massage Lubricant (200 ml),65e8f30bcb43951cbd853f59,Unknown,19.99,9.99,Personal Care,4,,,,,
697dbe12865b08757797f640,Gatorade Zero Grape Powder Packets (10 ct),67bdc806855e4112ad907797,Unknown,9.59,4.79,Vitamins&Supplements,4,,,,,
697f0327d0ddd9320aafc592,Taco Bell Creamy Baja Sauce (354 ml),65e8f30bcb43951cbd853f59,Unknown,5.79,2.89,Pantry,6,,,,,
697f033b865b087577b24cf7,Kraft French Dressing (425 ml),65e8f30bcb43951cbd853f59,Unknown,4.49,2.24,Pantry,8,,,,,
697f0b2ee9a0a7e95d7f4110,Kraft French Dressing (425 ml),67bdc806855e4112ad907797,Unknown,4.49,2.24,Pantry,8,,,,,
697f0c63e9a0a7e95d7f4814,Taco Bell Creamy Baja Sauce (354 ml),67bdc806855e4112ad907797,Unknown,5.79,2.89,Pantry,3,,,,,
69805b13e9a0a7e95d9b5888,Taco Bell Crunch Wrap Supreme Cravings Kit(642 g),65e8f30bcb43951cbd853f59,Unknown,9.99,4.99,Pantry,3,,,,,
69805b7e865b087577cb4385,Old El Paso Smart Fiesta Taco Seasoning Mix (24 g),65e8f30bcb43951cbd853f59,Unknown,1.89,0.94,Pantry,5,,,,,
69805ba4865b087577cb4402,Kraft Stove Top Lower Sodium Chicken Stuffing Mix (120 g),65e8f30bcb43951cbd853f59,Unknown,2.89,1.44,Pantry,1,,,,,
69806277d0ddd9320ac86a29,Taco Bell Crunchwrap Supreme Cravings Kit (642 g),67bdc806855e4112ad907797,Unknown,9.99,4.99,Pantry,2,,,,,
6981b06c865b087577e6a294,Kraft Calorie-Wise Catalina Dressing (425 ml),65e8f30bcb43951cbd853f59,Unknown,4.49,2.24,Pantry,9,,,,,
6981b0a5d0ddd9320ae3b5f4,Carnaby Sweet Sour Watermelon Syrup (428 ml),65e8f30bcb43951cbd853f59,Unknown,5.49,2.74,Pantry,11,,,,,
6981b13fd0ddd9320ae3b689,Greetalia Honey Dill Sauce (500ml),65e8f30bcb43951cbd853f59,Unknown,4.7,2.35,Easy Meals,6,,,,,
6981b184865b087577e6a5df,Kraft Stove Top Lower Sodium Chicken Stuffing Mix (120 g),65e8f30bcb43951cbd853f59,Unknown,2.89,1.44,Pantry,6,,,,,
6981b348861645b84c82754e,Mama Sita's Tocino Marinating Mix (75 g),67bdc806855e4112ad907797,Unknown,1.89,0.94,Pantry,15,,,,,
6981b348ee5a6123d41bf74e,Carnaby Sweet Sour Watermelon Syrup (428 ml),67bdc806855e4112ad907797,Unknown,5.49,2.74,Pantry,11,,,,,
6981b351ee5a6123d41bf76f,Greetalia Honey Dill sauce,67bdc806855e4112ad907797,Unknown,4.99,2.5,Pantry,4,,,,,
6981b3e1861645b84c827709,Taco Bell Crunchy Taco Cravings Kit (260 g),67bdc806855e4112ad907797,Unknown,5.79,2.89,Pantry,3,,,,,
6982f85b861645b84c9e0c87,Carnaby Sweet Cotton Candy Syrup (428 ml),65e8f30bcb43951cbd853f59,Unknown,5.49,2.74,Pantry,6,,,,,
6982f9e4861645b84c9e1169,Old Dutch Gourmet Seasoned Pretzel Spindles (250 g),65e8f30bcb43951cbd853f59,Unknown,5.49,2.74,Snacks,7,,,,,
6982fcea861645b84c9e1ba9,Carnaby Sweet Cotton Candy Syrup (428 ml),65e8f30bcb43951cbd853f59,Unknown,5.49,2.74,Pantry,6,,,,,
6982fcfb861645b84c9e1bfd,Gatorade Zero Lemon-Lime Powder Packets (10 ct),65e8f30bcb43951cbd853f59,Unknown,9.99,4.99,Drinks,8,,,,,
698301c3d0ddd9320afee0ef,Gatorade Zero Lemon-Lime Powder Packets (10 ct),67bdc806855e4112ad907797,Unknown,9.99,4.99,Drinks,2,,,,,
698301c4865b08757701d107,Carnaby Sweet Cotton Candy Syrup (428 ml),67bdc806855e4112ad907797,Unknown,5.49,2.74,Pantry,10,,,,,
698301c4d0ddd9320afee0fc,Dare Bear Paws Banana Bread Cookies (240 g),67bdc806855e4112ad907797,Unknown,4.49,2.24,Snacks,2,,,,,
6984486b861645b84cbaf00d,Mama Sita's Caldereta Spicy Sauce Mix (50 g),65e8f30bcb43951cbd853f59,Unknown,1.89,0.94,Pantry,23,,,,,
698448a5d0ddd9320a1a6514,Knorr Zero Salt Roasted Garlic Bouillon Powder (160 g),65e8f30bcb43951cbd853f59,Unknown,9.29,4.64,Pantry,10,,,,,
69844ab4861645b84cbaf8ef,Sempio Korean BBQ Bulgogi Marinade Sauce (900 g),65e8f30bcb43951cbd853f59,Unknown,7.99,3.99,Pantry,4,,,,,
69845853865b0875771df311,Heinz Tartar Sauce (354 ml),67bdc806855e4112ad907797,Unknown,5.89,2.94,Pantry,1,,,,,
69845853e9a0a7e95df67630,Kraft Calorie-Wise Catalina Dressing (425 ml),67bdc806855e4112ad907797,Unknown,4.49,2.24,Pantry,9,,,,,
69845853e9a0a7e95df6763d,Knorr Zero Salt Roasted Garlic Bouillon Powder (160 g),67bdc806855e4112ad907797,Unknown,9.29,4.64,Pantry,7,,,,,
6984d7afee5a6123d46250de,Mixed Frozen Pastry  3 Pc,67e6b1577b5f59b1bba8c7c4,Unknown,20.0,5.0,Pizza Dough,4,,,,,
6984d853e9a0a7e95dffd353,2 Pizza Dough FRESH,67e6b1577b5f59b1bba8c7c4,Unknown,12.0,4.99,Pizza Dough,9,,,,,
6984d8d7ee5a6123d4628adf,1 Mixed Artisan Frozen,67e6b1577b5f59b1bba8c7c4,Unknown,6.99,2.0,Sourdough,4,,,,,
6984d96dee5a6123d462a3da,"250 Ml Soup ,1 Loaf Bread  , Croissant",67e6b1577b5f59b1bba8c7c4,Unknown,18.0,9.0,Pizza Dough,8,,,,,
698598b5861645b84cd7157b,Breton Bites Pizza Crackers (180 g),65e8f30bcb43951cbd853f59,Unknown,4.29,2.14,Snacks,8,,,,,
6985991c865b08757739c1c8,Taco Bell Mild Taco Seasoning Mix (28 g),65e8f30bcb43951cbd853f59,Unknown,1.79,0.89,Pantry,8,,,,,
6985992fd0ddd9320a36731d,PAM No-Stick Air Fryer Cooking Spray (141 g),65e8f30bcb43951cbd853f59,Unknown,7.29,3.64,Pantry,10,,,,,
69859c26ee5a6123d4782428,Kraft Zesty Italian Dressing (425 ml),65e8f30bcb43951cbd853f59,Unknown,4.49,2.24,Pantry,4,,,,,
69859fe3e9a0a7e95d158c88,PAM No-Stick Air Fryer Cooking Spray (141 g),67bdc806855e4112ad907797,Unknown,7.29,3.64,Pantry,9,,,,,
6985a013e9a0a7e95d158d0f,Knorr Zero Salt Beef Bouillon Powder (160 g),67bdc806855e4112ad907797,Unknown,9.29,4.64,Pantry,9,,,,,
6985a050d0ddd9320a3692bb,Taco Bell Mild Taco Seasoning Mix (28 g),67bdc806855e4112ad907797,Unknown,1.79,0.89,Pantry,7,,,,,
698650b7cdf3ac47e4cf2fe7,top dogs,5fac3e04d7528a3c966b13a4,Unknown,5.99,2.99,Meat,8,,,,,
6986e8e860a3aaa497e27c54,Knorr Poudre de bouillon de bœuf sans sel / Zero Salt Beef Bouillon Powder (160 g),65e8f30bcb43951cbd853f59,Unknown,9.29,4.64,Pantry,11,,,,,
6986e94260a3aaa497e27dc7,Milk Bone Soft & Chewy Steak & Cheese Dog Treats (113 g),65e8f30bcb43951cbd853f59,Unknown,3.29,1.64,Pet Care,3,,,,,
6986fbc760a3aaa497e2cad6,Amooza Mozzarella Cheese Sticks (228 g),67bdc806855e4112ad907797,Unknown,8.99,4.49,Dairy & Eggs,2,,,,,
698706db38ce139b25c98773,Quaker Carrot Muffin Mix (900 g),65e8f30bcb43951cbd853f59,Unknown,5.07,2.53,Pantry,2,,,,,
698844d060a3aaa4970119e9,Snyder's of Hanover Twisted Nacho Cheese Pretzel Sticks (340 g),65e8f30bcb43951cbd853f59,Unknown,6.09,3.04,Snacks,9,,,,,
6988480a631683bc34617df2,Snyder's of Hanover Twisted Nacho Cheese Pretzel Sticks (340 g),67bdc806855e4112ad907797,Unknown,6.09,3.04,Snacks,2,,,,,
6988481d10bcc88893304cdf,Terra Sour Cream & Onion Vegetable Chips (141 g),67bdc806855e4112ad907797,Unknown,6.49,3.24,Snacks,8,,,,,
6988d7c100585416b95429e4,From Our Chef Oven Roasted Ham 900gr,5d0bd76c8894a4ebbfd704b8,Unknown,40.0,18.0,HMR,5,,,,,
6988ffede5de2b13bb4746be,candy cane cake poppers,5ddef30c9af4e045c44b9d67,Unknown,6.5,3.25,Bakery,3,,,,,
6989922a631683bc347995c6,Ritz Cheddar Flavoured Cheese Nibs (180 g),65e8f30bcb43951cbd853f59,Unknown,4.69,2.34,Snacks,1,,,,,
6989925138ce139b25038e07,Club House La Grille Spicy Montreal Steak Spice Seasoning (157 g),65e8f30bcb43951cbd853f59,Unknown,7.59,3.79,Pantry,3,,,,,
698999fb10bcc88893489f3b,Renee's Greek Feta Dressing (355 ml),67bdc806855e4112ad907797,Unknown,7.49,3.74,Pantry,4,,,,,
698999fb60a3aaa4971b5d1d,Pedigree DentaStix Medium Original Flavour Dog Treats (608 g),67bdc806855e4112ad907797,Unknown,13.29,6.64,Pet Care,1,,,,,
698a1dd4b6083324ab2bd08d,Organic Cream 10%,5fac3e04d7528a3c966b13a4,Unknown,3.99,1.99,Centre of Store,8,,,,,
698a3e5c38ce139b25121731,iceberg lettuce,65a1a8282f4530e32514d6c3,Unknown,4.99,2.5,Produce,7,,,,,
698a6de210bcc888935c3465,Dark Choco Gingers,691b59a5669ef62168a65bdb,Unknown,4.5,3.0,Nuts & Snacks,14,,,,,
698a6e5d60a3aaa49730527e,Truffle Pistachios,691b59a5669ef62168a65bdb,Unknown,13.5,8.5,Nuts & Snacks,5,,,,,
698a6ef0631683bc348cb934,Super Mac Nut Mix,691b59a5669ef62168a65bdb,Unknown,20.0,14.0,Nuts & Snacks,5,,,,,
698a6f4260a3aaa497307211,Fancy Nut Mix,691b59a5669ef62168a65bdb,Unknown,15.0,11.0,Nuts & Snacks,5,,,,,
698a6fc110bcc888935c6c25,Inshell Peanuts Salted,691b59a5669ef62168a65bdb,Unknown,4.0,2.5,Nuts & Snacks,7,,,,,
698a6ff038ce139b2519890e,Inshell Peanuts Unsalted,691b59a5669ef62168a65bdb,Unknown,4.0,2.0,Nuts & Snacks,4,,,,,
698ae5e410bcc8889364014d,Dairyland chocolate milk 946ml,65e8f30bcb43951cbd853f59,Unknown,3.0,1.5,Dairy & Eggs,3,,,,,
698ae7ea10bcc888936407e6,Pillsbury Reese's Peanut Butter Cookie Dough (454 g),65e8f30bcb43951cbd853f59,Unknown,5.69,2.84,Bakery,4,,,,,
698ae7fe38ce139b2521c690,The Laughing Cow Original Cheese Dippers with Whole Grain Breadsticks (140 g),65e8f30bcb43951cbd853f59,Unknown,4.39,2.19,Dairy & Eggs,3,,,,,
698ae850631683bc34942ba3,Liberte 5% Raspberry Greek Yogurt (100 g x 4 ct),65e8f30bcb43951cbd853f59,Unknown,5.39,2.69,Dairy & Eggs,1,,,,,
698aeb0010bcc88893640f1e,Dairyland 33% Whipping Cream Carton (946 ml),67bdc806855e4112ad907797,Unknown,7.69,3.84,Dairy & Eggs,8,,,,,
698aeee410bcc888936418e6,Goldfish Crisps Salt & Vinegar Baked Crackers (177 g),65e8f30bcb43951cbd853f59,Unknown,3.17,1.58,Snacks,3,,,,,
698b473efb240c94378ad05c,Macaroni Salad,5d0bd76b8894a4ebbfd7048a,Unknown,7.49,3.74,HMR,3,,,,,
698b682d988f28c4ca97865c,Mixed Produce Box #50,5d0bd76b8894a4ebbfd7048a,Unknown,5.0,5.0,Produce,1,,,,,
698b6845e5de2b13bbb5d573,Mixed Produce Box #51,5d0bd76b8894a4ebbfd7048a,Unknown,5.0,5.0,Produce,1,,,,,
698b685b988f28c4ca979701,Mixed Produce Box #60,5d0bd76b8894a4ebbfd7048a,Unknown,5.0,5.0,Produce,1,,,,,
698b68c089dc00ce48f93c00,Mixed Produce Box #68,5d0bd76b8894a4ebbfd7048a,Unknown,5.0,5.0,Produce,1,,,,,
698b6940b6083324ab7bea85,Mixed Produce Box #70,5d0bd76b8894a4ebbfd7048a,Unknown,5.0,5.0,Produce,1,,,,,
698b6c9a89dc00ce48fabf9b,Free From Smoked Black Forest Ham,5d0bd76b8894a4ebbfd7048a,Unknown,8.5,4.25,Deli & Ready Meals,6,,,,,
698b78e53b056c06dedc4320,FROZEN berries,5d0bd76b8894a4ebbfd7048a,Unknown,0.0,3.0,Produce,4,,,,,
698b78f6e9be5bffd2e5c343,Frozen Bananas,5d0bd76b8894a4ebbfd7048a,Unknown,0.0,1.5,Produce,1,,,,,
698b796a3887249b9e110706,Boost Protein Drink 20g Protein 237ml,69379713a3687e3a3db2d8bc,Unknown,3.99,1.5,Grocery,4,,,,,
698b7b74e9be5bffd2e6d38c,Mixed Produce Box #150,5d0bd76c8894a4ebbfd704b8,Unknown,5.0,5.0,Produce,1,,,,,
698b7b8bc4a187cb6c0ae332,Mixed Produce Box #152,5d0bd76c8894a4ebbfd704b8,Unknown,5.0,5.0,Produce,1,,,,,
698b7bb7ff05ab02e94795cd,Mixed Produce Box #153,5d0bd76c8894a4ebbfd704b8,Unknown,5.0,5.0,Produce,1,,,,,
698b7bc6e9be5bffd2e6e3fc,Mixed Produce Box #154,5d0bd76c8894a4ebbfd704b8,Unknown,5.0,5.0,Produce,1,,,,,
698b7bd03b056c06dedd209a,Mixed Produce Box #155,5d0bd76c8894a4ebbfd704b8,Unknown,5.0,5.0,Produce,1,,,,,
698b7bf5c4a187cb6c0b1407,Mixed Produce Box #157,5d0bd76c8894a4ebbfd704b8,Unknown,5.0,5.0,Produce,1,,,,,
698b7c01ff05ab02e947ac99,Mixed Produce Box #158,5d0bd76c8894a4ebbfd704b8,Unknown,5.0,5.0,Produce,1,,,,,
698b7c0cc4a187cb6c0b1d39,Mixed Produce Box #159,5d0bd76c8894a4ebbfd704b8,Unknown,5.0,5.0,Produce,1,,,,,
698b7c519476de55746df3ae,Mixed Produce Box #161,5d0bd76c8894a4ebbfd704b8,Unknown,5.0,5.0,Produce,1,,,,,
698b7c879476de55746e0b7c,Mixed Produce Box #163,5d0bd76c8894a4ebbfd704b8,Unknown,5.0,5.0,Produce,1,,,,,
698b7c919476de55746e0fb7,Mixed Produce Box #164,5d0bd76c8894a4ebbfd704b8,Unknown,5.0,5.0,Produce,1,,,,,
698b7c9e9476de55746e159a,Mixed Produce Box #165,5d0bd76c8894a4ebbfd704b8,Unknown,5.0,5.0,Produce,1,,,,,
698b7d23ff05ab02e948211c,Mixed Produce Box #166,5d0bd76c8894a4ebbfd704b8,Unknown,5.0,5.0,Produce,1,,,,,
698b7d303b056c06deddb000,Mixed Produce Box #167,5d0bd76c8894a4ebbfd704b8,Unknown,5.0,5.0,Produce,1,,,,,
698b7d919476de55746e6296,Mixed Produce Box #169,5d0bd76c8894a4ebbfd704b8,Unknown,5.0,5.0,Produce,1,,,,,
698b7d9c3b056c06deddd08c,Mixed Produce Box #170,5d0bd76c8894a4ebbfd704b8,Unknown,5.0,5.0,Produce,1,,,,,
698b7da5c4a187cb6c0bb186,Mixed Produce Box #171,5d0bd76c8894a4ebbfd704b8,Unknown,5.0,5.0,Produce,1,,,,,
698b7e3cff05ab02e94882ae,Mixed Produce Box #172,5d0bd76c8894a4ebbfd704b8,Unknown,5.0,5.0,Produce,1,,,,,
698b96959476de557476b191,"Dairy-Free Whipping Cream Alternative, Coconut based",5fac3e04d7528a3c966b13a4,Unknown,5.79,2.89,Centre of Store,2,,,,,
698b97e7c4a187cb6c15e5d2,"Pepperoni, Sliced",629cec56061cc278a85326dc,Unknown,6.0,3.0,Meat,6,,,,,
698b9c403b056c06dee6fa42,Frozen Berries,5ddef30c9af4e045c44b9d67,Unknown,0.0,3.0,Produce,8,,,,,
698baab19476de55747d20c8,Free From Original Breakfast Pork Sausages,5fac3e04d7528a3c966b13a4,Unknown,7.5,3.75,"Bacon, Sausages & Hot Dogs",2,,,,,
698bb10f5f6e0bbdf058f0b9,Peanuts unsalted 227g,691b59a5669ef62168a65bdb,Unknown,3.5,1.5,Nuts & Snacks,11,,,,,
698bf46ee9be5bffd20617bc,assorted bulk  buns 12 pack,5d0bd76c8894a4ebbfd704b8,Unknown,4.0,1.44,Bakery Instore,1,,,,,
698bf4a3e9be5bffd2061d46,assorted bulk  hotdog buns 12 pack,5d0bd76c8894a4ebbfd704b8,Unknown,4.0,1.44,Bakery Instore,1,,,,,
698c13099476de55748e2437,Mixed Produce Box #106,5d0bd76b8894a4ebbfd7048a,Unknown,5.0,5.0,Produce,1,,,,,
698c1336ff05ab02e96981df,Mixed Produce Box #105,5d0bd76b8894a4ebbfd7048a,Unknown,5.0,5.0,Produce,1,,,,,
698c13649476de55748e26c0,Mixed Produce Box #91,5d0bd76b8894a4ebbfd7048a,Unknown,5.0,5.0,Produce,1,,,,,
698c13af3b056c06defc3b93,Mixed Produce Box #64,5d0bd76b8894a4ebbfd7048a,Unknown,5.0,5.0,Produce,1,,,,,
698c13c0ff05ab02e9698914,Mixed Produce Box #94,5d0bd76b8894a4ebbfd7048a,Unknown,5.0,5.0,Produce,1,,,,,
698c16bcc4a187cb6c30002a,Mixed Produce Box #61,5d0bd76b8894a4ebbfd7048a,Unknown,5.0,5.0,Produce,1,,,,,
698c2ea85f6e0bbdf062e31a,WAKEMAKE Water Glow Coating Foundation #23 Beige (30 ml),65e8f30bcb43951cbd853f59,Unknown,39.99,19.99,Beauty,3,,,,,
698c2ebb9f2f71d05bf4ad3e,Grace Peanut Punch,65e8f30bcb43951cbd853f59,Unknown,1.59,0.79,Pantry,2,,,,,
698c2f0d730afb77e7253193,Little Sheep Plain Hot Pot Soup Base (130 g),65e8f30bcb43951cbd853f59,Unknown,6.39,3.19,Pantry,14,,,,,
698c3f25730afb77e72565ec,WAKEMAKE Water Glow Coating Foundation #23 Beige (30 ml),67bdc806855e4112ad907797,Unknown,39.99,19.99,Beauty,2,,,,,
698c3f259f2f71d05bf4ddb7,"""Balady Bread 7"""" Whole Wheat Pita (300 g)""",67bdc806855e4112ad907797,Unknown,2.99,1.49,Bakery,2,,,,,
698c3f25cef1e3f1e10f49af,Little Sheep Plain Hot Pot Soup Base (130 g),67bdc806855e4112ad907797,Unknown,6.39,3.19,Pantry,24,,,,,
698c3f3d9f2f71d05bf4ddfd,Maynards Original Gummies (150 g),67bdc806855e4112ad907797,Unknown,3.89,1.94,Candy,2,,,,,
698c8791e9be5bffd2139636,Mixed Produce Box #55,5d0bd76b8894a4ebbfd7048a,Unknown,5.0,5.0,Produce,1,,,,,
698c879e9476de5574992e49,Mixed Produce Box #56,5d0bd76b8894a4ebbfd7048a,Unknown,5.0,5.0,Produce,1,,,,,
698c87b1c4a187cb6c3cd41f,Mixed Produce Box #57,5d0bd76b8894a4ebbfd7048a,Unknown,5.0,5.0,Produce,1,,,,,
698c87b63b056c06de06f020,Mixed Produce Box #58,5d0bd76b8894a4ebbfd7048a,Unknown,5.0,5.0,Produce,1,,,,,
698c87c39476de5574993a37,Mixed Produce Box #59,5d0bd76b8894a4ebbfd7048a,Unknown,5.0,5.0,Produce,1,,,,,
698c880f9476de55749954a7,Mixed Produce Box #64,5d0bd76b8894a4ebbfd7048a,Unknown,5.0,5.0,Produce,1,,,,,
698cba61ff05ab02e9890455,cheese dippers,5d0bd76b8894a4ebbfd7048a,Unknown,4.79,2.39,Deli,22,,,,,
