item_id,item_name,store_id,store_name,original_price,price,category,stock_0930,stock_1630,stock_2030,change_1,change_2,change_3
68213c05b14699806189b2b0,Wildrose Herbal D-TOX Kit 12day Program,67ffcc6581edee2219c54e94,Unknown,64.99,54.99,Health & Wellness,9,,,,,
682bbc06c8802244e1542253,Banat Toothbrush Pack Of 2,67ffcc6581edee2219c54e94,Unknown,4.99,2.99,Grocery,6,,,,,
682bbf183e6e6efab73a3fb7,Meditation Incense Cones,67ffcc6581edee2219c54e94,Unknown,12.99,6.99,Grocery,8,,,,,
6869b846e76ab7f39234f42b,Sour Strips Green Apple,685f076cae659ef8e57956fc,Unknown,8.99,7.99,Snacks & Drinks,3,,,,,
6869b8b6e76ab7f3923502a3,Sour Strips Strawberry,685f076cae659ef8e57956fc,Unknown,8.99,7.99,Snacks & Drinks,4,,,,,
6869b96c26c9413d166fc310,Sour Strips Watermelon,685f076cae659ef8e57956fc,Unknown,8.99,7.99,Snacks & Drinks,1,,,,,
6869b9bdd45286d9ce5ea147,Sour Strips Tropical Mango,685f076cae659ef8e57956fc,Unknown,8.99,7.99,Snacks & Drinks,1,,,,,
6869ba9ee76ab7f392353a9d,Sour Strips Pink Lemonade,685f076cae659ef8e57956fc,Unknown,8.99,7.99,Snacks & Drinks,5,,,,,
6869bae4d45286d9ce5ec328,Sour Strips Wild Cherry,685f076cae659ef8e57956fc,Unknown,8.99,7.99,Snacks & Drinks,3,,,,,
686af3f226c9413d168f16fa,Pringles Original Party Pack,685f076cae659ef8e57956fc,Unknown,5.99,5.5,Snacks & Drinks,4,,,,,
68a523bee4d63010325aea25,Herbafresh Dead Sea Bath Salt 500g,67ffcc6581edee2219c54e94,Unknown,8.99,3.99,Grocery,15,,,,,
68bc5e026e06f3f1d9451757,L'Oreal Paris Feria Smokey Silver S1 Silver Grey Permanent Hair Dye Kit (1 ct),65e8f30bcb43951cbd853f59,Unknown,21.29,10.65,Beauty,1,,,,,
691f6eb770ccf1c96852c9f3,Coconut Cashews,691b59a5669ef62168a65bdb,Unknown,3.5,2.0,Nuts & Snacks,18,,,,,
691f6f952363bcbd857e1d3e,Milk Choco Covered Salted Caramel Peanuts,691b59a5669ef62168a65bdb,Unknown,4.5,3.5,Nuts & Snacks,9,,,,,
692e5b5c7aaefcde17875128,Everland Himalayan Crystal Salt 500g,67ffcc6581edee2219c54e94,Unknown,5.99,2.99,Grocery,5,,,,,
695807500c79613ef47ed200,Pretzel Pzazz Sour Cream & Chive,685f076cae659ef8e57956fc,Unknown,4.49,3.49,Snacks & Drinks,2,,,,,
695807dba1132e12bc69c1a4,Haribo Peaches,685f076cae659ef8e57956fc,Unknown,4.79,4.19,Snacks & Drinks,6,,,,,
69714698a0eb91f622f82d6c,Whisky Kiss Almonds,691b59a5669ef62168a65bdb,Unknown,3.5,2.0,Nuts & Snacks,29,,,,,
697146fbe2f09d0b9327b973,Salted Caramel Cashew,691b59a5669ef62168a65bdb,Unknown,3.5,2.0,Nuts & Snacks,10,,,,,
6971473140e632216a673804,Butter Toffee Almonds,691b59a5669ef62168a65bdb,Unknown,3.5,2.0,Nuts & Snacks,10,,,,,
6971481f077af9138bbd30d3,Matcha Choco Dipped Almonds,691b59a5669ef62168a65bdb,Unknown,4.5,3.5,Nuts & Snacks,2,,,,,
697148999f875680704e521a,Choco Salted Caramel Cashews,691b59a5669ef62168a65bdb,Unknown,4.5,3.5,Nuts & Snacks,7,,,,,
6976ba764bb7d7af11f788f7,New World Almond Butter Crunchy Roasted 500g,67ffcc6581edee2219c54e94,Unknown,14.99,8.99,Grocery,41,,,,,
6976bbec7717e37fa681e259,Karma Sparkling Watermelon Hydration Drink 285ml,67ffcc6581edee2219c54e94,Unknown,3.99,1.99,Beverages,25,,,,,
6976bc9ccf5c56b4f114614f,Karma Sparkling Grape Hydration Drink 285ml,67ffcc6581edee2219c54e94,Unknown,3.99,1.99,Beverages,24,,,,,
6976bce23695546c5d4594c5,Karma Apple Soda 285ml,67ffcc6581edee2219c54e94,Unknown,3.99,1.99,Beverages,19,,,,,
6976bd304e0f1abfeaaeefcf,Karma Berry Soda 285ml,67ffcc6581edee2219c54e94,Unknown,3.99,1.99,Beverages,23,,,,,
698a6de210bcc888935c3465,Dark Choco Gingers,691b59a5669ef62168a65bdb,Unknown,4.5,3.0,Nuts & Snacks,1,,,,,
698f97126b722fca3c676d2d,Clamato Extra Spicy Rimmer,65bd257956f2d4f45a3da0e2,Unknown,4.99,2.49,Centre of Store,2,,,,,
6990a5f7f3da2e15883cfdb8,Clearblue Digital & Visual Pregnancy Test Combo Pack (2 ct),65e8f30bcb43951cbd853f59,Unknown,24.99,24.99,Personal Care,1,,,,,
69b9d6eadb0f1efc55b0f9b7,"Mixed Artisan Loaf  , High Quality",67e6b1577b5f59b1bba8c7c4,Unknown,14.0,4.0,Artisan Crosta,9,,,,,
69b9d74adb0f1efc55b10093,"Mixed Pastry , Frozen",67e6b1577b5f59b1bba8c7c4,Unknown,18.0,5.0,Tuscan,5,,,,,
69c4d5fca4a30fc23dba81a8,Quaker Bran Muffin Mix (900 g),65e8f30bcb43951cbd853f59,Unknown,7.49,3.74,Pantry,1,,,,,
69c62a18f4ba5120831ea846,Heinz Garlic Mayo,65e8f30bcb43951cbd853f59,Unknown,4.99,2.49,Pantry,1,,,,,
69c62b016e02b353d07998cd,Nissin Crab Instant Noodle Cup (69 g),65e8f30bcb43951cbd853f59,Unknown,2.49,1.24,Pantry,13,,,,,
69c777c1d80c66b9d315d9e1,Maple Leaf 26% Less Salt Flakes of Ham (156 g),67bdc806855e4112ad907797,Unknown,3.99,1.99,Pantry,2,,,,,
69ca1a53f4ba51208353ddbf,Heinz Sriracha Mayonnaise Style Sauce (340 ml),65e8f30bcb43951cbd853f59,Unknown,4.99,2.49,Pantry,2,,,,,
69cb1ea76e02b353d0bc310b,Preparation H Ointment with Bio-Dyne Multi-Symptom Hemorrhoid Treatment (25 g),65e8f30bcb43951cbd853f59,Unknown,11.49,5.74,Medicine,10,,,,,
69cb7186f4ba5120836697f9,Whiskas Catmilk Cat Drink Treat (200 ml),65e8f30bcb43951cbd853f59,Unknown,3.39,1.69,Pet Care,4,,,,,
69cb721bf4ba51208366998c,Naam Coconut Curry Sauce (350 ml),65e8f30bcb43951cbd853f59,Unknown,8.49,4.24,Pantry,1,,,,,
69cb762b58ea93478c476a05,Naam Coconut Curry Sauce (350 ml),67bdc806855e4112ad907797,Unknown,8.49,4.24,Pantry,5,,,,,
69cc4e096e02b353d0cadafc,Yogurt Raisins,691b59a5669ef62168a65bdb,Unknown,4.5,3.5,Nuts & Snacks,5,,,,,
69cc4e9e58ea93478c52e670,Choco Salted Caremel Macadamia,691b59a5669ef62168a65bdb,Unknown,5.5,4.25,Nuts & Snacks,3,,,,,
69ccbcded80c66b9d357bff1,Knorr Premium Roasted Chicken Flavour Base (311 g),65e8f30bcb43951cbd853f59,Unknown,9.69,4.84,Pantry,1,,,,,
69ccbd35f4ba512083782519,Gerber Mealtime Garden Veggies Purée (162 ml),65e8f30bcb43951cbd853f59,Unknown,2.89,1.44,Baby,7,,,,,
69ccbd42f4ba51208378255e,Unico Whole Baby Clams (142 g),65e8f30bcb43951cbd853f59,Unknown,4.29,2.14,Pantry,1,,,,,
69ccbd4ff4ba512083782599,Heinz Mango Habanero Mayo,65e8f30bcb43951cbd853f59,Unknown,4.99,2.49,Pantry,1,,,,,
69ccc993d80c66b9d357dc1c,Gerber Mealtime Garden Veggies Purée (162 ml),67bdc806855e4112ad907797,Unknown,2.89,1.44,Baby,2,,,,,
69cdcbda1ac0c5f87401509e,SUNRYPE FRUIT2GO WLDBRY BULK,65bd257956f2d4f45a3da0e2,Unknown,0.49,0.24,Grocery,26,,,,,
69cdcc28b4eced6e6b0c7c44,SUNRYPE FRUIT2GO WLDBRY BULK,65bd257956f2d4f45a3da0e2,Unknown,0.49,0.24,Grocery,28,,,,,
69cdcc60b4eced6e6b0c7eb5,SUNRYPE FRUIT2GO WLDBRY BULK,65bd257956f2d4f45a3da0e2,Unknown,0.49,0.24,Grocery,47,,,,,
69cdcccd945e120abf6176ce,SUNRYPE FRUIT2GO WLDBRY BULK,65bd257956f2d4f45a3da0e2,Unknown,0.49,0.24,Grocery,44,,,,,
69cdccfb3090f65b97bc9763,SUNRYPE FRUIT2GO WLDBRY BULK,65bd257956f2d4f45a3da0e2,Unknown,0.49,0.24,Grocery,23,,,,,
69ce109d895133c51abde6d1,Imodium Mint Calming Liquid (240 ml),65e8f30bcb43951cbd853f59,Unknown,18.88,9.44,Medicine,3,,,,,
69ce10af898156d0cb8b984e,Buckley's Chest Congestion Liquid (150 ml),65e8f30bcb43951cbd853f59,Unknown,16.99,8.49,Medicine,2,,,,,
69ce115b898156d0cb8b9ad7,Enfamil A+ Stage 1 Concentrated Liquid Infant Formula (385 ml x 12 ct),65e8f30bcb43951cbd853f59,Unknown,67.97,33.98,Baby,2,,,,,
69ce19fc8f4c07a18fdaba16,Enfamil A+ Stage 1 Powder Formula Refill (992 g),67bdc806855e4112ad907797,Unknown,59.97,29.98,Baby,2,,,,,
69cf61374620fe6c27dcdefc,Biore Clear & Breathable Acne Clearing Cleanser (200 ml),65e8f30bcb43951cbd853f59,Unknown,13.49,6.74,Beauty,5,,,,,
69d0b53ab0510d31b8d3fa01,Hidden Valley Ranch Spicy,65e8f30bcb43951cbd853f59,Unknown,4.49,2.25,Pantry,4,,,,,
69d0b5588f4c07a18ffd69c4,IAMS Advanced Health Skin & Coat Chicken & Salmon Dry Adult Dog Food (2.72 kg),65e8f30bcb43951cbd853f59,Unknown,23.29,11.64,Pet Care,1,,,,,
69d1fef7ef88569bc4f4955a,Vegeta Food Seasoning (500 g),67bdc806855e4112ad907797,Unknown,8.29,4.14,Pantry,1,,,,,
69d2026cef88569bc4f49fdc,Barilla Pappardelle Pasta (450 g),65e8f30bcb43951cbd853f59,Unknown,5.79,2.89,Pantry,10,,,,,
69d352f5e7757e7592fd127c,Ben's Original Street Food Fried Rice with Vegetables Bowl (255 g),65e8f30bcb43951cbd853f59,Unknown,5.79,2.89,Pantry,1,,,,,
69d4a2f16eddcecfdaaf5b44,Mama Sita's Barbecue Marinade Sauce (350 ml),67bdc806855e4112ad907797,Unknown,5.59,2.79,Pantry,16,,,,,
69d4a2f1e7757e75920d974e,Mama Sita's Barbecue Marinade Mix (50 g),67bdc806855e4112ad907797,Unknown,1.17,0.58,Pantry,19,,,,,
69d4add36eddcecfdaaf73ed,Kraft Calorie-Wise Catalina Dressing (425 ml),65e8f30bcb43951cbd853f59,Unknown,4.29,2.14,Pantry,10,,,,,
69d4aed6e7757e75920db18f,Mama Sita's Tocino Marinating Mix (75 g),65e8f30bcb43951cbd853f59,Unknown,1.89,0.94,Pantry,10,,,,,
69d4aefab17bdf94ec873a7f,Mama Sita's Barbecue Marinade Mix (50 g),65e8f30bcb43951cbd853f59,Unknown,1.89,0.94,Pantry,11,,,,,
69d4af33e7757e75920db1fc,Mama Sita's Barbecue Marinade Mix (50 g),65e8f30bcb43951cbd853f59,Unknown,1.89,0.94,Pantry,8,,,,,
69d4af7f6eddcecfdaaf7713,Mama Sita's Tocino Marinating Mix (75 g),65e8f30bcb43951cbd853f59,Unknown,1.89,0.94,Pantry,4,,,,,
69d4afa5e7757e75920db28f,Mama Sita's Barbecue Marinade Sauce (350 ml),65e8f30bcb43951cbd853f59,Unknown,5.59,2.79,Pantry,17,,,,,
69d56d073c37af8a28b641cd,Gits Dosa Breakfast Mix,65e8f30bcb43951cbd853f59,Unknown,1.99,1.0,Pantry,10,,,,,
69d56dab667d9f75c4481228,Trojan Ultra Ribbed Condoms,65e8f30bcb43951cbd853f59,Unknown,14.99,7.5,Personal Care,1,,,,,
69d5f9879b04f23cb0999582,Hellmann's Spicy Mayonnaise Squeeze Bottle (340 ml),65e8f30bcb43951cbd853f59,Unknown,6.39,3.19,Pantry,10,,,,,
69d5fa539b04f23cb09996e0,Hellmann's Spicy Mayonnaise Squeeze Bottle (340 ml),67bdc806855e4112ad907797,Unknown,6.39,3.19,Pantry,6,,,,,
69d896be1ee129cbea2d307c,IAMS Proactive Health Minichunks Chicken & Whole Grains Recipe Dry Dog Food (3.18 kg),65e8f30bcb43951cbd853f59,Unknown,23.29,11.64,Pet Care,4,,,,,
69d89b6d1ba276ef1d7a652c,Mama Sita's Palabok Oriental Gravy Mix (57 g),65e8f30bcb43951cbd853f59,Unknown,1.89,0.94,Pantry,1,,,,,
69d9e9661ba276ef1d8cd990,Paldo Seafood Noodle Soup Bowl (86 g),65e8f30bcb43951cbd853f59,Unknown,1.99,0.99,Pantry,12,,,,,
69d9e9ef8f5487e41dc67cce,KFI Tikka Cooking Paste (275 g),65e8f30bcb43951cbd853f59,Unknown,6.69,3.34,Pantry,6,,,,,
69dc9600d154903247661d85,Quaker Blueberry Buttermilk Muffin Mix (900 g),65e8f30bcb43951cbd853f59,Unknown,7.49,3.74,Pantry,9,,,,,
69dc993ed15490324766257b,Quaker Blueberry Buttermilk Muffin Mix (900 g),67bdc806855e4112ad907797,Unknown,7.49,3.74,Pantry,3,,,,,
69dedcf11ee129cbea813838,Vanilla Almond Breeze 946ml Almond Breeze,67ffcc6581edee2219c54e94,Unknown,3.99,0.99,Beverages,1,,,,,
69dede0c8f5487e41d03f26e,Karma Sparkling Watermelon Hydration Drink Pack Of 4*285ml,67ffcc6581edee2219c54e94,Unknown,8.99,3.99,Beverages,8,,,,,
69df38658f5487e41d06c68e,Cesar Top Sirloin & Pork Tenderloin Wet Dog Food Variety Pack (100 g x 12 ct),67bdc806855e4112ad907797,Unknown,24.39,12.19,Pet Care,1,,,,,
69dfa93c1ba276ef1dd380f7,Vanilla Rolled Wafers (case of 6),686ffde536c2d6774d41f590,Unknown,60.0,36.0,Grocery,45,,,,,
69e03ada874a7fbdf2682b15,Karma Sparkling Grape Hydration Drink Pack of 4*285ml,67ffcc6581edee2219c54e94,Unknown,8.99,3.99,Beverages,13,,,,,
69e03c50d154903247953c73,Karma Berry Soda  Pack of 6*285ml,67ffcc6581edee2219c54e94,Unknown,10.99,4.99,Beverages,7,,,,,
69e03cbbd154903247954425,Karma Apple Soda Pack of 6*285ml,67ffcc6581edee2219c54e94,Unknown,10.99,4.99,Beverages,2,,,,,
69e082d51ba276ef1de27a5d,Frank's RedHot Garlic Parmesan Thick Sauce (354 ml),67bdc806855e4112ad907797,Unknown,5.59,2.79,Pantry,3,,,,,
69e082d51ee129cbea95d5e2,Old El Paso Mild Taco Seasoning Mix (24 g),67bdc806855e4112ad907797,Unknown,1.59,0.79,Pantry,10,,,,,
69e08514874a7fbdf26a7145,Frank's RedHot Garlic Parmesan Thick Sauce (354 ml),65e8f30bcb43951cbd853f59,Unknown,5.59,2.79,Pantry,2,,,,,
69e085551ba276ef1de28226,Tamam Rose Water (300 ml),65e8f30bcb43951cbd853f59,Unknown,2.27,1.13,Pantry,22,,,,,
69e089561ba276ef1de28b28,Ruffles Ranch Flavoured Dip (425 g),65e8f30bcb43951cbd853f59,Unknown,6.39,3.19,Pantry,1,,,,,
69e1d5af86fe4a35edfebbd6,Oreo Golden Mini Cookies Snak Paks (25 g x 6 ct),67bdc806855e4112ad907797,Unknown,3.99,1.99,Snacks,5,,,,,
69e2d536a2ee7a44f30e2d12,WINDSOR SAFE-T PLUS ECO,65bd257956f2d4f45a3da0e2,Unknown,12.0,6.0,Home & Ent.,1,,,,,
69e2d572e8f36f87acbf7369,PC GOURMET BBQ SAUCE,65bd257956f2d4f45a3da0e2,Unknown,5.69,2.84,Grocery,4,,,,,
69e2d5eca2ee7a44f30e4290,PC CHICKEN RIB BBQ SAUCE,65bd257956f2d4f45a3da0e2,Unknown,5.69,2.84,Grocery,8,,,,,
69e2d601e8f36f87acbf85ab,PC CHICKEN RIB BBQ SAUCE,65bd257956f2d4f45a3da0e2,Unknown,5.69,2.84,Grocery,2,,,,,
69e2d83d94d8f87933ab3f08,WERTHER'S CREAMY FILLED,65bd257956f2d4f45a3da0e2,Unknown,3.79,1.89,Grocery,11,,,,,
69e2d8fca22758b420c9c66d,ZINCOFAX ORIG OINT,65bd257956f2d4f45a3da0e2,Unknown,6.24,3.12,HABA,8,,,,,
69e2e41986fe4a35ed0ebe6e,Gerber Mealtime Garden Veggies Purée (162 ml),65e8f30bcb43951cbd853f59,Unknown,2.89,2.6,Baby,12,,,,,
69e2e43de91caefa0096f960,Quaker Dipps Chocolate Chip Granola Bars (156 g),65e8f30bcb43951cbd853f59,Unknown,3.99,3.59,Snacks,10,,,,,
69e3267c7e1c4562b62bc458,Iogo Nano Peach Yogurt Drink (93 ml x 6 ct),65e8f30bcb43951cbd853f59,Unknown,4.49,2.24,Dairy & Eggs,3,,,,,
69e3292dcecf3738ccac13ec,Vatika Naturals Henna Burgundy Hair Dye (60 g),65e8f30bcb43951cbd853f59,Unknown,6.09,3.04,Beauty,5,,,,,
69e3294b86fe4a35ed10dc0f,Icy Hot Pro Pain Relief Dry Spray (118 ml),65e8f30bcb43951cbd853f59,Unknown,19.99,9.99,Medicine,1,,,,,
69e32aba59545b3c4803d4e2,naturSource Original Salad Topper (625 g),65e8f30bcb43951cbd853f59,Unknown,15.39,7.69,Pantry,7,,,,,
69e33242e91caefa00994b5a,naturSource Original Salad Topper (625 g),67bdc806855e4112ad907797,Unknown,15.39,7.69,Pantry,4,,,,,
69e3b12acecf3738ccb075ea,Mi Sedaap Curry Flavour Noodle 73gx5,69379713a3687e3a3db2d8bc,Unknown,4.99,1.5,Grocery,4,,,,,
69e4209d86fe4a35ed1e8652,M.Y San Graham Crackers ,65e8f30bcb43951cbd853f59,Unknown,2.17,1.95,Snacks,12,,,,,
69e477abcecf3738ccbc0c13,Heinz Mayochup Mayonnaise Style Sauce (340 ml),67bdc806855e4112ad907797,Unknown,4.99,2.49,Pantry,5,,,,,
69e477abe91caefa00aadd37,Delectables Stew Chicken & Seafood Lickable Wet Cat Treats Variety Pack (12 ct),67bdc806855e4112ad907797,Unknown,17.39,8.69,Pet Care,3,,,,,
69e478fd59545b3c4813dc09,Heinz Mayochup Mayonnaise Style Sauce (340 ml),65e8f30bcb43951cbd853f59,Unknown,4.99,2.49,Pantry,4,,,,,
69e5c6c259545b3c4822bd03,Iogo Nano Peach Yogurt Drink (93 ml x 6 ct),65e8f30bcb43951cbd853f59,Unknown,4.49,2.24,Dairy & Eggs,3,,,,,
69e5c70d7e1c4562b64d42bc,Pillsbury Easy Roll Pie Crusts (400 g),65e8f30bcb43951cbd853f59,Unknown,4.59,2.29,Bakery,4,,,,,
69e5c9f37e1c4562b64d4cfd,Axis-Y Glow Your Own Way Gift Set (1 ct),65e8f30bcb43951cbd853f59,Unknown,72.99,36.49,Beauty,3,,,,,
69e5ca3586fe4a35ed307472,Sunasia Garlic Puffed Chicharrones (75 g),65e8f30bcb43951cbd853f59,Unknown,2.99,1.49,Snacks,7,,,,,
69e5d02159545b3c4822d785,Pillsbury Easy Roll Pie Crusts (400 g),67bdc806855e4112ad907797,Unknown,4.59,2.29,Bakery,9,,,,,
69e5d0217e1c4562b64d5eba,Iogo Nano Peach Yogurt Drink (93 ml x 6 ct),67bdc806855e4112ad907797,Unknown,4.49,2.24,Dairy & Eggs,3,,,,,
69e719b6cecf3738ccda906c,Dunkaroos Biscuits au chocolat / Chocolate Cookies & Double Chocolate Frosting (168 g),65e8f30bcb43951cbd853f59,Unknown,5.99,2.99,Snacks,1,,,,,
69e719cbcecf3738ccda90d9,Icy Hot Hydrogel Fast Acting Pro Pain Relief Patch (5 ct),65e8f30bcb43951cbd853f59,Unknown,19.99,9.99,Medicine,2,,,,,
69e719f5cecf3738ccda9178,Hershey's Delicious Strawberry Syrup (472 ml),65e8f30bcb43951cbd853f59,Unknown,7.79,3.89,Pantry,5,,,,,
69e72054cecf3738ccdaa10f,Club House Parmesan & Garlic Sauce Mix (23 g),67bdc806855e4112ad907797,Unknown,1.49,0.74,Pantry,1,,,,,
69e72054e91caefa00ccef60,Astro Snacks Freeze-Dried Marshmallows Candy (50 g),67bdc806855e4112ad907797,Unknown,11.99,5.99,Candy,7,,,,,
69e86a8759545b3c4842b91d,Las Margaritas Hot Salsa (500 ml),65e8f30bcb43951cbd853f59,Unknown,8.79,4.39,Easy Meals,1,,,,,
69e86e66e91caefa00ddb3f3,Silk Almond (946ml),65e8f30bcb43951cbd853f59,Unknown,3.29,1.65,Dairy & Eggs,7,,,,,
69e86f3259545b3c4842c4a3,Old El Paso Hard Taco Dinner Kit,65e8f30bcb43951cbd853f59,Unknown,4.75,2.38,Easy Meals,8,,,,,
69e86f697e1c4562b66fb8cc,Baken-Ets Hot 'N Spicy Pork Rinds (70 g),65e8f30bcb43951cbd853f59,Unknown,3.29,1.64,Snacks,2,,,,,
69e86f857e1c4562b66fb8ef,Jack Link's Hickory Smoked Bacon Jerky (65 g),65e8f30bcb43951cbd853f59,Unknown,7.99,3.99,Snacks,4,,,,,
69e870c7cecf3738ccea3809,Baken-Ets Hot 'N Spicy Pork Rinds (70 g),65e8f30bcb43951cbd853f59,Unknown,3.29,1.64,Snacks,3,,,,,
69e870dfcecf3738ccea383f,Baken-Ets Traditional Pork Rinds (70 g),65e8f30bcb43951cbd853f59,Unknown,3.29,1.64,Snacks,1,,,,,
69e8712c86fe4a35ed511d98,Ritz Original Crackers (350 g),65e8f30bcb43951cbd853f59,Unknown,6.59,3.29,Snacks,10,,,,,
69e8740e86fe4a35ed5123e0,Las Margaritas Hot Salsa (500 ml),67bdc806855e4112ad907797,Unknown,8.79,4.39,Easy Meals,1,,,,,
69e8740ee91caefa00ddbec8,Lunchmate Mini Pepperoni Pizzas (120 g),67bdc806855e4112ad907797,Unknown,3.77,1.88,Easy Meals,8,,,,,
69e8769159b619d258ca0319,NESTLE TURTLES CHOC ORIGINAL,5d0bd76c8894a4ebbfd704b8,Unknown,16.0,8.0,Grocery,82,,,,,
69e8d12259b619d258d418bf,Mixed Produce Box #15,5d0bd76b8894a4ebbfd7048a,Unknown,3.0,3.0,Produce,1,,,,,
69e8d2fee572d7caeca97bd7,Mixed Produce Box #7,5d0bd76b8894a4ebbfd7048a,Unknown,3.0,3.0,Produce,1,,,,,
69e8d32259b619d258d5080d,Mixed Produce Box #34,5d0bd76b8894a4ebbfd7048a,Unknown,3.0,3.0,Produce,1,,,,,
69e8d3334d93078fb8eae95f,Mixed Produce Box #35,5d0bd76b8894a4ebbfd7048a,Unknown,3.0,3.0,Produce,1,,,,,
69e8d3587578110cf23b1f07,Mixed Produce Box #36,5d0bd76b8894a4ebbfd7048a,Unknown,3.0,3.0,Produce,1,,,,,
69e8ff030513be7ea4c66e41,cannoli chips,5ddef30c9af4e045c44b9d67,Unknown,5.0,1.0,Bakery,18,,,,,
69e90fc6712a68c689b90f58,NO NAME LIGHT DESSERT WHIP CRM,5fac3e04d7528a3c966b13a4,Unknown,3.24,1.0,Frozen,4,,,,,
69e911f0eadda114cdc9a828,COOL WHIP DESSERT TOPPING LT,5fac3e04d7528a3c966b13a4,Unknown,4.25,1.94,Frozen,6,,,,,
69e9232e93f413a8a090866a,Mixed Produce Box #417,5d0bd76c8894a4ebbfd704b8,Unknown,5.0,5.0,Produce,1,,,,,
69e92504ced55a87855dc3b4,Mixed Produce Box #309,5d0bd76c8894a4ebbfd704b8,Unknown,5.0,5.0,Produce,1,,,,,
69e92608712a68c689bd0294,Mixed Produce Box #405,5d0bd76c8894a4ebbfd704b8,Unknown,5.0,5.0,Produce,1,,,,,
69e92636568075e5aa97144a,Mixed Produce Box #407,5d0bd76c8894a4ebbfd704b8,Unknown,5.0,5.0,Produce,1,,,,,
69e9270093f413a8a0912f16,Mixed Produce Box #682,5d0bd76c8894a4ebbfd704b8,Unknown,5.0,5.0,Produce,1,,,,,
69e927e51767f76b41a4cc95,Mixed Produce Box #104,5d0bd76c8894a4ebbfd704b8,Unknown,5.0,5.0,Produce,1,,,,,
69e9465493f413a8a0965fdf,PC VEGETABLE MISO RICE ROLLS,6969181f05a95a3633344338,Unknown,11.0,3.99,Meat,2,,,,,
69e946f4568075e5aa9d332b,PC TORT JALAPENO CHEESE STICKS,6969181f05a95a3633344338,Unknown,11.99,5.99,Meat,39,,,,,
69e970a752b2689171ce09a3,Pedialyte Unflavoured Electrolyte Oral Rehydration Solution (1 L),65e8f30bcb43951cbd853f59,Unknown,12.99,11.69,Drinks,4,,,,,
69e9715715a31ba3643b49f7,Cesar New York Strip Wet Dog Food (100 g),65e8f30bcb43951cbd853f59,Unknown,2.39,1.19,Pet Care,24,,,,,
69e9ba2515a31ba3643e1027,La Rocca Strawberries and Cream Cake,65e8f30bcb43951cbd853f59,Unknown,18.79,9.4,Bakery,4,,,,,
69e9bbcd801ae9157372b268,Pure J.L. Kraft Miso Lime Ginger Dressing & Marinade (355 ml),65e8f30bcb43951cbd853f59,Unknown,5.79,2.89,Pantry,4,,,,,
69e9bc0c15a31ba3643e1431,Quaker Chewy Low Sugar Chocolatey Chip Granola Bars Value Pack (960 g),65e8f30bcb43951cbd853f59,Unknown,15.79,7.89,Snacks,2,,,,,
69e9bc2e801ae9157372b32a,Anua Heartleaf 77% Soothing Toner (500 ml),65e8f30bcb43951cbd853f59,Unknown,49.99,24.99,Beauty,2,,,,,
69e9bc4852b2689171d10b56,Crispy Namak Para (360 g),65e8f30bcb43951cbd853f59,Unknown,4.39,2.19,Snacks,7,,,,,
69e9bc8b15a31ba3643e152a,Carnaby Sweet Peanut Butter Choco-Crunch Ice Cream & Dessert Topping (100 g),65e8f30bcb43951cbd853f59,Unknown,3.79,1.89,Pantry,11,,,,,
69e9be7815a31ba3643e1a88,King's Original Hawaiian Sweet Rolls (340 g),65e8f30bcb43951cbd853f59,Unknown,4.99,2.49,Bakery,1,,,,,
69e9bf533262bc3ed36d9cbd,Activia expert strawberry ,67bdc806855e4112ad907797,Unknown,4.39,2.19,Dairy & Eggs,2,,,,,
69e9bf53801ae9157372bbec,Farmer's Market Tuxedo Cake (753 g),67bdc806855e4112ad907797,Unknown,15.49,7.74,Bakery,1,,,,,
69e9c2d83f52967133b7af49,Carnaby Sweet Peanut Butter Choco-Crunch Ice Cream & Dessert Topping (100 g),67bdc806855e4112ad907797,Unknown,3.79,1.89,Pantry,11,,,,,
69e9c2d8689eff37b5b1c11e,Powerade Fruit Punch Sports Drink (946 ml),67bdc806855e4112ad907797,Unknown,3.29,1.64,Drinks,1,,,,,
69e9c2d8bdaca3bf0af1f0b6,Anua Heartleaf 77% Soothing Toner (500 ml),67bdc806855e4112ad907797,Unknown,49.99,24.99,Beauty,2,,,,,
69e9c2d8c8b3587b5add017c,"Kind Nuts, Sea Salt, & Dark Chocolate Bar (40 g)",67bdc806855e4112ad907797,Unknown,2.89,1.44,Snacks,4,,,,,
69e9c46f49ced8759ea8253a,Farmer's Market Apple Fritter Mini Doughnuts (264 g),67bdc806855e4112ad907797,Unknown,4.99,2.49,Bakery,1,,,,,
69ea5a808a77e179449a17f7,Mixed Produce Box #83,6969181f05a95a3633344338,Unknown,5.0,5.0,Produce,1,,,,,
69ea5de5eadda114cdf46509,FRENCH BREAD W SESAME,5d0bd76c8894a4ebbfd704b8,Unknown,1.5,0.74,Bakery,1,,,,,
69ea75cab970588b66b6df1b,Mixed Produce Box #42,5d0bd76b8894a4ebbfd7048a,Unknown,5.0,5.0,Produce,1,,,,,
69ea75ec535d03f9395ecb18,Mixed Produce Box #44,5d0bd76b8894a4ebbfd7048a,Unknown,5.0,5.0,Produce,1,,,,,
69ea75fbb970588b66b6eced,Mixed Produce Box #45,5d0bd76b8894a4ebbfd7048a,Unknown,5.0,5.0,Produce,1,,,,,
69ea7605eadda114cdf8f113,Mixed Produce Box #46,5d0bd76b8894a4ebbfd7048a,Unknown,5.0,5.0,Produce,1,,,,,
69ea7614ee7d8b594b4351fb,Mixed Produce Box #47,5d0bd76b8894a4ebbfd7048a,Unknown,5.0,5.0,Produce,1,,,,,
69ea763952a9c861123e219a,Mixed Produce Box #49,5d0bd76b8894a4ebbfd7048a,Unknown,5.0,5.0,Produce,1,,,,,
69ea7760535d03f9395efe91,FM Cinnamon Rolls,5ddef30c9af4e045c44b9d67,Unknown,4.94,2.0,Bakery,52,,,,,
69ea784feadda114cdf96f52,Cucumber Single,65bd257956f2d4f45a3da0e2,Unknown,2.25,1.12,Produce,1,,,,,
69ea7869535d03f9395f3213,PCO TOMATO GRAPE 283G,65bd257956f2d4f45a3da0e2,Unknown,4.99,2.49,Produce,1,,,,,
69ea7872ee7d8b594b439583,NN DINNER ROLLS WHITE,5d0bd76c8894a4ebbfd704b8,Unknown,4.29,0.74,Bakery,3,,,,,
69ea7a0152a9c861123ee481,Grape 907g,65bd257956f2d4f45a3da0e2,Unknown,7.99,3.99,Produce,3,,,,,
69ea7a57b970588b66b795a1,Mixed Produce Box #612,5d0bd76c8894a4ebbfd704b8,Unknown,5.0,5.0,Produce,1,,,,,
69ea7b0f48021cebce5a74dc,Mixed Produce Box #51,5d0bd76b8894a4ebbfd7048a,Unknown,5.0,5.0,Produce,1,,,,,
69ea7b28535d03f9395fb3e2,Mixed Produce Box #52,5d0bd76b8894a4ebbfd7048a,Unknown,5.0,5.0,Produce,1,,,,,
69ea7bb2eadda114cdfa2165,Mixed Produce Box #610,5d0bd76c8894a4ebbfd704b8,Unknown,5.0,5.0,Produce,1,,,,,
69ea7c93eadda114cdfa51e3,Mixed Produce Box #488,5d0bd76c8894a4ebbfd704b8,Unknown,5.0,5.0,Produce,1,,,,,
69ea7cbb74440f369aceb681,Mixed Produce Box #469,5d0bd76c8894a4ebbfd704b8,Unknown,5.0,5.0,Produce,1,,,,,
69ea7d1831e39a20ef70d14f,Mixed Produce Box #200,5d0bd76c8894a4ebbfd704b8,Unknown,5.0,5.0,Produce,1,,,,,
69ea7d28b970588b66b819d2,Mixed Produce Box #201,5d0bd76c8894a4ebbfd704b8,Unknown,5.0,5.0,Produce,1,,,,,
69ea7d3648021cebce5ac2ec,Mixed Produce Box #202,5d0bd76c8894a4ebbfd704b8,Unknown,5.0,5.0,Produce,1,,,,,
69ea7d5d52a9c861123fa425,Mixed Produce Box #53,5d0bd76b8894a4ebbfd7048a,Unknown,5.0,5.0,Produce,1,,,,,
69ea7d6852a9c861123fa661,Mixed Produce Box #54,5d0bd76b8894a4ebbfd7048a,Unknown,5.0,5.0,Produce,1,,,,,
69ea7d7feadda114cdfa93dc,Mixed Produce Box #56,5d0bd76b8894a4ebbfd7048a,Unknown,5.0,5.0,Produce,1,,,,,
69ea7d92535d03f939604427,Mixed Produce Box #58,5d0bd76b8894a4ebbfd7048a,Unknown,5.0,5.0,Produce,1,,,,,
69ea7d9848021cebce5ace03,Mixed Produce Box #205,5d0bd76c8894a4ebbfd704b8,Unknown,5.0,5.0,Produce,1,,,,,
69ea7edf1c7aa1a76028c2e1,Mixed Produce Box #332,5d0bd76c8894a4ebbfd704b8,Unknown,5.0,5.0,Produce,1,,,,,
69ea7f7574440f369acf2c9a,Mixed Produce Box #382,5d0bd76c8894a4ebbfd704b8,Unknown,5.0,5.0,Produce,1,,,,,
69ea9ceeeadda114cd000cb6,SCH JUMBO SUMMER SAUSAGE SV 390g,5d0bd76c8894a4ebbfd704b8,Unknown,16.32,3.25,Deli,1,,,,,
69eadcaeeadda114cd072fd7,BC SAUS BRKFAST PORK AND BEEF,629cec56061cc278a85326dc,Unknown,10.0,5.0,Meat,1,,,,,
69eadcb81c7aa1a7603541c3,PC ORIG BREAKFAST PK SSG,629cec56061cc278a85326dc,Unknown,6.49,3.24,Meat,2,,,,,
69eade0d535d03f9396befdd,NN BREAD WHITE,6969181f05a95a3633344338,Unknown,2.5,1.25,Bakery,26,,,,,
69eadf4a09809e6a68beca69,NN BREAD 100% WW FRESH,6969181f05a95a3633344338,Unknown,2.5,1.25,Bakery,40,,,,,
69eae27509809e6a68bee308,ASSORTED ROLLS 12PK,5d0bd76c8894a4ebbfd704b8,Unknown,4.0,2.0,Bakery,1,,,,,
69eae289eadda114cd076b2e,ASSORTED ROLLS 12PK,5d0bd76c8894a4ebbfd704b8,Unknown,4.0,2.0,Bakery,1,,,,,
69eae2edeadda114cd076e86,ASSORTED ROLLS 12PK,5d0bd76c8894a4ebbfd704b8,Unknown,4.0,2.0,Bakery,1,,,,,
69eae2f909809e6a68bee72b,ASSORTED ROLLS 12PK,5d0bd76c8894a4ebbfd704b8,Unknown,4.0,2.0,Bakery,1,,,,,
69eae498535d03f9396c2edd,GALA ANGEL FOOD CAKE,6969181f05a95a3633344338,Unknown,5.5,2.75,Bakery,5,,,,,
69eb0d60c8b3587b5aee42b4,Butterball Turkey Bacon (375 g),65e8f30bcb43951cbd853f59,Unknown,7.79,3.89,Meat & Fish,11,,,,,
69eb0de049ced8759eb8a1a2,Pillsbury Reese's Peanut Butter Cookie Dough (454 g),65e8f30bcb43951cbd853f59,Unknown,4.57,2.28,Bakery,8,,,,,
69eb0e366463066110e79a19,Farmer's Market Tiramisu Cake (675 g),65e8f30bcb43951cbd853f59,Unknown,15.49,7.74,Bakery,1,,,,,
69eb0e4849ced8759eb8a2ad,Farmer's Market Cookies and Creme Cake (825 g),65e8f30bcb43951cbd853f59,Unknown,13.89,6.94,Bakery,1,,,,,
69eb0e6bc8b3587b5aee45f1,Sunrise Sriracha Smoked Tofu (180 g),65e8f30bcb43951cbd853f59,Unknown,5.59,2.79,Meat & Fish,3,,,,,
69eb0fd1c8b3587b5aee4a1b,King's Original Hawaiian Sweet Rolls (340 g),65e8f30bcb43951cbd853f59,Unknown,4.99,2.49,Bakery,1,,,,,
69eb0febbdaca3bf0a0282da,Chubby Go Bananas Soda Pop (250 ml),65e8f30bcb43951cbd853f59,Unknown,0.89,0.44,Drinks,1,,,,,
69eb1306c8b3587b5aee5161,Nongshim Cuttlefish Snack (260 g),65e8f30bcb43951cbd853f59,Unknown,7.29,3.64,Snacks,5,,,,,
69eb133c49ced8759eb8af44,Earth's Best Organic Strawberry Banana Fruit Yogurt Smoothie (125 ml),65e8f30bcb43951cbd853f59,Unknown,2.99,1.49,Baby,7,,,,,
69eb1361c8b3587b5aee526d,Earth's Best Organic Mixed Berry Fruit Yogurt Smoothie (125 ml),65e8f30bcb43951cbd853f59,Unknown,2.99,1.49,Baby,2,,,,,
69eb138249ced8759eb8afb9,Maxwell House Dark Roast K-Cup Coffee Pods (30 ct),65e8f30bcb43951cbd853f59,Unknown,23.99,11.99,Pantry,3,,,,,
